"No.","Time","Source","Destination","Protocol","Length","Info"
"1","0.000000","192.168.1.81","69.196.227.78","TCP","54","58982 > 443 [ACK] Seq=1 Ack=1 Win=65535 Len=0"
"2","0.018715","69.196.227.78","192.168.1.81","TCP","60","[TCP ACKed unseen segment] 443 > 58982 [ACK] Seq=1 Ack=2 Win=40958 Len=0"
"8","0.578385","192.168.1.81","192.168.1.211","TCP","181","[TCP segment of a reassembled PDU]"
"9","0.581036","192.168.1.211","192.168.1.81","TCP","99","[TCP segment of a reassembled PDU]"
"10","0.581075","192.168.1.81","192.168.1.211","TCP","66","58547 > 8009 [ACK] Seq=116 Ack=34 Win=4094 Len=0 TSval=247164671 TSecr=7019238"
"11","0.581491","192.168.1.211","192.168.1.81","TCP","177","[TCP segment of a reassembled PDU]"
"12","0.581518","192.168.1.81","192.168.1.211","TCP","66","58547 > 8009 [ACK] Seq=116 Ack=145 Win=4092 Len=0 TSval=247164671 TSecr=7019238"
"13","0.696903","64.233.171.189","192.168.1.81","TLSv1.2","126","Application Data"
"14","0.696962","192.168.1.81","64.233.171.189","TCP","66","58525 > 443 [ACK] Seq=1 Ack=61 Win=4094 Len=0 TSval=247164786 TSecr=2223923765"
"15","1.594362","192.168.1.81","64.233.171.95","TCP","54","58918 > 443 [ACK] Seq=1 Ack=1 Win=4096 Len=0"
"16","1.622315","64.233.171.95","192.168.1.81","TCP","66","[TCP ACKed unseen segment] 443 > 58918 [ACK] Seq=1 Ack=2 Win=358 Len=0 TSval=2442827326 TSecr=246939963"
"19","2.500104","192.168.1.81","176.32.98.166","TCP","78","58988 > 80 [SYN] Seq=0 Win=65535 Len=0 MSS=1460 WS=32 TSval=247166582 TSecr=0 SACK_PERM=1"
"20","2.516712","176.32.98.166","192.168.1.81","TCP","62","80 > 58988 [SYN, ACK] Seq=0 Ack=1 Win=8190 Len=0 MSS=1460 WS=64"
"21","2.516771","192.168.1.81","176.32.98.166","TCP","54","58988 > 80 [ACK] Seq=1 Ack=1 Win=262144 Len=0"
"22","2.516881","192.168.1.81","176.32.98.166","HTTP","443","GET / HTTP/1.1 "
"23","2.540566","176.32.98.166","192.168.1.81","HTTP","526","HTTP/1.1 301 Moved Permanently  (text/html)"
"24","2.540660","192.168.1.81","176.32.98.166","TCP","54","58988 > 80 [ACK] Seq=390 Ack=473 Win=261664 Len=0"
"27","2.574254","192.168.1.81","176.32.98.166","TCP","78","58989 > 80 [SYN] Seq=0 Win=65535 Len=0 MSS=1460 WS=32 TSval=247166654 TSecr=0 SACK_PERM=1"
"28","2.593609","176.32.98.166","192.168.1.81","TCP","62","80 > 58989 [SYN, ACK] Seq=0 Ack=1 Win=8190 Len=0 MSS=1460 WS=64"
"29","2.593702","192.168.1.81","176.32.98.166","TCP","54","58989 > 80 [ACK] Seq=1 Ack=1 Win=262144 Len=0"
"30","2.593866","192.168.1.81","176.32.98.166","HTTP","447","GET / HTTP/1.1 "
"31","2.603740","192.168.1.81","64.233.171.95","TCP","54","58919 > 443 [ACK] Seq=1 Ack=1 Win=4096 Len=0"
"32","2.638593","64.233.171.95","192.168.1.81","TCP","66","[TCP ACKed unseen segment] 443 > 58919 [ACK] Seq=1 Ack=2 Win=375 Len=0 TSval=2377535776 TSecr=246940899"
"33","2.644495","176.32.98.166","192.168.1.81","HTTP","1224","HTTP/1.1 302 MovedTemporarily  (text/html)"
"34","2.644564","192.168.1.81","176.32.98.166","TCP","54","58989 > 80 [ACK] Seq=394 Ack=1171 Win=260960 Len=0"
"35","2.648003","192.168.1.81","176.32.98.166","TCP","78","58990 > 443 [SYN] Seq=0 Win=65535 Len=0 MSS=1460 WS=32 TSval=247166724 TSecr=0 SACK_PERM=1"
"36","2.663505","176.32.98.166","192.168.1.81","TCP","62","443 > 58990 [SYN, ACK] Seq=0 Ack=1 Win=8190 Len=0 MSS=1460 WS=64"
"37","2.663566","192.168.1.81","176.32.98.166","TCP","54","58990 > 443 [ACK] Seq=1 Ack=1 Win=262144 Len=0"
"38","2.663758","192.168.1.81","176.32.98.166","TLSv1.2","265","Client Hello"
"39","2.678569","176.32.98.166","192.168.1.81","TCP","60","443 > 58990 [ACK] Seq=1 Ack=212 Win=2096896 Len=0"
"40","2.679024","176.32.98.166","192.168.1.81","TCP","60","[TCP Dup ACK 39#1] 443 > 58990 [ACK] Seq=1 Ack=212 Win=2096896 Len=0"
"41","2.682054","176.32.98.166","192.168.1.81","TLSv1.2","1514","Server Hello"
"42","2.682519","176.32.98.166","192.168.1.81","TCP","1514","[TCP segment of a reassembled PDU]"
"43","2.682521","176.32.98.166","192.168.1.81","TLSv1.2","1514","Certificate"
"44","2.682522","176.32.98.166","192.168.1.81","TCP","1514","[TCP segment of a reassembled PDU]"
"45","2.682523","176.32.98.166","192.168.1.81","TLSv1.2","549","Certificate Status"
"46","2.682568","192.168.1.81","176.32.98.166","TCP","54","58990 > 443 [ACK] Seq=212 Ack=2921 Win=260672 Len=0"
"47","2.682628","192.168.1.81","176.32.98.166","TCP","54","58990 > 443 [ACK] Seq=212 Ack=5841 Win=259200 Len=0"
"48","2.682628","192.168.1.81","176.32.98.166","TCP","54","58990 > 443 [ACK] Seq=212 Ack=6336 Win=258720 Len=0"
"49","2.682628","192.168.1.81","176.32.98.166","TCP","54","[TCP Window Update] 58990 > 443 [ACK] Seq=212 Ack=6336 Win=262144 Len=0"
"50","2.683288","192.168.1.81","176.32.98.166","TLSv1.2","245","Client Key Exchange, Change Cipher Spec, Hello Request, Hello Request, Hello Request, Hello Request"
"52","2.687617","192.168.1.81","176.32.98.166","TLSv1.2","683","Application Data"
"53","2.701593","176.32.98.166","192.168.1.81","TLSv1.2","105","Change Cipher Spec, Encrypted Handshake Message"
"54","2.701680","192.168.1.81","176.32.98.166","TCP","54","58990 > 443 [ACK] Seq=1032 Ack=6387 Win=262080 Len=0"
"55","2.742167","176.32.98.166","192.168.1.81","TCP","60","443 > 58990 [ACK] Seq=6387 Ack=1032 Win=2096064 Len=0"
"56","2.782178","176.32.98.166","192.168.1.81","TCP","1514","[TCP segment of a reassembled PDU]"
"57","2.782754","176.32.98.166","192.168.1.81","TCP","1514","[TCP segment of a reassembled PDU]"
"58","2.782756","176.32.98.166","192.168.1.81","TCP","1514","[TCP segment of a reassembled PDU]"
"59","2.782757","176.32.98.166","192.168.1.81","TLSv1.2","351","Application Data"
"60","2.782793","192.168.1.81","176.32.98.166","TCP","54","58990 > 443 [ACK] Seq=1032 Ack=9307 Win=260672 Len=0"
"61","2.782793","192.168.1.81","176.32.98.166","TCP","54","58990 > 443 [ACK] Seq=1032 Ack=11064 Win=260384 Len=0"
"62","2.801261","192.168.1.81","192.168.1.211","TCP","181","[TCP segment of a reassembled PDU]"
"63","2.804860","192.168.1.211","192.168.1.81","TCP","99","[TCP segment of a reassembled PDU]"
"64","2.804919","192.168.1.81","192.168.1.211","TCP","66","58546 > 8009 [ACK] Seq=116 Ack=34 Win=4094 Len=0 TSval=247166878 TSecr=7019460"
"65","2.805334","192.168.1.211","192.168.1.81","TCP","177","[TCP segment of a reassembled PDU]"
"66","2.805374","192.168.1.81","192.168.1.211","TCP","66","58546 > 8009 [ACK] Seq=116 Ack=145 Win=4092 Len=0 TSval=247166878 TSecr=7019460"
"67","2.863892","176.32.98.166","192.168.1.81","TCP","1514","[TCP segment of a reassembled PDU]"
"68","2.863967","192.168.1.81","176.32.98.166","TCP","54","58990 > 443 [ACK] Seq=1032 Ack=12524 Win=262144 Len=0"
"69","2.864406","176.32.98.166","192.168.1.81","TCP","1514","[TCP segment of a reassembled PDU]"
"70","2.864408","176.32.98.166","192.168.1.81","TLSv1.2","643","Application Data"
"71","2.864431","192.168.1.81","176.32.98.166","TCP","54","58990 > 443 [ACK] Seq=1032 Ack=14573 Win=260064 Len=0"
"72","2.870112","176.32.98.166","192.168.1.81","TCP","1514","[TCP segment of a reassembled PDU]"
"73","2.870576","176.32.98.166","192.168.1.81","TCP","1514","[TCP segment of a reassembled PDU]"
"74","2.870580","176.32.98.166","192.168.1.81","TLSv1.2","100","Application Data"
"75","2.870618","192.168.1.81","176.32.98.166","TCP","54","58990 > 443 [ACK] Seq=1032 Ack=17493 Win=259200 Len=0"
"76","2.870670","192.168.1.81","176.32.98.166","TCP","54","58990 > 443 [ACK] Seq=1032 Ack=17539 Win=259168 Len=0"
"77","2.870680","192.168.1.81","176.32.98.166","TCP","54","[TCP Window Update] 58990 > 443 [ACK] Seq=1032 Ack=17539 Win=262144 Len=0"
"79","2.876240","176.32.98.166","192.168.1.81","TCP","1514","[TCP segment of a reassembled PDU]"
"80","2.876826","176.32.98.166","192.168.1.81","TLSv1.2","1371","Application Data"
"81","2.876861","192.168.1.81","176.32.98.166","TCP","54","58990 > 443 [ACK] Seq=1032 Ack=20316 Win=260800 Len=0"
"82","2.877614","176.32.98.166","192.168.1.81","TCP","1514","[TCP segment of a reassembled PDU]"
"83","2.877615","176.32.98.166","192.168.1.81","TCP","1514","[TCP segment of a reassembled PDU]"
"84","2.877616","176.32.98.166","192.168.1.81","TLSv1.2","242","Application Data"
"85","2.877645","192.168.1.81","176.32.98.166","TCP","54","58990 > 443 [ACK] Seq=1032 Ack=23236 Win=259200 Len=0"
"86","2.877645","192.168.1.81","176.32.98.166","TCP","54","[TCP Window Update] 58990 > 443 [ACK] Seq=1032 Ack=23236 Win=262144 Len=0"
"87","2.877695","192.168.1.81","176.32.98.166","TCP","54","58990 > 443 [ACK] Seq=1032 Ack=23424 Win=261952 Len=0"
"88","2.878577","176.32.98.166","192.168.1.81","TCP","1514","[TCP segment of a reassembled PDU]"
"89","2.878580","176.32.98.166","192.168.1.81","TLSv1.2","977","Application Data"
"90","2.878605","192.168.1.81","176.32.98.166","TCP","54","58990 > 443 [ACK] Seq=1032 Ack=25807 Win=259744 Len=0"
"91","2.880196","176.32.98.166","192.168.1.81","TCP","1514","[TCP segment of a reassembled PDU]"
"92","2.880200","176.32.98.166","192.168.1.81","TLSv1.2","1090","Application Data"
"93","2.880201","176.32.98.166","192.168.1.81","TCP","1514","[TCP segment of a reassembled PDU]"
"94","2.880202","176.32.98.166","192.168.1.81","TLSv1.2","928","Application Data"
"95","2.880247","192.168.1.81","176.32.98.166","TCP","54","58990 > 443 [ACK] Seq=1032 Ack=28303 Win=259648 Len=0"
"96","2.880247","192.168.1.81","176.32.98.166","TCP","54","58990 > 443 [ACK] Seq=1032 Ack=30637 Win=259808 Len=0"
"97","2.880782","176.32.98.166","192.168.1.81","TCP","1514","[TCP segment of a reassembled PDU]"
"98","2.880784","176.32.98.166","192.168.1.81","TLSv1.2","637","Application Data"
"99","2.880815","192.168.1.81","176.32.98.166","TCP","54","58990 > 443 [ACK] Seq=1032 Ack=32680 Win=260096 Len=0"
"100","2.898373","176.32.98.166","192.168.1.81","TLSv1.2","1405","Application Data"
"101","2.898423","192.168.1.81","176.32.98.166","TCP","54","58990 > 443 [ACK] Seq=1032 Ack=34031 Win=260768 Len=0"
"102","2.923517","176.32.98.166","192.168.1.81","TLSv1.2","422","Application Data"
"103","2.923569","192.168.1.81","176.32.98.166","TCP","54","58990 > 443 [ACK] Seq=1032 Ack=34399 Win=261760 Len=0"
"105","2.934568","192.168.1.81","54.192.103.131","TCP","78","58991 > 443 [SYN] Seq=0 Win=65535 Len=0 MSS=1460 WS=32 TSval=247167004 TSecr=0 SACK_PERM=1"
"106","2.934663","176.32.98.166","192.168.1.81","TLSv1.2","1010","Application Data"
"107","2.934671","192.168.1.81","54.192.103.131","TCP","78","58992 > 443 [SYN] Seq=0 Win=65535 Len=0 MSS=1460 WS=32 TSval=247167004 TSecr=0 SACK_PERM=1"
"108","2.934727","192.168.1.81","176.32.98.166","TCP","54","58990 > 443 [ACK] Seq=1032 Ack=35355 Win=261184 Len=0"
"109","2.934730","192.168.1.81","54.192.103.131","TCP","78","58993 > 443 [SYN] Seq=0 Win=65535 Len=0 MSS=1460 WS=32 TSval=247167004 TSecr=0 SACK_PERM=1"
"110","2.934764","192.168.1.81","54.192.103.131","TCP","78","58994 > 443 [SYN] Seq=0 Win=65535 Len=0 MSS=1460 WS=32 TSval=247167004 TSecr=0 SACK_PERM=1"
"111","2.934798","192.168.1.81","54.192.103.131","TCP","78","58995 > 443 [SYN] Seq=0 Win=65535 Len=0 MSS=1460 WS=32 TSval=247167004 TSecr=0 SACK_PERM=1"
"112","2.950815","54.192.103.131","192.168.1.81","TCP","74","443 > 58991 [SYN, ACK] Seq=0 Ack=1 Win=14480 Len=0 MSS=1460 SACK_PERM=1 TSval=3719275060 TSecr=247167004 WS=256"
"113","2.951130","54.192.103.131","192.168.1.81","TCP","74","443 > 58995 [SYN, ACK] Seq=0 Ack=1 Win=14480 Len=0 MSS=1460 SACK_PERM=1 TSval=3725458955 TSecr=247167004 WS=256"
"114","2.951168","192.168.1.81","54.192.103.131","TCP","66","58991 > 443 [ACK] Seq=1 Ack=1 Win=131744 Len=0 TSval=247167020 TSecr=3719275060"
"115","2.951273","192.168.1.81","54.192.103.131","TCP","66","58995 > 443 [ACK] Seq=1 Ack=1 Win=131744 Len=0 TSval=247167020 TSecr=3725458955"
"116","2.951443","54.192.103.131","192.168.1.81","TCP","74","443 > 58992 [SYN, ACK] Seq=0 Ack=1 Win=14480 Len=0 MSS=1460 SACK_PERM=1 TSval=3914829657 TSecr=247167004 WS=256"
"117","2.951779","192.168.1.81","54.192.103.131","TCP","66","58992 > 443 [ACK] Seq=1 Ack=1 Win=131744 Len=0 TSval=247167020 TSecr=3914829657"
"118","2.951779","192.168.1.81","54.192.103.131","TLSv1.2","294","Client Hello"
"119","2.951950","192.168.1.81","54.192.103.131","TLSv1.2","294","Client Hello"
"120","2.952102","54.192.103.131","192.168.1.81","TCP","74","443 > 58993 [SYN, ACK] Seq=0 Ack=1 Win=14480 Len=0 MSS=1460 SACK_PERM=1 TSval=3719275060 TSecr=247167004 WS=256"
"121","2.952113","192.168.1.81","54.192.103.131","TLSv1.2","294","Client Hello"
"122","2.952160","192.168.1.81","54.192.103.131","TCP","66","58993 > 443 [ACK] Seq=1 Ack=1 Win=131744 Len=0 TSval=247167021 TSecr=3719275060"
"123","2.952336","192.168.1.81","54.192.103.131","TLSv1.2","294","Client Hello"
"124","2.953036","54.192.103.131","192.168.1.81","TCP","74","443 > 58994 [SYN, ACK] Seq=0 Ack=1 Win=14480 Len=0 MSS=1460 SACK_PERM=1 TSval=3915082751 TSecr=247167004 WS=256"
"125","2.953067","192.168.1.81","54.192.103.131","TCP","66","58994 > 443 [ACK] Seq=1 Ack=1 Win=131744 Len=0 TSval=247167022 TSecr=3915082751"
"126","2.953331","192.168.1.81","54.192.103.131","TLSv1.2","294","Client Hello"
"127","2.967157","54.192.103.131","192.168.1.81","TCP","66","443 > 58991 [ACK] Seq=1 Ack=229 Win=15616 Len=0 TSval=3719275061 TSecr=247167020"
"128","2.967356","54.192.103.131","192.168.1.81","TCP","66","443 > 58995 [ACK] Seq=1 Ack=229 Win=15616 Len=0 TSval=3725458956 TSecr=247167021"
"129","2.967846","54.192.103.131","192.168.1.81","TCP","66","443 > 58992 [ACK] Seq=1 Ack=229 Win=15616 Len=0 TSval=3914829658 TSecr=247167021"
"130","2.968407","54.192.103.131","192.168.1.81","TCP","66","443 > 58993 [ACK] Seq=1 Ack=229 Win=15616 Len=0 TSval=3719275061 TSecr=247167021"
"131","2.968718","54.192.103.131","192.168.1.81","TCP","66","443 > 58994 [ACK] Seq=1 Ack=229 Win=15616 Len=0 TSval=3915082753 TSecr=247167022"
"132","2.971903","54.192.103.131","192.168.1.81","TLSv1.2","1514","Server Hello"
"133","2.972418","54.192.103.131","192.168.1.81","TLSv1.2","1514","Certificate"
"134","2.972420","54.192.103.131","192.168.1.81","TCP","1514","[TCP segment of a reassembled PDU]"
"135","2.972421","54.192.103.131","192.168.1.81","TLSv1.2","477","Certificate Status"
"136","2.972470","192.168.1.81","54.192.103.131","TCP","66","58991 > 443 [ACK] Seq=229 Ack=2897 Win=129600 Len=0 TSval=247167040 TSecr=3719275062"
"137","2.972526","192.168.1.81","54.192.103.131","TCP","66","58991 > 443 [ACK] Seq=229 Ack=4756 Win=129184 Len=0 TSval=247167040 TSecr=3719275062"
"138","2.973236","54.192.103.131","192.168.1.81","TLSv1.2","1514","Server Hello"
"139","2.973239","54.192.103.131","192.168.1.81","TLSv1.2","1514","Certificate"
"140","2.973240","54.192.103.131","192.168.1.81","TCP","1514","[TCP segment of a reassembled PDU]"
"141","2.973241","54.192.103.131","192.168.1.81","TLSv1.2","477","Certificate Status"
"142","2.973242","54.192.103.131","192.168.1.81","TLSv1.2","1514","Server Hello"
"143","2.973276","192.168.1.81","54.192.103.131","TCP","66","58995 > 443 [ACK] Seq=229 Ack=2897 Win=128864 Len=0 TSval=247167041 TSecr=3725458957"
"144","2.973326","192.168.1.81","54.192.103.131","TCP","66","58995 > 443 [ACK] Seq=229 Ack=4756 Win=127008 Len=0 TSval=247167041 TSecr=3725458957"
"145","2.973327","192.168.1.81","54.192.103.131","TLSv1.2","257","Client Key Exchange, Change Cipher Spec, Hello Request, Hello Request, Hello Request, Hello Request"
"146","2.973772","192.168.1.81","54.192.103.131","TCP","66","[TCP Window Update] 58995 > 443 [ACK] Seq=229 Ack=4756 Win=131072 Len=0 TSval=247167041 TSecr=3725458957"
"147","2.974292","54.192.103.131","192.168.1.81","TLSv1.2","1514","Certificate"
"148","2.974296","54.192.103.131","192.168.1.81","TCP","1514","[TCP segment of a reassembled PDU]"
"149","2.974297","54.192.103.131","192.168.1.81","TLSv1.2","477","Certificate Status"
"150","2.974329","192.168.1.81","54.192.103.131","TCP","66","58992 > 443 [ACK] Seq=229 Ack=2897 Win=128864 Len=0 TSval=247167042 TSecr=3914829659"
"151","2.974378","192.168.1.81","54.192.103.131","TCP","66","58992 > 443 [ACK] Seq=229 Ack=4756 Win=127008 Len=0 TSval=247167042 TSecr=3914829659"
"152","2.974513","192.168.1.81","54.192.103.131","TLSv1.2","257","Client Key Exchange, Change Cipher Spec, Hello Request, Hello Request, Hello Request, Hello Request"
"153","2.974895","54.192.103.131","192.168.1.81","TLSv1.2","1514","Server Hello"
"154","2.974898","54.192.103.131","192.168.1.81","TLSv1.2","1514","Certificate"
"155","2.974899","54.192.103.131","192.168.1.81","TCP","1514","[TCP segment of a reassembled PDU]"
"156","2.974901","54.192.103.131","192.168.1.81","TLSv1.2","477","Certificate Status"
"157","2.974930","192.168.1.81","54.192.103.131","TCP","66","58994 > 443 [ACK] Seq=229 Ack=2897 Win=128864 Len=0 TSval=247167042 TSecr=3915082754"
"158","2.974937","192.168.1.81","54.192.103.131","TCP","66","58994 > 443 [ACK] Seq=229 Ack=4756 Win=127008 Len=0 TSval=247167042 TSecr=3915082754"
"159","2.975207","192.168.1.81","54.192.103.131","TCP","66","[TCP Window Update] 58992 > 443 [ACK] Seq=229 Ack=4756 Win=131072 Len=0 TSval=247167042 TSecr=3914829659"
"160","2.976039","192.168.1.81","54.192.103.131","TLSv1.2","257","Client Key Exchange, Change Cipher Spec, Hello Request, Hello Request, Hello Request, Hello Request"
"161","2.976421","192.168.1.81","54.192.103.131","TCP","66","[TCP Window Update] 58994 > 443 [ACK] Seq=229 Ack=4756 Win=131072 Len=0 TSval=247167043 TSecr=3915082754"
"162","2.977130","192.168.1.81","54.192.103.131","TLSv1.2","257","Client Key Exchange, Change Cipher Spec, Hello Request, Hello Request, Hello Request, Hello Request"
"163","2.979586","192.168.1.81","54.192.103.131","TLSv1.2","585","Application Data"
"164","2.979658","192.168.1.81","54.192.103.131","TLSv1.2","537","Application Data"
"165","2.979740","192.168.1.81","54.192.103.131","TLSv1.2","571","Application Data"
"166","2.979816","192.168.1.81","54.192.103.131","TLSv1.2","596","Application Data"
"167","2.980657","54.192.103.131","192.168.1.81","TLSv1.2","1514","Server Hello"
"168","2.981214","54.192.103.131","192.168.1.81","TLSv1.2","1514","Certificate"
"169","2.981216","54.192.103.131","192.168.1.81","TCP","1514","[TCP segment of a reassembled PDU]"
"170","2.981217","54.192.103.131","192.168.1.81","TLSv1.2","477","Certificate Status"
"171","2.981249","192.168.1.81","54.192.103.131","TCP","66","58993 > 443 [ACK] Seq=229 Ack=2897 Win=129600 Len=0 TSval=247167047 TSecr=3719275062"
"172","2.981300","192.168.1.81","54.192.103.131","TCP","66","58993 > 443 [ACK] Seq=229 Ack=4756 Win=129184 Len=0 TSval=247167047 TSecr=3719275062"
"173","2.982122","192.168.1.81","54.192.103.131","TLSv1.2","257","Client Key Exchange, Change Cipher Spec, Hello Request, Hello Request, Hello Request, Hello Request"
"174","2.982716","192.168.1.81","54.192.103.131","TLSv1.2","571","Application Data"
"175","2.990078","54.192.103.131","192.168.1.81","TLSv1.2","324","New Session Ticket, Change Cipher Spec, Encrypted Handshake Message"
"176","2.990116","192.168.1.81","54.192.103.131","TCP","66","58991 > 443 [ACK] Seq=939 Ack=5014 Win=130784 Len=0 TSval=247167055 TSecr=3719275064"
"177","2.991310","54.192.103.131","192.168.1.81","TLSv1.2","324","New Session Ticket, Change Cipher Spec, Encrypted Handshake Message"
"178","2.991341","192.168.1.81","54.192.103.131","TCP","66","58995 > 443 [ACK] Seq=891 Ack=5014 Win=130784 Len=0 TSval=247167056 TSecr=3725458959"
"179","2.992659","54.192.103.131","192.168.1.81","TLSv1.2","324","New Session Ticket, Change Cipher Spec, Encrypted Handshake Message"
"180","2.992707","192.168.1.81","54.192.103.131","TCP","66","58992 > 443 [ACK] Seq=925 Ack=5014 Win=130784 Len=0 TSval=247167057 TSecr=3914829661"
"181","2.994466","54.192.103.131","192.168.1.81","TLSv1.2","324","New Session Ticket, Change Cipher Spec, Encrypted Handshake Message"
"182","2.994496","192.168.1.81","54.192.103.131","TCP","66","58994 > 443 [ACK] Seq=950 Ack=5014 Win=130784 Len=0 TSval=247167058 TSecr=3915082756"
"183","2.995449","54.192.103.131","192.168.1.81","TCP","1514","[TCP segment of a reassembled PDU]"
"184","2.996023","54.192.103.131","192.168.1.81","TLSv1.2","649","Application Data"
"185","2.996025","54.192.103.131","192.168.1.81","TLSv1.2","100","Application Data"
"186","2.996026","54.192.103.131","192.168.1.81","TCP","1514","[TCP segment of a reassembled PDU]"
"187","2.996026","54.192.103.131","192.168.1.81","TCP","1514","[TCP segment of a reassembled PDU]"
"188","2.996027","54.192.103.131","192.168.1.81","TCP","1514","[TCP segment of a reassembled PDU]"
"189","2.996028","54.192.103.131","192.168.1.81","TCP","1514","[TCP segment of a reassembled PDU]"
"190","2.996029","54.192.103.131","192.168.1.81","TCP","1514","[TCP segment of a reassembled PDU]"
"191","2.996073","192.168.1.81","54.192.103.131","TCP","66","58995 > 443 [ACK] Seq=891 Ack=7045 Win=130464 Len=0 TSval=247167059 TSecr=3725458959"
"192","2.996073","192.168.1.81","54.192.103.131","TCP","66","58995 > 443 [ACK] Seq=891 Ack=7079 Win=131008 Len=0 TSval=247167059 TSecr=3725458959"
"193","2.996073","192.168.1.81","54.192.103.131","TCP","66","58991 > 443 [ACK] Seq=939 Ack=7910 Win=128160 Len=0 TSval=247167059 TSecr=3719275064"
"194","2.996073","192.168.1.81","54.192.103.131","TCP","66","58991 > 443 [ACK] Seq=939 Ack=10806 Win=125280 Len=0 TSval=247167059 TSecr=3719275064"
"195","2.996829","54.192.103.131","192.168.1.81","TCP","1514","[TCP segment of a reassembled PDU]"
"196","2.996832","54.192.103.131","192.168.1.81","TCP","1514","[TCP segment of a reassembled PDU]"
"197","2.996833","54.192.103.131","192.168.1.81","TCP","1514","[TCP segment of a reassembled PDU]"
"198","2.996834","54.192.103.131","192.168.1.81","TCP","1514","[TCP segment of a reassembled PDU]"
"199","2.996834","54.192.103.131","192.168.1.81","TLSv1.2","611","Application Data"
"200","2.996866","192.168.1.81","54.192.103.131","TCP","66","58991 > 443 [ACK] Seq=939 Ack=13702 Win=122368 Len=0 TSval=247167059 TSecr=3719275064"
"201","2.996873","192.168.1.81","54.192.103.131","TCP","66","58991 > 443 [ACK] Seq=939 Ack=16598 Win=119488 Len=0 TSval=247167059 TSecr=3719275064"
"202","2.996886","192.168.1.81","54.192.103.131","TCP","66","58992 > 443 [ACK] Seq=925 Ack=5559 Win=130496 Len=0 TSval=247167059 TSecr=3914829661"
"203","2.997210","192.168.1.81","54.192.103.131","TCP","66","58991 > 443 [ACK] Seq=939 Ack=18046 Win=131072 Len=0 TSval=247167060 TSecr=3719275064"
"204","2.997827","54.192.103.131","192.168.1.81","TCP","1514","[TCP segment of a reassembled PDU]"
"205","2.997831","54.192.103.131","192.168.1.81","TCP","1514","[TCP segment of a reassembled PDU]"
"206","2.997832","54.192.103.131","192.168.1.81","TCP","1514","[TCP segment of a reassembled PDU]"
"207","2.997833","54.192.103.131","192.168.1.81","TCP","1514","[TCP segment of a reassembled PDU]"
"208","2.997834","54.192.103.131","192.168.1.81","TCP","1514","[TCP segment of a reassembled PDU]"
"209","2.997835","54.192.103.131","192.168.1.81","TCP","1514","[TCP segment of a reassembled PDU]"
"210","2.997837","54.192.103.131","192.168.1.81","TCP","1514","[TCP segment of a reassembled PDU]"
"211","2.997893","54.192.103.131","192.168.1.81","TCP","1514","[TCP segment of a reassembled PDU]"
"212","2.997904","192.168.1.81","54.192.103.131","TCP","66","58992 > 443 [ACK] Seq=925 Ack=8455 Win=128160 Len=0 TSval=247167060 TSecr=3914829661"
"213","2.997904","192.168.1.81","54.192.103.131","TCP","66","58992 > 443 [ACK] Seq=925 Ack=11351 Win=125280 Len=0 TSval=247167060 TSecr=3914829661"
"214","2.997904","192.168.1.81","54.192.103.131","TCP","66","58992 > 443 [ACK] Seq=925 Ack=14247 Win=122368 Len=0 TSval=247167060 TSecr=3914829661"
"215","2.997917","192.168.1.81","54.192.103.131","TCP","66","58992 > 443 [ACK] Seq=925 Ack=17143 Win=119488 Len=0 TSval=247167060 TSecr=3914829661"
"216","2.998010","192.168.1.81","54.192.103.131","TCP","66","[TCP Window Update] 58992 > 443 [ACK] Seq=925 Ack=17143 Win=131072 Len=0 TSval=247167060 TSecr=3914829661"
"217","3.000932","54.192.103.131","192.168.1.81","TCP","66","443 > 58993 [ACK] Seq=4756 Ack=925 Win=17920 Len=0 TSval=3719275064 TSecr=247167048"
"218","3.002226","54.192.103.131","192.168.1.81","TLSv1.2","324","New Session Ticket, Change Cipher Spec, Encrypted Handshake Message"
"219","3.002310","192.168.1.81","54.192.103.131","TCP","66","58993 > 443 [ACK] Seq=925 Ack=5014 Win=130784 Len=0 TSval=247167064 TSecr=3719275065"
"220","3.002606","54.192.103.131","192.168.1.81","TCP","1514","[TCP segment of a reassembled PDU]"
"221","3.002629","54.192.103.131","192.168.1.81","TCP","1514","[TCP segment of a reassembled PDU]"
"222","3.002630","54.192.103.131","192.168.1.81","TCP","1514","[TCP segment of a reassembled PDU]"
"223","3.002632","54.192.103.131","192.168.1.81","TCP","1514","[TCP segment of a reassembled PDU]"
"224","3.002633","54.192.103.131","192.168.1.81","TCP","1514","[TCP segment of a reassembled PDU]"
"225","3.002635","54.192.103.131","192.168.1.81","TCP","1514","[TCP segment of a reassembled PDU]"
"226","3.002636","54.192.103.131","192.168.1.81","TCP","1514","[TCP segment of a reassembled PDU]"
"227","3.002753","54.192.103.131","192.168.1.81","TCP","1514","[TCP segment of a reassembled PDU]"
"228","3.002754","54.192.103.131","192.168.1.81","TCP","1514","[TCP segment of a reassembled PDU]"
"229","3.002798","192.168.1.81","54.192.103.131","TCP","66","58993 > 443 [ACK] Seq=925 Ack=7910 Win=128160 Len=0 TSval=247167064 TSecr=3719275065"
"230","3.002799","192.168.1.81","54.192.103.131","TCP","66","[TCP Window Update] 58993 > 443 [ACK] Seq=925 Ack=7910 Win=131072 Len=0 TSval=247167064 TSecr=3719275065"
"231","3.002799","192.168.1.81","54.192.103.131","TCP","66","58993 > 443 [ACK] Seq=925 Ack=10806 Win=128160 Len=0 TSval=247167064 TSecr=3719275065"
"232","3.002799","192.168.1.81","54.192.103.131","TCP","66","58993 > 443 [ACK] Seq=925 Ack=13702 Win=125280 Len=0 TSval=247167064 TSecr=3719275065"
"233","3.002799","192.168.1.81","54.192.103.131","TCP","66","58993 > 443 [ACK] Seq=925 Ack=15150 Win=131072 Len=0 TSval=247167064 TSecr=3719275065"
"234","3.002799","192.168.1.81","54.192.103.131","TCP","66","58993 > 443 [ACK] Seq=925 Ack=18046 Win=128160 Len=0 TSval=247167064 TSecr=3719275065"
"235","3.002799","192.168.1.81","54.192.103.131","TCP","66","[TCP Window Update] 58993 > 443 [ACK] Seq=925 Ack=18046 Win=131072 Len=0 TSval=247167064 TSecr=3719275065"
"236","3.003944","54.192.103.131","192.168.1.81","TCP","1514","[TCP segment of a reassembled PDU]"
"237","3.003947","54.192.103.131","192.168.1.81","TLSv1.2","1483","Application Data"
"238","3.003949","54.192.103.131","192.168.1.81","TLSv1.2","100","Application Data"
"239","3.004013","192.168.1.81","54.192.103.131","TCP","66","58994 > 443 [ACK] Seq=950 Ack=7879 Win=128192 Len=0 TSval=247167065 TSecr=3915082756"
"240","3.004014","192.168.1.81","54.192.103.131","TCP","66","58994 > 443 [ACK] Seq=950 Ack=7913 Win=128160 Len=0 TSval=247167065 TSecr=3915082756"
"241","3.004031","192.168.1.81","54.192.103.131","TCP","66","[TCP Window Update] 58994 > 443 [ACK] Seq=950 Ack=7913 Win=131072 Len=0 TSval=247167065 TSecr=3915082756"
"242","3.014177","54.192.103.131","192.168.1.81","TCP","1514","[TCP segment of a reassembled PDU]"
"243","3.014885","54.192.103.131","192.168.1.81","TCP","1514","[TCP segment of a reassembled PDU]"
"244","3.014888","54.192.103.131","192.168.1.81","TCP","1514","[TCP segment of a reassembled PDU]"
"245","3.014889","54.192.103.131","192.168.1.81","TLSv1.2","875","Application Data"
"246","3.014890","54.192.103.131","192.168.1.81","TCP","1514","[TCP segment of a reassembled PDU]"
"247","3.014891","54.192.103.131","192.168.1.81","TCP","1514","[TCP segment of a reassembled PDU]"
"248","3.014892","54.192.103.131","192.168.1.81","TLSv1.2","1514","Application Data"
"249","3.014893","54.192.103.131","192.168.1.81","TLSv1.2","1335","Application Data"
"250","3.014957","192.168.1.81","54.192.103.131","TCP","66","58991 > 443 [ACK] Seq=939 Ack=20942 Win=129600 Len=0 TSval=247167075 TSecr=3719275066"
"251","3.014957","192.168.1.81","54.192.103.131","TCP","66","58991 > 443 [ACK] Seq=939 Ack=21751 Win=128800 Len=0 TSval=247167075 TSecr=3719275066"
"252","3.014958","192.168.1.81","54.192.103.131","TCP","66","58992 > 443 [ACK] Seq=925 Ack=20039 Win=129600 Len=0 TSval=247167075 TSecr=3914829663"
"253","3.014998","192.168.1.81","54.192.103.131","TCP","66","58992 > 443 [ACK] Seq=925 Ack=22935 Win=126720 Len=0 TSval=247167075 TSecr=3914829663"
"254","3.014999","192.168.1.81","54.192.103.131","TCP","66","[TCP Window Update] 58992 > 443 [ACK] Seq=925 Ack=22935 Win=131072 Len=0 TSval=247167075 TSecr=3914829663"
"255","3.014999","192.168.1.81","54.192.103.131","TCP","66","58992 > 443 [ACK] Seq=925 Ack=24204 Win=129792 Len=0 TSval=247167075 TSecr=3914829663"
"256","3.018511","54.192.103.131","192.168.1.81","TCP","1514","[TCP segment of a reassembled PDU]"
"257","3.018574","192.168.1.81","54.192.103.131","TCP","66","58993 > 443 [ACK] Seq=925 Ack=19494 Win=131072 Len=0 TSval=247167079 TSecr=3719275067"
"258","3.018981","54.192.103.131","192.168.1.81","TCP","1514","[TCP segment of a reassembled PDU]"
"259","3.018983","54.192.103.131","192.168.1.81","TLSv1.2","1514","Application Data"
"260","3.018985","54.192.103.131","192.168.1.81","TLSv1.2","1294","Application Data"
"261","3.019019","192.168.1.81","54.192.103.131","TCP","66","58993 > 443 [ACK] Seq=925 Ack=22390 Win=128160 Len=0 TSval=247167079 TSecr=3719275067"
"262","3.019019","192.168.1.81","54.192.103.131","TCP","66","[TCP Window Update] 58993 > 443 [ACK] Seq=925 Ack=22390 Win=131072 Len=0 TSval=247167079 TSecr=3719275067"
"263","3.019070","192.168.1.81","54.192.103.131","TCP","66","58993 > 443 [ACK] Seq=925 Ack=23618 Win=129824 Len=0 TSval=247167079 TSecr=3719275067"
"264","3.022107","192.168.1.81","54.192.103.131","TLSv1.2","562","Application Data"
"265","3.042777","54.192.103.131","192.168.1.81","TLSv1.2","591","Application Data"
"266","3.042824","192.168.1.81","54.192.103.131","TCP","66","58993 > 443 [ACK] Seq=1421 Ack=24143 Win=130528 Len=0 TSval=247167101 TSecr=3719275068"
"267","3.044991","192.168.1.81","54.192.103.131","TLSv1.2","606","Application Data"
"268","3.063310","54.192.103.131","192.168.1.81","TCP","1514","[TCP segment of a reassembled PDU]"
"269","3.063899","54.192.103.131","192.168.1.81","TCP","1514","[TCP segment of a reassembled PDU]"
"270","3.063902","54.192.103.131","192.168.1.81","TCP","1514","[TCP segment of a reassembled PDU]"
"271","3.063903","54.192.103.131","192.168.1.81","TCP","1514","[TCP segment of a reassembled PDU]"
"272","3.063904","54.192.103.131","192.168.1.81","TCP","1514","[TCP segment of a reassembled PDU]"
"273","3.063905","54.192.103.131","192.168.1.81","TCP","1514","[TCP segment of a reassembled PDU]"
"274","3.063906","54.192.103.131","192.168.1.81","TCP","1514","[TCP segment of a reassembled PDU]"
"275","3.063906","54.192.103.131","192.168.1.81","TCP","1514","[TCP segment of a reassembled PDU]"
"276","3.063963","54.192.103.131","192.168.1.81","TCP","1514","[TCP segment of a reassembled PDU]"
"277","3.063964","54.192.103.131","192.168.1.81","TCP","1514","[TCP segment of a reassembled PDU]"
"278","3.063965","54.192.103.131","192.168.1.81","TCP","1514","[TCP segment of a reassembled PDU]"
"279","3.063966","54.192.103.131","192.168.1.81","TLSv1.2","551","Application Data"
"280","3.063967","54.192.103.131","192.168.1.81","TCP","1514","[TCP segment of a reassembled PDU]"
"281","3.063978","192.168.1.81","54.192.103.131","TCP","66","58993 > 443 [ACK] Seq=1961 Ack=27039 Win=129600 Len=0 TSval=247167121 TSecr=3719275071"
"282","3.063978","192.168.1.81","54.192.103.131","TCP","66","58993 > 443 [ACK] Seq=1961 Ack=29935 Win=128160 Len=0 TSval=247167121 TSecr=3719275071"
"283","3.063978","192.168.1.81","54.192.103.131","TCP","66","58993 > 443 [ACK] Seq=1961 Ack=32831 Win=125280 Len=0 TSval=247167121 TSecr=3719275071"
"284","3.063978","192.168.1.81","54.192.103.131","TCP","66","58993 > 443 [ACK] Seq=1961 Ack=35727 Win=122368 Len=0 TSval=247167121 TSecr=3719275071"
"285","3.063978","192.168.1.81","54.192.103.131","TCP","66","[TCP Window Update] 58993 > 443 [ACK] Seq=1961 Ack=35727 Win=131072 Len=0 TSval=247167121 TSecr=3719275071"
"286","3.064045","192.168.1.81","54.192.103.131","TCP","66","58993 > 443 [ACK] Seq=1961 Ack=37175 Win=131072 Len=0 TSval=247167121 TSecr=3719275071"
"287","3.064045","192.168.1.81","54.192.103.131","TCP","66","58993 > 443 [ACK] Seq=1961 Ack=40071 Win=128160 Len=0 TSval=247167121 TSecr=3719275071"
"288","3.064045","192.168.1.81","54.192.103.131","TCP","66","[TCP Window Update] 58993 > 443 [ACK] Seq=1961 Ack=40071 Win=131072 Len=0 TSval=247167121 TSecr=3719275071"
"289","3.064045","192.168.1.81","54.192.103.131","TCP","66","58993 > 443 [ACK] Seq=1961 Ack=40556 Win=130560 Len=0 TSval=247167121 TSecr=3719275071"
"290","3.065645","54.192.103.131","192.168.1.81","TCP","1514","[TCP segment of a reassembled PDU]"
"291","3.065949","192.168.1.81","54.192.103.131","TCP","66","58993 > 443 [ACK] Seq=1961 Ack=43452 Win=129600 Len=0 TSval=247167123 TSecr=3719275071"
"292","3.080637","54.192.103.131","192.168.1.81","TCP","1514","[TCP segment of a reassembled PDU]"
"293","3.081215","192.168.1.81","54.192.103.131","TCP","66","58993 > 443 [ACK] Seq=1961 Ack=44900 Win=131072 Len=0 TSval=247167137 TSecr=3719275073"
"294","3.081335","54.192.103.131","192.168.1.81","TCP","1514","[TCP segment of a reassembled PDU]"
"295","3.081339","54.192.103.131","192.168.1.81","TCP","1514","[TCP segment of a reassembled PDU]"
"296","3.081378","192.168.1.81","54.192.103.131","TCP","66","58993 > 443 [ACK] Seq=1961 Ack=47796 Win=128160 Len=0 TSval=247167137 TSecr=3719275073"
"297","3.082057","54.192.103.131","192.168.1.81","TCP","1514","[TCP segment of a reassembled PDU]"
"298","3.082061","54.192.103.131","192.168.1.81","TCP","1514","[TCP segment of a reassembled PDU]"
"299","3.082062","54.192.103.131","192.168.1.81","TCP","1514","[TCP segment of a reassembled PDU]"
"300","3.082101","192.168.1.81","54.192.103.131","TCP","66","58993 > 443 [ACK] Seq=1961 Ack=50692 Win=125280 Len=0 TSval=247167138 TSecr=3719275073"
"301","3.082520","192.168.1.81","54.192.103.131","TCP","66","58993 > 443 [ACK] Seq=1961 Ack=52140 Win=131072 Len=0 TSval=247167138 TSecr=3719275073"
"302","3.082772","54.192.103.131","192.168.1.81","TCP","1514","[TCP segment of a reassembled PDU]"
"303","3.082777","54.192.103.131","192.168.1.81","TCP","1514","[TCP segment of a reassembled PDU]"
"304","3.082778","54.192.103.131","192.168.1.81","TCP","1514","[TCP segment of a reassembled PDU]"
"305","3.082779","54.192.103.131","192.168.1.81","TLSv1.2","1514","Application Data"
"306","3.082781","54.192.103.131","192.168.1.81","TCP","1514","[TCP segment of a reassembled PDU]"
"307","3.082782","54.192.103.131","192.168.1.81","TCP","1514","[TCP segment of a reassembled PDU]"
"308","3.082783","54.192.103.131","192.168.1.81","TCP","1514","[TCP segment of a reassembled PDU]"
"309","3.082885","54.192.103.131","192.168.1.81","TCP","1514","[TCP segment of a reassembled PDU]"
"310","3.082887","54.192.103.131","192.168.1.81","TCP","1514","[TCP segment of a reassembled PDU]"
"311","3.082948","192.168.1.81","54.192.103.131","TCP","66","58993 > 443 [ACK] Seq=1961 Ack=55036 Win=128160 Len=0 TSval=247167138 TSecr=3719275073"
"312","3.082948","192.168.1.81","54.192.103.131","TCP","66","58993 > 443 [ACK] Seq=1961 Ack=57932 Win=125280 Len=0 TSval=247167138 TSecr=3719275073"
"313","3.082949","192.168.1.81","54.192.103.131","TCP","66","58993 > 443 [ACK] Seq=1961 Ack=60828 Win=122368 Len=0 TSval=247167138 TSecr=3719275073"
"314","3.082949","192.168.1.81","54.192.103.131","TCP","66","58993 > 443 [ACK] Seq=1961 Ack=62276 Win=131072 Len=0 TSval=247167138 TSecr=3719275073"
"315","3.082949","192.168.1.81","54.192.103.131","TCP","66","58993 > 443 [ACK] Seq=1961 Ack=65172 Win=128160 Len=0 TSval=247167138 TSecr=3719275073"
"316","3.083006","192.168.1.81","54.192.103.131","TCP","66","[TCP Window Update] 58993 > 443 [ACK] Seq=1961 Ack=65172 Win=131072 Len=0 TSval=247167138 TSecr=3719275073"
"317","3.083657","54.192.103.131","192.168.1.81","TCP","1514","[TCP segment of a reassembled PDU]"
"318","3.083660","54.192.103.131","192.168.1.81","TCP","1514","[TCP segment of a reassembled PDU]"
"319","3.083697","192.168.1.81","54.192.103.131","TCP","66","58993 > 443 [ACK] Seq=1961 Ack=68068 Win=128160 Len=0 TSval=247167139 TSecr=3719275073"
"320","3.083708","192.168.1.81","54.192.103.131","TCP","66","[TCP Window Update] 58993 > 443 [ACK] Seq=1961 Ack=68068 Win=131072 Len=0 TSval=247167139 TSecr=3719275073"
"321","3.088732","192.168.1.81","54.192.103.131","TLSv1.2","614","Application Data"
"322","3.099218","54.192.103.131","192.168.1.81","TCP","1514","[TCP segment of a reassembled PDU]"
"323","3.099774","54.192.103.131","192.168.1.81","TCP","1514","[TCP segment of a reassembled PDU]"
"324","3.099777","54.192.103.131","192.168.1.81","TCP","1514","[TCP segment of a reassembled PDU]"
"325","3.099779","54.192.103.131","192.168.1.81","TLSv1.2","1514","Application Data"
"326","3.099780","54.192.103.131","192.168.1.81","TCP","1514","[TCP segment of a reassembled PDU]"
"327","3.099781","54.192.103.131","192.168.1.81","TCP","1514","[TCP segment of a reassembled PDU]"
"328","3.099782","54.192.103.131","192.168.1.81","TCP","1514","[TCP segment of a reassembled PDU]"
"329","3.099825","192.168.1.81","54.192.103.131","TCP","66","58993 > 443 [ACK] Seq=1961 Ack=70964 Win=129600 Len=0 TSval=247167154 TSecr=3719275075"
"330","3.099825","192.168.1.81","54.192.103.131","TCP","66","58993 > 443 [ACK] Seq=1961 Ack=73860 Win=126720 Len=0 TSval=247167154 TSecr=3719275075"
"331","3.099886","192.168.1.81","54.192.103.131","TCP","66","58993 > 443 [ACK] Seq=1961 Ack=76756 Win=123808 Len=0 TSval=247167154 TSecr=3719275075"
"332","3.099923","192.168.1.81","54.192.103.131","TCP","66","58993 > 443 [ACK] Seq=1961 Ack=78204 Win=131072 Len=0 TSval=247167154 TSecr=3719275075"
"333","3.102335","54.192.103.131","192.168.1.81","TCP","1514","[TCP segment of a reassembled PDU]"
"334","3.102940","54.192.103.131","192.168.1.81","TCP","1514","[TCP segment of a reassembled PDU]"
"335","3.102943","54.192.103.131","192.168.1.81","TCP","1514","[TCP segment of a reassembled PDU]"
"336","3.102945","54.192.103.131","192.168.1.81","TCP","1514","[TCP segment of a reassembled PDU]"
"337","3.102946","54.192.103.131","192.168.1.81","TCP","1514","[TCP segment of a reassembled PDU]"
"338","3.102948","54.192.103.131","192.168.1.81","TCP","1514","[TCP segment of a reassembled PDU]"
"339","3.102949","54.192.103.131","192.168.1.81","TCP","1514","[TCP segment of a reassembled PDU]"
"340","3.102950","54.192.103.131","192.168.1.81","TLSv1.2","1514","Application Data"
"341","3.103000","54.192.103.131","192.168.1.81","TCP","1514","[TCP segment of a reassembled PDU]"
"342","3.103001","54.192.103.131","192.168.1.81","TCP","1514","[TCP segment of a reassembled PDU]"
"343","3.103002","54.192.103.131","192.168.1.81","TCP","1514","[TCP segment of a reassembled PDU]"
"344","3.103003","54.192.103.131","192.168.1.81","TCP","1514","[TCP segment of a reassembled PDU]"
"345","3.103014","192.168.1.81","54.192.103.131","TCP","66","58993 > 443 [ACK] Seq=1961 Ack=81100 Win=129600 Len=0 TSval=247167157 TSecr=3719275075"
"346","3.103015","192.168.1.81","54.192.103.131","TCP","66","58993 > 443 [ACK] Seq=1961 Ack=83996 Win=126720 Len=0 TSval=247167157 TSecr=3719275075"
"347","3.103015","192.168.1.81","54.192.103.131","TCP","66","58993 > 443 [ACK] Seq=1961 Ack=86892 Win=123808 Len=0 TSval=247167157 TSecr=3719275075"
"348","3.103015","192.168.1.81","54.192.103.131","TCP","66","58993 > 443 [ACK] Seq=1961 Ack=89788 Win=120928 Len=0 TSval=247167157 TSecr=3719275075"
"349","3.103064","192.168.1.81","54.192.103.131","TCP","66","58993 > 443 [ACK] Seq=1961 Ack=92684 Win=118016 Len=0 TSval=247167157 TSecr=3719275075"
"350","3.103064","192.168.1.81","54.192.103.131","TCP","66","58993 > 443 [ACK] Seq=1961 Ack=95580 Win=115136 Len=0 TSval=247167157 TSecr=3719275075"
"351","3.103168","54.192.103.131","192.168.1.81","TCP","1514","[TCP segment of a reassembled PDU]"
"352","3.103171","54.192.103.131","192.168.1.81","TCP","1514","[TCP segment of a reassembled PDU]"
"353","3.103172","54.192.103.131","192.168.1.81","TCP","1514","[TCP segment of a reassembled PDU]"
