"No.","Time","Source","Destination","Protocol","Length","Info"
"1","0.000000000","192.168.1.89","54.239.18.49","TLSv1","736","Application Data, Application Data"
"2","0.001566000","192.168.1.89","54.239.22.213","TLSv1","1048","Application Data, Application Data"
"3","0.001686000","192.168.1.89","54.239.22.213","TLSv1","1256","Application Data, Application Data"
"4","0.023030000","54.239.18.49","192.168.1.89","TCP","60","443 > 65463 [ACK] Seq=1 Ack=683 Win=32745 Len=0"
"5","0.023399000","54.239.22.213","192.168.1.89","TCP","60","443 > 65451 [ACK] Seq=1 Ack=995 Win=32752 Len=0"
"6","0.023775000","54.239.22.213","192.168.1.89","TCP","60","443 > 65451 [ACK] Seq=1 Ack=2197 Win=32733 Len=0"
"7","0.024252000","54.239.22.213","192.168.1.89","TLSv1","371","Application Data"
"8","0.024320000","192.168.1.89","54.239.22.213","TCP","54","65451 > 443 [ACK] Seq=2197 Ack=318 Win=8182 Len=0"
"9","0.036507000","54.239.18.49","192.168.1.89","TLSv1","499","Application Data"
"10","0.036589000","192.168.1.89","54.239.18.49","TCP","54","65463 > 443 [ACK] Seq=683 Ack=446 Win=8178 Len=0"
"11","0.149142000","192.168.1.89","54.239.22.213","TLSv1","1384","Application Data, Application Data"
"12","0.158977000","192.168.1.89","54.239.18.49","TLSv1","784","Application Data, Application Data"
"13","0.165710000","54.239.22.213","192.168.1.89","TCP","60","443 > 65451 [ACK] Seq=318 Ack=3527 Win=32747 Len=0"
"14","0.169076000","54.239.22.213","192.168.1.89","TLSv1","371","Application Data"
"15","0.169162000","192.168.1.89","54.239.22.213","TCP","54","65451 > 443 [ACK] Seq=3527 Ack=635 Win=8182 Len=0"
"16","0.174617000","54.239.18.49","192.168.1.89","TCP","60","443 > 65463 [ACK] Seq=446 Ack=1413 Win=32756 Len=0"
"17","0.178935000","54.239.18.49","192.168.1.89","TLSv1","667","Application Data"
"18","0.179050000","192.168.1.89","54.239.18.49","TCP","54","65463 > 443 [ACK] Seq=1413 Ack=1059 Win=8172 Len=0"
"21","0.214424000","192.168.1.89","199.16.156.232","TCP","78","65471 > 443 [SYN] Seq=0 Win=65535 Len=0 MSS=1460 WS=32 TSval=1460722451 TSecr=0 SACK_PERM=1"
"22","0.261424000","199.16.156.232","192.168.1.89","TCP","74","443 > 65471 [SYN, ACK] Seq=0 Ack=1 Win=28960 Len=0 MSS=1460 SACK_PERM=1 TSval=162659874 TSecr=1460722451 WS=256"
"23","0.261516000","192.168.1.89","199.16.156.232","TCP","66","65471 > 443 [ACK] Seq=1 Ack=1 Win=131744 Len=0 TSval=1460722498 TSecr=162659874"
"24","0.261805000","192.168.1.89","199.16.156.232","TLSv1.2","284","Client Hello"
"25","0.306477000","199.16.156.232","192.168.1.89","TCP","66","443 > 65471 [ACK] Seq=1 Ack=219 Win=30208 Len=0 TSval=162659921 TSecr=1460722498"
"26","0.306767000","199.16.156.232","192.168.1.89","TLSv1.2","1514","Server Hello"
"27","0.307325000","199.16.156.232","192.168.1.89","TLSv1.2","1514","Certificate"
"28","0.307329000","199.16.156.232","192.168.1.89","TLSv1.2","195","Server Key Exchange"
"29","0.307419000","192.168.1.89","199.16.156.232","TCP","66","65471 > 443 [ACK] Seq=219 Ack=2897 Win=129600 Len=0 TSval=1460722543 TSecr=162659922"
"30","0.307419000","192.168.1.89","199.16.156.232","TCP","66","65471 > 443 [ACK] Seq=219 Ack=3026 Win=129472 Len=0 TSval=1460722543 TSecr=162659922"
"31","0.309389000","192.168.1.89","199.16.156.232","TLSv1.2","192","Client Key Exchange, Change Cipher Spec, Hello Request, Hello Request"
"32","0.318883000","192.168.1.89","199.16.156.232","TLSv1.2","119","Application Data"
"33","0.318884000","192.168.1.89","199.16.156.232","TLSv1.2","116","Application Data"
"34","0.318951000","192.168.1.89","199.16.156.232","TLSv1.2","108","Application Data"
"35","0.319130000","192.168.1.89","199.16.156.232","TLSv1.2","1020","Application Data"
"36","0.353693000","199.16.156.232","192.168.1.89","TLSv1.2","308","New Session Ticket, Change Cipher Spec, Encrypted Handshake Message"
"37","0.353785000","192.168.1.89","199.16.156.232","TCP","66","65471 > 443 [ACK] Seq=1444 Ack=3268 Win=130816 Len=0 TSval=1460722587 TSecr=162659969"
"38","0.353920000","199.16.156.232","192.168.1.89","TLSv1.2","110","Application Data"
"39","0.353979000","192.168.1.89","199.16.156.232","TCP","66","65471 > 443 [ACK] Seq=1444 Ack=3312 Win=131008 Len=0 TSval=1460722587 TSecr=162659969"
"40","0.354210000","192.168.1.89","199.16.156.232","TLSv1.2","104","Application Data"
"41","0.363661000","199.16.156.232","192.168.1.89","TLSv1.2","104","Application Data"
"42","0.363753000","192.168.1.89","199.16.156.232","TCP","66","65471 > 443 [ACK] Seq=1482 Ack=3350 Win=131008 Len=0 TSval=1460722596 TSecr=162659979"
"43","0.387476000","199.16.156.232","192.168.1.89","TLSv1.2","562","Application Data"
"44","0.387589000","192.168.1.89","199.16.156.232","TCP","66","65471 > 443 [ACK] Seq=1482 Ack=3846 Win=130560 Len=0 TSval=1460722619 TSecr=162659997"
"45","0.395448000","192.168.1.89","54.239.18.49","TLSv1","648","Application Data, Application Data"
"46","0.411070000","54.239.18.49","192.168.1.89","TCP","60","443 > 65463 [ACK] Seq=1059 Ack=2007 Win=32758 Len=0"
"47","0.419376000","54.239.18.49","192.168.1.89","TLSv1","435","Application Data"
"48","0.419464000","192.168.1.89","54.239.18.49","TCP","54","65463 > 443 [ACK] Seq=2007 Ack=1440 Win=8180 Len=0"
"49","0.432111000","199.16.156.232","192.168.1.89","TCP","66","443 > 65471 [ACK] Seq=3846 Ack=1482 Win=32000 Len=0 TSval=162660047 TSecr=1460722587"
"50","0.842830000","192.168.1.89","192.168.1.211","TCP","181","[TCP segment of a reassembled PDU]"
"51","0.846032000","192.168.1.211","192.168.1.89","TCP","99","[TCP segment of a reassembled PDU]"
"52","0.846126000","192.168.1.89","192.168.1.211","TCP","66","65040 > 8009 [ACK] Seq=116 Ack=34 Win=4094 Len=0 TSval=1460723072 TSecr=4730056"
"53","0.846494000","192.168.1.211","192.168.1.89","TCP","177","[TCP segment of a reassembled PDU]"
"54","0.846634000","192.168.1.89","192.168.1.211","TCP","66","65040 > 8009 [ACK] Seq=116 Ack=145 Win=4092 Len=0 TSval=1460723072 TSecr=4730056"
"55","1.253832000","192.168.1.89","74.125.226.69","TLSv1.2","135","Application Data"
"56","1.254422000","192.168.1.89","74.125.226.69","TCP","66","65407 > 443 [FIN, ACK] Seq=70 Ack=1 Win=4096 Len=0 TSval=1460723478 TSecr=2315042423"
"57","1.287582000","74.125.226.69","192.168.1.89","TCP","66","443 > 65407 [ACK] Seq=1 Ack=70 Win=483 Len=0 TSval=2315281901 TSecr=1460723478"
"58","1.287586000","74.125.226.69","192.168.1.89","TCP","66","443 > 65407 [FIN, ACK] Seq=1 Ack=71 Win=483 Len=0 TSval=2315281901 TSecr=1460723478"
"59","1.287706000","192.168.1.89","74.125.226.69","TCP","66","[TCP Spurious Retransmission] 65407 > 443 [FIN, ACK] Seq=70 Ack=1 Win=4096 Len=0 TSval=1460723511 TSecr=2315281901"
"60","1.287706000","192.168.1.89","74.125.226.69","TCP","66","65407 > 443 [ACK] Seq=71 Ack=2 Win=4096 Len=0 TSval=1460723511 TSecr=2315281901"
"61","1.329381000","74.125.226.69","192.168.1.89","TCP","78","[TCP Dup ACK 58#1] 443 > 65407 [ACK] Seq=2 Ack=71 Win=483 Len=0 TSval=2315281934 TSecr=1460723511 SLE=70 SRE=71"
"63","1.569856000","192.168.1.89","74.125.226.66","TCP","78","65472 > 443 [SYN] Seq=0 Win=65535 Len=0 MSS=1460 WS=32 TSval=1460723789 TSecr=0 SACK_PERM=1"
"64","1.597431000","74.125.226.66","192.168.1.89","TCP","74","443 > 65472 [SYN, ACK] Seq=0 Ack=1 Win=42540 Len=0 MSS=1430 SACK_PERM=1 TSval=2322473532 TSecr=1460723789 WS=128"
"65","1.597527000","192.168.1.89","74.125.226.66","TCP","66","65472 > 443 [ACK] Seq=1 Ack=1 Win=131872 Len=0 TSval=1460723816 TSecr=2322473532"
"66","1.598014000","192.168.1.89","74.125.226.66","TLSv1.2","583","Client Hello"
"67","1.623465000","74.125.226.66","192.168.1.89","TCP","66","443 > 65472 [ACK] Seq=1 Ack=518 Win=43648 Len=0 TSval=2322473559 TSecr=1460723816"
"68","1.623877000","74.125.226.66","192.168.1.89","TLSv1.2","220","Server Hello, Change Cipher Spec, Hello Request, Hello Request"
"69","1.623940000","192.168.1.89","74.125.226.66","TCP","66","65472 > 443 [ACK] Seq=518 Ack=155 Win=131712 Len=0 TSval=1460723842 TSecr=2322473559"
"70","1.624956000","192.168.1.89","74.125.226.66","TLSv1.2","282","Change Cipher Spec, Hello Request, Hello Request, Hello Request, Hello Request"
"71","1.654300000","74.125.226.66","192.168.1.89","TLSv1.2","122","Application Data"
"72","1.654372000","192.168.1.89","74.125.226.66","TCP","66","65472 > 443 [ACK] Seq=734 Ack=211 Win=131648 Len=0 TSval=1460723872 TSecr=2322473586"
"73","1.654585000","74.125.226.66","192.168.1.89","TLSv1.2","108","Application Data"
"74","1.654637000","192.168.1.89","74.125.226.66","TCP","66","65472 > 443 [ACK] Seq=734 Ack=253 Win=131616 Len=0 TSval=1460723872 TSecr=2322473586"
"75","1.832025000","192.168.1.89","205.251.253.114","TLSv1.2","723","Application Data"
"76","1.850391000","205.251.253.114","192.168.1.89","TCP","1514","[TCP segment of a reassembled PDU]"
"77","1.850891000","205.251.253.114","192.168.1.89","TCP","1514","[TCP segment of a reassembled PDU]"
"78","1.850895000","205.251.253.114","192.168.1.89","TCP","1514","[TCP segment of a reassembled PDU]"
"79","1.850896000","205.251.253.114","192.168.1.89","TCP","1514","[TCP segment of a reassembled PDU]"
"80","1.850897000","205.251.253.114","192.168.1.89","TCP","1514","[TCP segment of a reassembled PDU]"
"81","1.850898000","205.251.253.114","192.168.1.89","TCP","1514","[TCP segment of a reassembled PDU]"
"82","1.850955000","192.168.1.89","205.251.253.114","TCP","66","65455 > 443 [ACK] Seq=658 Ack=2897 Win=4005 Len=0 TSval=1460724065 TSecr=3092906729"
"83","1.850956000","192.168.1.89","205.251.253.114","TCP","66","65455 > 443 [ACK] Seq=658 Ack=5793 Win=3915 Len=0 TSval=1460724065 TSecr=3092906729"
"84","1.850983000","192.168.1.89","205.251.253.114","TCP","66","65455 > 443 [ACK] Seq=658 Ack=8689 Win=3824 Len=0 TSval=1460724065 TSecr=3092906729"
"85","1.851027000","205.251.253.114","192.168.1.89","TLSv1.2","1185","Application Data"
"86","1.851060000","192.168.1.89","205.251.253.114","TCP","66","65455 > 443 [ACK] Seq=658 Ack=9808 Win=3789 Len=0 TSval=1460724065 TSecr=3092906729"
"87","1.851533000","192.168.1.89","205.251.253.114","TCP","66","[TCP Window Update] 65455 > 443 [ACK] Seq=658 Ack=9808 Win=4096 Len=0 TSval=1460724066 TSecr=3092906729"
"88","1.859142000","192.168.1.89","205.251.242.54","TLSv1.2","1259","Application Data"
"89","1.870276000","192.168.1.89","205.251.253.114","TLSv1.2","538","Application Data"
"90","1.871423000","192.168.1.89","205.251.253.114","TLSv1.2","613","Application Data"
"91","1.871487000","192.168.1.89","205.251.253.114","TLSv1.2","533","Application Data"
"92","1.879412000","192.168.1.89","205.251.242.54","TCP","78","65473 > 443 [SYN] Seq=0 Win=65535 Len=0 MSS=1460 WS=32 TSval=1460724092 TSecr=0 SACK_PERM=1"
"93","1.880514000","192.168.1.89","205.251.242.54","TCP","78","65474 > 443 [SYN] Seq=0 Win=65535 Len=0 MSS=1460 WS=32 TSval=1460724093 TSecr=0 SACK_PERM=1"
"94","1.881701000","192.168.1.89","205.251.242.54","TCP","78","65475 > 443 [SYN] Seq=0 Win=65535 Len=0 MSS=1460 WS=32 TSval=1460724094 TSecr=0 SACK_PERM=1"
"95","1.889212000","205.251.253.114","192.168.1.89","TCP","1514","[TCP segment of a reassembled PDU]"
"96","1.889741000","205.251.253.114","192.168.1.89","TCP","1514","[TCP segment of a reassembled PDU]"
"97","1.889745000","205.251.253.114","192.168.1.89","TCP","1514","[TCP segment of a reassembled PDU]"
"98","1.889747000","205.251.253.114","192.168.1.89","TCP","1514","[TCP segment of a reassembled PDU]"
"99","1.889748000","205.251.253.114","192.168.1.89","TCP","1514","[TCP segment of a reassembled PDU]"
"100","1.889818000","192.168.1.89","205.251.253.114","TCP","66","65457 > 443 [ACK] Seq=548 Ack=2897 Win=4050 Len=0 TSval=1460724101 TSecr=3117743333"
"101","1.889818000","192.168.1.89","205.251.253.114","TCP","66","65457 > 443 [ACK] Seq=548 Ack=4345 Win=4096 Len=0 TSval=1460724101 TSecr=3117743333"
"102","1.889883000","192.168.1.89","205.251.253.114","TCP","66","65457 > 443 [ACK] Seq=548 Ack=7241 Win=4005 Len=0 TSval=1460724101 TSecr=3117743333"
"103","1.889970000","205.251.253.114","192.168.1.89","TLSv1.2","900","Application Data"
"104","1.890005000","192.168.1.89","205.251.253.114","TCP","66","65457 > 443 [ACK] Seq=548 Ack=8075 Win=4069 Len=0 TSval=1460724101 TSecr=3117743333"
"105","1.894730000","205.251.253.114","192.168.1.89","TCP","1514","[TCP segment of a reassembled PDU]"
"106","1.895165000","205.251.253.114","192.168.1.89","TCP","1514","[TCP segment of a reassembled PDU]"
"107","1.895168000","205.251.253.114","192.168.1.89","TCP","1514","[TCP segment of a reassembled PDU]"
"108","1.895169000","205.251.253.114","192.168.1.89","TCP","1514","[TCP segment of a reassembled PDU]"
"109","1.895170000","205.251.253.114","192.168.1.89","TCP","1514","[TCP segment of a reassembled PDU]"
"110","1.895172000","205.251.253.114","192.168.1.89","TCP","1514","[TCP segment of a reassembled PDU]"
"111","1.895208000","205.251.253.114","192.168.1.89","TCP","1514","[TCP segment of a reassembled PDU]"
"112","1.895210000","205.251.253.114","192.168.1.89","TCP","1514","[TCP segment of a reassembled PDU]"
"113","1.895242000","192.168.1.89","205.251.253.114","TCP","66","65454 > 443 [ACK] Seq=468 Ack=2897 Win=4005 Len=0 TSval=1460724106 TSecr=3092964530"
"114","1.895242000","192.168.1.89","205.251.253.114","TCP","66","65454 > 443 [ACK] Seq=468 Ack=5793 Win=3915 Len=0 TSval=1460724106 TSecr=3092964530"
"115","1.895314000","192.168.1.89","205.251.253.114","TCP","66","65454 > 443 [ACK] Seq=468 Ack=8689 Win=3824 Len=0 TSval=1460724106 TSecr=3092964530"
"116","1.895315000","192.168.1.89","205.251.253.114","TCP","66","65454 > 443 [ACK] Seq=468 Ack=11585 Win=3734 Len=0 TSval=1460724106 TSecr=3092964530"
"117","1.895431000","192.168.1.89","205.251.253.114","TCP","66","[TCP Window Update] 65454 > 443 [ACK] Seq=468 Ack=11585 Win=4096 Len=0 TSval=1460724106 TSecr=3092964530"
"118","1.896028000","205.251.253.114","192.168.1.89","TCP","1514","[TCP segment of a reassembled PDU]"
"119","1.896032000","205.251.253.114","192.168.1.89","TCP","1514","[TCP segment of a reassembled PDU]"
"120","1.896034000","205.251.253.114","192.168.1.89","TCP","1514","[TCP segment of a reassembled PDU]"
"121","1.896035000","205.251.242.54","192.168.1.89","TCP","62","443 > 65473 [SYN, ACK] Seq=0 Ack=1 Win=8190 Len=0 MSS=1460 WS=64"
"122","1.896087000","192.168.1.89","205.251.253.114","TCP","66","65454 > 443 [ACK] Seq=468 Ack=14481 Win=4005 Len=0 TSval=1460724107 TSecr=3092964530"
"123","1.896115000","192.168.1.89","205.251.242.54","TCP","54","65473 > 443 [ACK] Seq=1 Ack=1 Win=262144 Len=0"
"124","1.896221000","192.168.1.89","205.251.253.114","TCP","66","65454 > 443 [ACK] Seq=468 Ack=15929 Win=4096 Len=0 TSval=1460724107 TSecr=3092964530"
"125","1.896750000","192.168.1.89","205.251.242.54","TLSv1.2","297","Client Hello"
"126","1.897024000","205.251.242.54","192.168.1.89","TCP","62","443 > 65474 [SYN, ACK] Seq=0 Ack=1 Win=8190 Len=0 MSS=1460 WS=64"
"127","1.897077000","192.168.1.89","205.251.242.54","TCP","54","65474 > 443 [ACK] Seq=1 Ack=1 Win=262144 Len=0"
"128","1.897384000","192.168.1.89","205.251.242.54","TLSv1.2","297","Client Hello"
"129","1.898123000","205.251.253.114","192.168.1.89","TCP","1514","[TCP segment of a reassembled PDU]"
"130","1.898127000","205.251.253.114","192.168.1.89","TCP","1514","[TCP segment of a reassembled PDU]"
"131","1.898128000","205.251.253.114","192.168.1.89","TLSv1.2","574","Application Data"
"132","1.898190000","192.168.1.89","205.251.253.114","TCP","66","65455 > 443 [ACK] Seq=1130 Ack=12704 Win=4005 Len=0 TSval=1460724108 TSecr=3092906732"
"133","1.898191000","192.168.1.89","205.251.253.114","TCP","66","65455 > 443 [ACK] Seq=1130 Ack=13212 Win=3989 Len=0 TSval=1460724108 TSecr=3092906732"
"134","1.898253000","192.168.1.89","205.251.253.114","TCP","66","[TCP Window Update] 65455 > 443 [ACK] Seq=1130 Ack=13212 Win=4096 Len=0 TSval=1460724108 TSecr=3092906732"
"135","1.909820000","205.251.242.54","192.168.1.89","TLSv1.2","1004","Application Data"
"136","1.910097000","205.251.242.54","192.168.1.89","TLSv1.2","88","Application Data"
"137","1.910153000","192.168.1.89","205.251.242.54","TCP","54","65458 > 443 [ACK] Seq=1206 Ack=951 Win=8162 Len=0"
"138","1.910264000","192.168.1.89","205.251.242.54","TCP","54","65458 > 443 [ACK] Seq=1206 Ack=985 Win=8161 Len=0"
"139","1.910682000","205.251.242.54","192.168.1.89","TCP","62","443 > 65475 [SYN, ACK] Seq=0 Ack=1 Win=8190 Len=0 MSS=1460 WS=64"
"140","1.910747000","192.168.1.89","205.251.242.54","TCP","54","65475 > 443 [ACK] Seq=1 Ack=1 Win=262144 Len=0"
"141","1.911295000","205.251.253.114","192.168.1.89","TLSv1.2","1514","Application Data"
"142","1.911299000","205.251.253.114","192.168.1.89","TCP","1514","[TCP segment of a reassembled PDU]"
"143","1.911353000","192.168.1.89","205.251.253.114","TCP","66","65454 > 443 [ACK] Seq=468 Ack=18825 Win=4005 Len=0 TSval=1460724121 TSecr=3092964532"
"144","1.912086000","205.251.253.114","192.168.1.89","TCP","1514","[TCP segment of a reassembled PDU]"
"145","1.912091000","205.251.253.114","192.168.1.89","TCP","1514","[TCP segment of a reassembled PDU]"
"146","1.912093000","205.251.253.114","192.168.1.89","TCP","1514","[TCP segment of a reassembled PDU]"
"147","1.912094000","205.251.253.114","192.168.1.89","TCP","1514","[TCP segment of a reassembled PDU]"
"148","1.912095000","205.251.253.114","192.168.1.89","TCP","1514","[TCP segment of a reassembled PDU]"
"149","1.912240000","205.251.253.114","192.168.1.89","TCP","1514","[TCP segment of a reassembled PDU]"
"150","1.912245000","205.251.253.114","192.168.1.89","TCP","1514","[TCP segment of a reassembled PDU]"
"151","1.912279000","192.168.1.89","205.251.253.114","TCP","66","65454 > 443 [ACK] Seq=468 Ack=21721 Win=3915 Len=0 TSval=1460724122 TSecr=3092964532"
"152","1.912279000","192.168.1.89","205.251.253.114","TCP","66","65454 > 443 [ACK] Seq=468 Ack=24617 Win=3824 Len=0 TSval=1460724122 TSecr=3092964532"
"153","1.912356000","192.168.1.89","205.251.253.114","TCP","66","65454 > 443 [ACK] Seq=468 Ack=27513 Win=3734 Len=0 TSval=1460724122 TSecr=3092964532"
"154","1.913125000","205.251.253.114","192.168.1.89","TCP","1514","[TCP segment of a reassembled PDU]"
"155","1.913128000","205.251.253.114","192.168.1.89","TCP","1514","[TCP segment of a reassembled PDU]"
"156","1.913130000","205.251.242.54","192.168.1.89","TCP","60","[TCP Window Update] 443 > 65473 [ACK] Seq=1 Ack=1 Win=14848 Len=0"
"157","1.913182000","192.168.1.89","205.251.253.114","TCP","66","65454 > 443 [ACK] Seq=468 Ack=30409 Win=3643 Len=0 TSval=1460724123 TSecr=3092964532"
"158","1.914574000","192.168.1.89","205.251.253.114","TCP","66","65454 > 443 [ACK] Seq=468 Ack=31857 Win=4096 Len=0 TSval=1460724124 TSecr=3092964532"
"159","1.914889000","205.251.242.54","192.168.1.89","TCP","60","443 > 65473 [ACK] Seq=1 Ack=244 Win=15872 Len=0"
"160","1.914893000","205.251.242.54","192.168.1.89","TCP","60","443 > 65474 [ACK] Seq=1 Ack=244 Win=2096896 Len=0"
"161","1.915073000","192.168.1.89","205.251.242.54","TLSv1.2","297","Client Hello"
"162","1.915280000","192.168.1.89","205.251.242.54","TLSv1.2","1243","Application Data"
"163","1.915405000","205.251.242.54","192.168.1.89","TCP","60","[TCP Dup ACK 160#1] 443 > 65474 [ACK] Seq=1 Ack=244 Win=2096896 Len=0"
"164","1.916210000","205.251.242.54","192.168.1.89","TLSv1.2","208","Server Hello, Change Cipher Spec, Encrypted Handshake Message"
"165","1.916214000","205.251.242.54","192.168.1.89","TLSv1.2","208","Server Hello, Change Cipher Spec, Encrypted Handshake Message"
"166","1.916275000","192.168.1.89","205.251.242.54","TCP","54","65473 > 443 [ACK] Seq=244 Ack=155 Win=261984 Len=0"
"167","1.916276000","192.168.1.89","205.251.242.54","TCP","54","65474 > 443 [ACK] Seq=244 Ack=155 Win=261984 Len=0"
"168","1.916712000","192.168.1.89","205.251.242.54","TLSv1.2","170","Change Cipher Spec, Hello Request, Hello Request, Hello Request, Hello Request"
"169","1.918375000","192.168.1.89","205.251.242.54","TLSv1.2","170","Change Cipher Spec, Hello Request, Hello Request, Hello Request, Hello Request"
"170","1.919726000","192.168.1.89","205.251.242.54","TLSv1.2","1244","Application Data"
"171","1.919850000","192.168.1.89","205.251.242.54","TLSv1.2","1244","Application Data"
"172","1.929559000","205.251.253.114","192.168.1.89","TLSv1.2","1514","Application Data"
"173","1.929956000","205.251.253.114","192.168.1.89","TCP","1514","[TCP segment of a reassembled PDU]"
"174","1.929961000","205.251.253.114","192.168.1.89","TCP","1514","[TCP segment of a reassembled PDU]"
"175","1.929962000","205.251.253.114","192.168.1.89","TLSv1.2","1036","Application Data"
"176","1.930034000","192.168.1.89","205.251.253.114","TCP","66","65454 > 443 [ACK] Seq=468 Ack=34753 Win=4050 Len=0 TSval=1460724137 TSecr=3092964534"
"177","1.930034000","192.168.1.89","205.251.253.114","TCP","66","65454 > 443 [ACK] Seq=468 Ack=37171 Win=3975 Len=0 TSval=1460724137 TSecr=3092964534"
"178","1.930223000","192.168.1.89","205.251.253.114","TCP","66","[TCP Window Update] 65454 > 443 [ACK] Seq=468 Ack=37171 Win=4096 Len=0 TSval=1460724137 TSecr=3092964534"
"179","1.935255000","205.251.242.54","192.168.1.89","TCP","60","443 > 65473 [ACK] Seq=155 Ack=1550 Win=18176 Len=0"
"180","1.937552000","205.251.242.54","192.168.1.89","TCP","60","[TCP Window Update] 443 > 65475 [ACK] Seq=1 Ack=1 Win=14848 Len=0"
"181","1.939512000","192.168.1.89","205.251.253.114","TLSv1.2","551","Application Data"
"182","1.941997000","205.251.242.54","192.168.1.89","TCP","60","443 > 65474 [ACK] Seq=155 Ack=1550 Win=2095552 Len=0"
"183","1.943128000","205.251.242.54","192.168.1.89","TCP","60","443 > 65475 [ACK] Seq=1 Ack=244 Win=15872 Len=0"
"184","1.943353000","205.251.242.54","192.168.1.89","TLSv1.2","208","Server Hello, Change Cipher Spec, Encrypted Handshake Message"
"185","1.943514000","192.168.1.89","205.251.242.54","TCP","54","65475 > 443 [ACK] Seq=244 Ack=155 Win=261984 Len=0"
"186","1.949065000","192.168.1.89","205.251.242.54","TLSv1.2","170","Change Cipher Spec, Hello Request, Hello Request, Hello Request, Hello Request"
"187","1.956821000","192.168.1.89","205.251.253.114","TLSv1.2","502","Application Data"
"188","1.957810000","192.168.1.89","205.251.253.114","TLSv1.2","547","Application Data"
"189","1.957977000","192.168.1.89","205.251.253.114","TLSv1.2","539","Application Data"
"190","1.958110000","192.168.1.89","205.251.253.114","TLSv1.2","539","Application Data"
"191","1.958202000","192.168.1.89","205.251.253.114","TLSv1.2","541","Application Data"
"192","1.964098000","192.168.1.89","74.125.228.220","TLSv1.2","646","Application Data"
"193","1.965545000","205.251.242.54","192.168.1.89","TLSv1.2","1056","Application Data"
"194","1.965642000","192.168.1.89","205.251.242.54","TCP","54","65473 > 443 [ACK] Seq=1550 Ack=1157 Win=261120 Len=0"
"195","1.965900000","205.251.242.54","192.168.1.89","TLSv1.2","88","Application Data"
"196","1.965947000","192.168.1.89","205.251.242.54","TCP","54","65473 > 443 [ACK] Seq=1550 Ack=1191 Win=261088 Len=0"
"197","1.968452000","205.251.253.114","192.168.1.89","TCP","1514","[TCP segment of a reassembled PDU]"
"198","1.968987000","205.251.253.114","192.168.1.89","TCP","1514","[TCP segment of a reassembled PDU]"
"199","1.968991000","205.251.253.114","192.168.1.89","TCP","1514","[TCP segment of a reassembled PDU]"
"200","1.968992000","205.251.253.114","192.168.1.89","TCP","1514","[TCP segment of a reassembled PDU]"
"201","1.968993000","205.251.253.114","192.168.1.89","TCP","1514","[TCP segment of a reassembled PDU]"
"202","1.968995000","205.251.253.114","192.168.1.89","TCP","1514","[TCP segment of a reassembled PDU]"
"203","1.968996000","205.251.253.114","192.168.1.89","TLSv1.2","126","Application Data"
"204","1.969052000","192.168.1.89","205.251.253.114","TCP","66","65454 > 443 [ACK] Seq=953 Ack=40067 Win=4005 Len=0 TSval=1460724170 TSecr=3092964537"
"205","1.969053000","192.168.1.89","205.251.253.114","TCP","66","65454 > 443 [ACK] Seq=953 Ack=42963 Win=3915 Len=0 TSval=1460724170 TSecr=3092964537"
"206","1.969122000","192.168.1.89","205.251.253.114","TCP","66","65454 > 443 [ACK] Seq=953 Ack=45859 Win=3824 Len=0 TSval=1460724170 TSecr=3092964537"
"207","1.969122000","192.168.1.89","205.251.253.114","TCP","66","65454 > 443 [ACK] Seq=953 Ack=45919 Win=3822 Len=0 TSval=1460724170 TSecr=3092964537"
"208","1.969787000","205.251.242.54","192.168.1.89","TLSv1.2","1057","Application Data"
"209","1.969791000","205.251.242.54","192.168.1.89","TLSv1.2","88","Application Data"
"210","1.969844000","192.168.1.89","205.251.242.54","TCP","54","65458 > 443 [ACK] Seq=2395 Ack=1988 Win=8160 Len=0"
"211","1.969845000","192.168.1.89","205.251.242.54","TCP","54","65458 > 443 [ACK] Seq=2395 Ack=2022 Win=8159 Len=0"
"212","1.970250000","192.168.1.89","205.251.253.114","TCP","66","[TCP Window Update] 65454 > 443 [ACK] Seq=953 Ack=45919 Win=4096 Len=0 TSval=1460724171 TSecr=3092964537"
"213","1.974261000","205.251.253.114","192.168.1.89","TCP","1514","[TCP segment of a reassembled PDU]"
"214","1.974917000","205.251.253.114","192.168.1.89","TLSv1.2","593","Application Data"
"215","1.974991000","192.168.1.89","205.251.253.114","TCP","66","65457 > 443 [ACK] Seq=1029 Ack=10050 Win=4034 Len=0 TSval=1460724175 TSecr=3117743342"
"216","1.976443000","205.251.253.114","192.168.1.89","TCP","1514","[TCP segment of a reassembled PDU]"
"217","1.977031000","205.251.253.114","192.168.1.89","TCP","1514","[TCP segment of a reassembled PDU]"
"218","1.977041000","205.251.253.114","192.168.1.89","TCP","1514","[TCP segment of a reassembled PDU]"
"219","1.977044000","205.251.253.114","192.168.1.89","TLSv1.2","640","Application Data"
"220","1.977184000","192.168.1.89","205.251.253.114","TCP","66","65453 > 443 [ACK] Seq=474 Ack=2897 Win=4005 Len=0 TSval=1460724177 TSecr=3117749842"
"221","1.977184000","192.168.1.89","205.251.253.114","TCP","66","65453 > 443 [ACK] Seq=474 Ack=4919 Win=3942 Len=0 TSval=1460724177 TSecr=3117749842"
"222","1.978271000","192.168.1.89","205.251.253.114","TCP","66","[TCP Window Update] 65453 > 443 [ACK] Seq=474 Ack=4919 Win=4096 Len=0 TSval=1460724178 TSecr=3117749842"
"223","1.978568000","205.251.253.114","192.168.1.89","TCP","1514","[TCP segment of a reassembled PDU]"
"224","1.979165000","205.251.253.114","192.168.1.89","TCP","1514","[TCP segment of a reassembled PDU]"
"225","1.979169000","205.251.253.114","192.168.1.89","TCP","1514","[TCP segment of a reassembled PDU]"
"226","1.979170000","205.251.253.114","192.168.1.89","TCP","1514","[TCP segment of a reassembled PDU]"
"227","1.979171000","205.251.253.114","192.168.1.89","TCP","1514","[TCP segment of a reassembled PDU]"
"228","1.979172000","205.251.253.114","192.168.1.89","TCP","1514","[TCP segment of a reassembled PDU]"
"229","1.979281000","205.251.253.114","192.168.1.89","TCP","1514","[TCP segment of a reassembled PDU]"
"230","1.979284000","205.251.253.114","192.168.1.89","TCP","1514","[TCP segment of a reassembled PDU]"
"231","1.979286000","205.251.253.114","192.168.1.89","TCP","1514","[TCP segment of a reassembled PDU]"
"232","1.979299000","192.168.1.89","205.251.253.114","TCP","66","65452 > 443 [ACK] Seq=476 Ack=2897 Win=4050 Len=0 TSval=1460724178 TSecr=3092899836"
"233","1.979300000","192.168.1.89","205.251.253.114","TCP","66","65452 > 443 [ACK] Seq=476 Ack=5793 Win=3960 Len=0 TSval=1460724178 TSecr=3092899836"
"234","1.979300000","192.168.1.89","205.251.253.114","TCP","66","65452 > 443 [ACK] Seq=476 Ack=8689 Win=3869 Len=0 TSval=1460724179 TSecr=3092899836"
"235","1.979362000","192.168.1.89","205.251.253.114","TCP","66","65452 > 443 [ACK] Seq=476 Ack=11585 Win=3779 Len=0 TSval=1460724179 TSecr=3092899836"
"236","1.979542000","192.168.1.89","205.251.253.114","TCP","66","65452 > 443 [ACK] Seq=476 Ack=13033 Win=4096 Len=0 TSval=1460724179 TSecr=3092899836"
"237","1.980084000","205.251.253.114","192.168.1.89","TCP","1514","[TCP segment of a reassembled PDU]"
"238","1.980087000","205.251.253.114","192.168.1.89","TCP","1514","[TCP segment of a reassembled PDU]"
"239","1.980089000","205.251.253.114","192.168.1.89","TLSv1.2","626","Application Data"
"240","1.980135000","192.168.1.89","205.251.253.114","TCP","66","65452 > 443 [ACK] Seq=476 Ack=15929 Win=4005 Len=0 TSval=1460724179 TSecr=3092899836"
"241","1.980144000","192.168.1.89","205.251.253.114","TCP","66","65455 > 443 [ACK] Seq=1566 Ack=13772 Win=4078 Len=0 TSval=1460724179 TSecr=3092906741"
"242","1.980781000","205.251.253.114","192.168.1.89","TCP","1514","[TCP segment of a reassembled PDU]"
"243","1.980785000","205.251.253.114","192.168.1.89","TCP","1514","[TCP segment of a reassembled PDU]"
"244","1.980800000","205.251.253.114","192.168.1.89","TCP","1514","[TCP segment of a reassembled PDU]"
"245","1.980801000","205.251.253.114","192.168.1.89","TCP","1514","[TCP segment of a reassembled PDU]"
"246","1.980803000","205.251.253.114","192.168.1.89","TCP","1514","[TCP segment of a reassembled PDU]"
"247","1.980943000","205.251.253.114","192.168.1.89","TLSv1.2","1402","Application Data"
"248","1.980945000","205.251.253.114","192.168.1.89","TCP","1514","[TCP segment of a reassembled PDU]"
"249","1.980947000","205.251.253.114","192.168.1.89","TCP","1514","[TCP segment of a reassembled PDU]"
"250","1.980948000","205.251.253.114","192.168.1.89","TCP","1514","[TCP segment of a reassembled PDU]"
"251","1.980961000","192.168.1.89","205.251.253.114","TCP","66","65455 > 443 [ACK] Seq=1566 Ack=16668 Win=3988 Len=0 TSval=1460724180 TSecr=3092906741"
"252","1.980961000","192.168.1.89","205.251.253.114","TCP","66","65455 > 443 [ACK] Seq=1566 Ack=19564 Win=3897 Len=0 TSval=1460724180 TSecr=3092906741"
"253","1.981114000","205.251.253.114","192.168.1.89","TCP","1514","[TCP segment of a reassembled PDU]"
"254","1.981117000","205.251.253.114","192.168.1.89","TCP","1514","[TCP segment of a reassembled PDU]"
"255","1.981118000","205.251.253.114","192.168.1.89","TCP","1514","[TCP segment of a reassembled PDU]"
"256","1.981126000","192.168.1.89","205.251.253.114","TCP","66","65456 > 443 [ACK] Seq=474 Ack=2785 Win=4009 Len=0 TSval=1460724180 TSecr=3117749842"
"257","1.981127000","192.168.1.89","205.251.253.114","TCP","66","65455 > 443 [ACK] Seq=1566 Ack=22460 Win=3807 Len=0 TSval=1460724180 TSecr=3092906741"
"258","1.981171000","192.168.1.89","205.251.253.114","TCP","66","65455 > 443 [ACK] Seq=1566 Ack=25356 Win=3716 Len=0 TSval=1460724180 TSecr=3092906741"
"259","1.981171000","192.168.1.89","205.251.253.114","TCP","66","65455 > 443 [ACK] Seq=1566 Ack=28252 Win=3626 Len=0 TSval=1460724180 TSecr=3092906741"
"260","1.988985000","192.168.1.89","205.251.253.114","TCP","66","[TCP Window Update] 65452 > 443 [ACK] Seq=476 Ack=15929 Win=4096 Len=0 TSval=1460724187 TSecr=3092899836"
"261","1.989276000","192.168.1.89","205.251.253.114","TCP","66","[TCP Window Update] 65455 > 443 [ACK] Seq=1566 Ack=28252 Win=4096 Len=0 TSval=1460724187 TSecr=3092906741"
"262","1.997081000","74.125.228.220","192.168.1.89","TCP","66","443 > 65466 [ACK] Seq=1 Ack=581 Win=402 Len=0 TSval=2665962647 TSecr=1460724167"
"263","1.997515000","205.251.253.114","192.168.1.89","TCP","1514","[TCP segment of a reassembled PDU]"
"264","1.998014000","205.251.253.114","192.168.1.89","TLSv1.2","1514","Application Data"
"265","1.998017000","205.251.253.114","192.168.1.89","TCP","1514","[TCP segment of a reassembled PDU]"
"266","1.998019000","205.251.253.114","192.168.1.89","TCP","1514","[TCP segment of a reassembled PDU]"
"267","1.998020000","205.251.253.114","192.168.1.89","TCP","1514","[TCP segment of a reassembled PDU]"
"268","1.998022000","205.251.253.114","192.168.1.89","TCP","1514","[TCP segment of a reassembled PDU]"
"269","1.998080000","205.251.253.114","192.168.1.89","TCP","1514","[TCP segment of a reassembled PDU]"
"270","1.998099000","192.168.1.89","205.251.253.114","TCP","66","65455 > 443 [ACK] Seq=1566 Ack=31148 Win=4050 Len=0 TSval=1460724195 TSecr=3092906743"
"271","1.998100000","192.168.1.89","205.251.253.114","TCP","66","65455 > 443 [ACK] Seq=1566 Ack=34044 Win=3960 Len=0 TSval=1460724195 TSecr=3092906743"
"272","1.998100000","192.168.1.89","205.251.253.114","TCP","66","65455 > 443 [ACK] Seq=1566 Ack=36940 Win=3869 Len=0 TSval=1460724195 TSecr=3092906743"
"273","1.998892000","205.251.253.114","192.168.1.89","TCP","1514","[TCP segment of a reassembled PDU]"
"274","1.998896000","205.251.253.114","192.168.1.89","TCP","1514","[TCP segment of a reassembled PDU]"
"275","1.998897000","205.251.253.114","192.168.1.89","TCP","1514","[TCP segment of a reassembled PDU]"
"276","1.998898000","205.251.253.114","192.168.1.89","TLSv1.2","460","Application Data"
"277","1.998953000","192.168.1.89","205.251.253.114","TCP","66","65455 > 443 [ACK] Seq=1566 Ack=39836 Win=3779 Len=0 TSval=1460724196 TSecr=3092906743"
"278","1.998954000","192.168.1.89","205.251.253.114","TCP","66","65455 > 443 [ACK] Seq=1566 Ack=42732 Win=3688 Len=0 TSval=1460724196 TSecr=3092906743"
"279","1.999010000","192.168.1.89","205.251.253.114","TCP","66","65455 > 443 [ACK] Seq=1566 Ack=43126 Win=3676 Len=0 TSval=1460724196 TSecr=3092906743"
"280","1.999988000","192.168.1.89","205.251.253.114","TCP","66","[TCP Window Update] 65455 > 443 [ACK] Seq=1566 Ack=43126 Win=4096 Len=0 TSval=1460724197 TSecr=3092906743"
"281","2.000807000","205.251.253.114","192.168.1.89","TLSv1.2","1514","Application Data"
"282","2.001234000","205.251.253.114","192.168.1.89","TCP","1514","[TCP segment of a reassembled PDU]"
"283","2.001237000","205.251.253.114","192.168.1.89","TCP","1514","[TCP segment of a reassembled PDU]"
"284","2.001239000","205.251.253.114","192.168.1.89","TCP","1514","[TCP segment of a reassembled PDU]"
"285","2.001240000","205.251.253.114","192.168.1.89","TCP","1514","[TCP segment of a reassembled PDU]"
"286","2.001298000","192.168.1.89","205.251.253.114","TCP","66","65452 > 443 [ACK] Seq=476 Ack=18825 Win=4005 Len=0 TSval=1460724198 TSecr=3092899838"
"287","2.001327000","192.168.1.89","205.251.253.114","TCP","66","65452 > 443 [ACK] Seq=476 Ack=21721 Win=3915 Len=0 TSval=1460724198 TSecr=3092899838"
"288","2.001420000","205.251.253.114","192.168.1.89","TCP","1514","[TCP segment of a reassembled PDU]"
"289","2.001423000","205.251.253.114","192.168.1.89","TCP","1514","[TCP segment of a reassembled PDU]"
"290","2.001456000","192.168.1.89","205.251.253.114","TCP","66","65452 > 443 [ACK] Seq=476 Ack=24617 Win=3824 Len=0 TSval=1460724198 TSecr=3092899838"
"291","2.001701000","192.168.1.89","205.251.253.114","TCP","66","65452 > 443 [ACK] Seq=476 Ack=26065 Win=4096 Len=0 TSval=1460724198 TSecr=3092899838"
"292","2.002465000","205.251.253.114","192.168.1.89","TCP","1514","[TCP segment of a reassembled PDU]"
"293","2.002468000","205.251.253.114","192.168.1.89","TCP","1514","[TCP segment of a reassembled PDU]"
"294","2.002469000","205.251.253.114","192.168.1.89","TCP","1514","[TCP segment of a reassembled PDU]"
"295","2.002471000","205.251.253.114","192.168.1.89","TCP","1514","[TCP segment of a reassembled PDU]"
"296","2.002534000","192.168.1.89","205.251.253.114","TCP","66","65452 > 443 [ACK] Seq=476 Ack=28961 Win=4005 Len=0 TSval=1460724199 TSecr=3092899838"
"297","2.002535000","192.168.1.89","205.251.253.114","TCP","66","65452 > 443 [ACK] Seq=476 Ack=31857 Win=3915 Len=0 TSval=1460724199 TSecr=3092899838"
"298","2.003481000","192.168.1.89","205.251.253.114","TLSv1.2","572","Application Data"
"299","2.005605000","205.251.242.54","192.168.1.89","TCP","60","443 > 65475 [ACK] Seq=155 Ack=360 Win=15872 Len=0"
"300","2.006156000","205.251.242.54","192.168.1.89","TLSv1.2","1057","Application Data"
"301","2.006221000","192.168.1.89","205.251.242.54","TCP","54","65474 > 443 [ACK] Seq=1550 Ack=1158 Win=261120 Len=0"
"302","2.006517000","205.251.242.54","192.168.1.89","TLSv1.2","88","Application Data"
"303","2.006585000","192.168.1.89","205.251.242.54","TCP","54","65474 > 443 [ACK] Seq=1550 Ack=1192 Win=261088 Len=0"
"304","2.014791000","192.168.1.89","205.251.253.114","TLSv1.2","539","Application Data"
"305","2.014963000","192.168.1.89","205.251.253.114","TCP","66","[TCP Window Update] 65452 > 443 [ACK] Seq=476 Ack=31857 Win=4096 Len=0 TSval=1460724210 TSecr=3092899838"
"306","2.017213000","192.168.1.89","205.251.253.114","TLSv1.2","537","Application Data"
"307","2.017406000","192.168.1.89","205.251.253.114","TLSv1.2","544","Application Data"
"308","2.018098000","205.251.253.114","192.168.1.89","TLSv1.2","1514","Application Data"
"309","2.018673000","205.251.253.114","192.168.1.89","TCP","1514","[TCP segment of a reassembled PDU]"
"310","2.018677000","205.251.253.114","192.168.1.89","TCP","1514","[TCP segment of a reassembled PDU]"
"311","2.018679000","205.251.253.114","192.168.1.89","TCP","1514","[TCP segment of a reassembled PDU]"
"312","2.018680000","205.251.253.114","192.168.1.89","TCP","1514","[TCP segment of a reassembled PDU]"
"313","2.018738000","192.168.1.89","205.251.253.114","TCP","66","65452 > 443 [ACK] Seq=476 Ack=34753 Win=4050 Len=0 TSval=1460724213 TSecr=3092899840"
"314","2.018738000","192.168.1.89","205.251.253.114","TCP","66","65452 > 443 [ACK] Seq=476 Ack=37649 Win=3960 Len=0 TSval=1460724213 TSecr=3092899840"
"315","2.018853000","205.251.253.114","192.168.1.89","TCP","1514","[TCP segment of a reassembled PDU]"
"316","2.018856000","205.251.253.114","192.168.1.89","TCP","1514","[TCP segment of a reassembled PDU]"
"317","2.018857000","205.251.253.114","192.168.1.89","TCP","1514","[TCP segment of a reassembled PDU]"
"318","2.018858000","205.251.253.114","192.168.1.89","TLSv1.2","607","Application Data"
"319","2.018889000","192.168.1.89","205.251.253.114","TCP","66","65452 > 443 [ACK] Seq=476 Ack=39097 Win=4096 Len=0 TSval=1460724213 TSecr=3092899840"
"320","2.018923000","192.168.1.89","205.251.253.114","TCP","66","65452 > 443 [ACK] Seq=476 Ack=41993 Win=4005 Len=0 TSval=1460724213 TSecr=3092899840"
"321","2.018923000","192.168.1.89","205.251.253.114","TCP","66","[TCP Window Update] 65452 > 443 [ACK] Seq=476 Ack=41993 Win=4096 Len=0 TSval=1460724213 TSecr=3092899840"
"322","2.018936000","192.168.1.89","205.251.253.114","TCP","66","65452 > 443 [ACK] Seq=476 Ack=43982 Win=4033 Len=0 TSval=1460724213 TSecr=3092899840"
"323","2.019600000","205.251.253.114","192.168.1.89","TCP","1514","[TCP segment of a reassembled PDU]"
"324","2.019604000","205.251.253.114","192.168.1.89","TCP","1514","[TCP segment of a reassembled PDU]"
"325","2.019606000","205.251.253.114","192.168.1.89","TCP","1514","[TCP segment of a reassembled PDU]"
"326","2.019607000","205.251.253.114","192.168.1.89","TLSv1.2","904","Application Data"
"327","2.019608000","205.251.253.114","192.168.1.89","TLSv1.2","100","Application Data"
"328","2.019663000","192.168.1.89","205.251.253.114","TCP","66","65457 > 443 [ACK] Seq=1535 Ack=12946 Win=4005 Len=0 TSval=1460724213 TSecr=3117743346"
"329","2.019663000","192.168.1.89","205.251.253.114","TCP","66","65457 > 443 [ACK] Seq=1535 Ack=15232 Win=3934 Len=0 TSval=1460724213 TSecr=3117743346"
"330","2.019676000","192.168.1.89","205.251.253.114","TCP","66","65457 > 443 [ACK] Seq=1535 Ack=15266 Win=3933 Len=0 TSval=1460724213 TSecr=3117743346"
"331","2.020310000","192.168.1.89","205.251.253.114","TCP","66","[TCP Window Update] 65457 > 443 [ACK] Seq=1535 Ack=15266 Win=4096 Len=0 TSval=1460724214 TSecr=3117743346"
"332","2.027832000","74.125.228.220","192.168.1.89","TLSv1.2","166","Application Data"
"333","2.027914000","192.168.1.89","74.125.228.220","TCP","66","65466 > 443 [ACK] Seq=581 Ack=101 Win=4092 Len=0 TSval=1460724221 TSecr=2665962682"
"334","2.028001000","192.168.1.89","205.251.253.114","TLSv1.2","556","Application Data"
"335","2.028333000","74.125.228.220","192.168.1.89","TLSv1.2","1484","Application Data"
"336","2.028337000","74.125.228.220","192.168.1.89","TLSv1.2","1484","Application Data"
"337","2.028338000","74.125.228.220","192.168.1.89","TLSv1.2","1484","Application Data"
"338","2.028340000","74.125.228.220","192.168.1.89","TLSv1.2","366","Application Data"
"339","2.028341000","74.125.228.220","192.168.1.89","TLSv1.2","112","Application Data"
"340","2.028414000","192.168.1.89","74.125.228.220","TCP","66","65466 > 443 [ACK] Seq=581 Ack=1519 Win=4051 Len=0 TSval=1460724221 TSecr=2665962682"
"341","2.028431000","192.168.1.89","74.125.228.220","TCP","66","65466 > 443 [ACK] Seq=581 Ack=2937 Win=4007 Len=0 TSval=1460724221 TSecr=2665962682"
