"No.","Time","Source","Destination","Protocol","Length","Info"
"3","0.039993000","172.20.7.83","31.13.71.1","TLSv1.2","280","Application Data"
"4","0.040073000","172.20.7.83","31.13.71.1","TLSv1.2","1177","Application Data"
"5","0.147705000","172.20.7.83","119.254.11.66","TCP","54","56052 > 80 [ACK] Seq=1 Ack=1 Win=4117 Len=0"
"6","0.190860000","172.20.7.83","117.135.175.158","TCP","54","56185 > 80 [ACK] Seq=1 Ack=1 Win=8192 Len=0"
"7","0.194351000","172.20.7.83","117.135.175.158","TCP","54","56186 > 80 [ACK] Seq=1 Ack=1 Win=8192 Len=0"
"8","0.198987000","172.20.7.83","117.135.175.158","TCP","54","56187 > 80 [ACK] Seq=1 Ack=1 Win=8192 Len=0"
"9","0.466557000","172.20.7.83","31.13.71.1","TLSv1.2","1391","[TCP Retransmission] Application Data, Application Data"
"10","0.500479000","216.58.216.206","172.20.7.83","TCP","66","443 > 55966 [ACK] Seq=1 Ack=1 Win=483 Len=0 TSval=3192835723 TSecr=1626007875"
"11","0.535843000","31.13.71.1","172.20.7.83","TLSv1.2","108","Application Data"
"12","0.535923000","172.20.7.83","31.13.71.1","TCP","66","50845 > 443 [ACK] Seq=1326 Ack=43 Win=1095 Len=0 TSval=1626188803 TSecr=1669045627"
"13","0.608533000","31.13.71.1","172.20.7.83","TCP","66","[TCP Window Update] 443 > 50845 [ACK] Seq=43 Ack=1326 Win=2043 Len=0 TSval=1669045692 TSecr=1626188734"
"14","0.643662000","31.13.71.1","172.20.7.83","TLSv1.2","626","Application Data"
"15","0.643667000","31.13.71.1","172.20.7.83","TCP","1464","[TCP segment of a reassembled PDU]"
"16","0.643707000","31.13.71.1","172.20.7.83","TLSv1.2","285","Application Data"
"17","0.643708000","31.13.71.1","172.20.7.83","TLSv1.2","114","Application Data"
"18","0.643858000","172.20.7.83","31.13.71.1","TCP","66","50845 > 443 [ACK] Seq=1326 Ack=603 Win=1078 Len=0 TSval=1626188910 TSecr=1669045732"
"19","0.643858000","172.20.7.83","31.13.71.1","TCP","66","50845 > 443 [ACK] Seq=1326 Ack=2220 Win=1027 Len=0 TSval=1626188910 TSecr=1669045732"
"20","0.643859000","172.20.7.83","31.13.71.1","TCP","66","50845 > 443 [ACK] Seq=1326 Ack=2268 Win=1026 Len=0 TSval=1626188910 TSecr=1669045732"
"21","0.834048000","119.254.11.66","172.20.7.83","TCP","66","[TCP ACKed unseen segment] 80 > 56052 [ACK] Seq=1 Ack=2 Win=8326 Len=0 TSval=2770078420 TSecr=1625841307"
"22","0.834129000","172.20.7.83","119.254.11.66","TCP","66","[TCP Previous segment not captured] 56052 > 80 [FIN, ACK] Seq=2 Ack=1 Win=4117 Len=0 TSval=1626189099 TSecr=2770078420"
"23","0.901299000","108.160.167.175","172.20.7.83","TLSv1","391","Application Data"
"24","0.901392000","172.20.7.83","108.160.167.175","TCP","66","52944 > 443 [ACK] Seq=1 Ack=326 Win=4085 Len=0 TSval=1626189166 TSecr=503876051"
"25","0.907047000","172.20.7.83","108.160.167.175","TLSv1","460","Application Data, Application Data"
"26","1.030582000","108.160.167.175","172.20.7.83","TCP","66","443 > 52944 [ACK] Seq=326 Ack=395 Win=83 Len=0 TSval=503876083 TSecr=1626189171"
"27","1.267506000","119.254.11.66","172.20.7.83","ICMP","94","Destination unreachable (Host administratively prohibited)"
"28","1.465996000","172.20.7.83","119.254.11.66","TCP","54","56060 > 80 [ACK] Seq=1 Ack=1 Win=4117 Len=0"
"32","1.711192000","172.20.7.83","216.58.216.206","TCP","78","56713 > 443 [SYN] Seq=0 Win=65535 Len=0 MSS=1460 WS=32 TSval=1626189974 TSecr=0 SACK_PERM=1"
"34","1.712172000","172.20.7.83","74.125.226.82","TCP","78","56714 > 443 [SYN] Seq=0 Win=65535 Len=0 MSS=1460 WS=32 TSval=1626189975 TSecr=0 SACK_PERM=1"
"35","1.762938000","216.58.216.206","172.20.7.83","TCP","74","443 > 56713 [SYN, ACK] Seq=0 Ack=1 Win=42540 Len=0 MSS=1430 SACK_PERM=1 TSval=3192809073 TSecr=1626189974 WS=128"
"36","1.763027000","172.20.7.83","216.58.216.206","TCP","66","56713 > 443 [ACK] Seq=1 Ack=1 Win=131872 Len=0 TSval=1626190025 TSecr=3192809073"
"37","1.764172000","172.20.7.83","216.58.216.206","TLSv1.2","583","Client Hello"
"38","1.811271000","216.58.216.206","172.20.7.83","TCP","66","443 > 56713 [ACK] Seq=1 Ack=518 Win=43648 Len=0 TSval=3192809125 TSecr=1626190026"
"39","1.811451000","216.58.216.206","172.20.7.83","TLSv1.2","220","Server Hello, Change Cipher Spec, Hello Request, Hello Request"
"40","1.811517000","172.20.7.83","216.58.216.206","TCP","66","56713 > 443 [ACK] Seq=518 Ack=155 Win=131712 Len=0 TSval=1626190073 TSecr=3192809125"
"41","1.812097000","172.20.7.83","216.58.216.206","TLSv1.2","282","Change Cipher Spec, Hello Request, Hello Request, Hello Request, Hello Request"
"42","1.863217000","216.58.216.206","172.20.7.83","TLSv1.2","122","Application Data"
"43","1.863297000","172.20.7.83","216.58.216.206","TCP","66","56713 > 443 [ACK] Seq=734 Ack=211 Win=131648 Len=0 TSval=1626190124 TSecr=3192809170"
"44","1.863386000","216.58.216.206","172.20.7.83","TLSv1.2","108","Application Data"
"45","1.863419000","172.20.7.83","216.58.216.206","TCP","66","56713 > 443 [ACK] Seq=734 Ack=253 Win=131616 Len=0 TSval=1626190124 TSecr=3192809170"
"46","1.864290000","74.125.226.82","172.20.7.83","TCP","74","443 > 56714 [SYN, ACK] Seq=0 Ack=1 Win=42540 Len=0 MSS=1430 SACK_PERM=1 TSval=2513387048 TSecr=1626189975 WS=128"
"47","1.864348000","172.20.7.83","74.125.226.82","TCP","66","56714 > 443 [ACK] Seq=1 Ack=1 Win=131872 Len=0 TSval=1626190125 TSecr=2513387048"
"48","1.884085000","172.20.7.83","74.125.226.82","TLSv1.2","583","Client Hello"
"51","1.902042000","119.254.11.66","172.20.7.83","TCP","66","[TCP ACKed unseen segment] 80 > 56060 [ACK] Seq=1 Ack=2 Win=8326 Len=0 TSval=798896205 TSecr=1625842310"
"52","1.902142000","172.20.7.83","119.254.11.66","TCP","66","[TCP Previous segment not captured] 56060 > 80 [FIN, ACK] Seq=2 Ack=1 Win=4117 Len=0 TSval=1626190162 TSecr=798896205"
"54","1.935087000","172.20.7.83","111.206.227.118","TCP","78","56715 > 80 [SYN] Seq=0 Win=65535 Len=0 MSS=1460 WS=32 TSval=1626190194 TSecr=0 SACK_PERM=1"
"55","2.011980000","172.20.7.83","66.29.212.110","TCP","78","56716 > 80 [SYN] Seq=0 Win=65535 Len=0 MSS=1460 WS=32 TSval=1626190269 TSecr=0 SACK_PERM=1"
"56","2.023888000","172.20.7.83","72.21.91.8","TCP","78","56717 > 80 [SYN] Seq=0 Win=65535 Len=0 MSS=1460 WS=32 TSval=1626190282 TSecr=0 SACK_PERM=1"
"57","2.024160000","172.20.7.83","72.21.91.8","TCP","78","56718 > 80 [SYN] Seq=0 Win=65535 Len=0 MSS=1460 WS=32 TSval=1626190282 TSecr=0 SACK_PERM=1"
"58","2.030753000","74.125.226.82","172.20.7.83","TCP","66","443 > 56714 [ACK] Seq=1 Ack=518 Win=43648 Len=0 TSval=2513387220 TSecr=1626190144"
"59","2.031321000","74.125.226.82","172.20.7.83","TLSv1.2","220","Server Hello, Change Cipher Spec, Hello Request, Hello Request"
"60","2.031391000","172.20.7.83","74.125.226.82","TCP","66","56714 > 443 [ACK] Seq=518 Ack=155 Win=131712 Len=0 TSval=1626190289 TSecr=2513387220"
"61","2.035959000","172.20.7.83","74.125.226.82","TLSv1.2","282","Change Cipher Spec, Hello Request, Hello Request, Hello Request, Hello Request"
"62","2.043447000","72.21.91.8","172.20.7.83","TCP","74","80 > 56717 [SYN, ACK] Seq=0 Ack=1 Win=14480 Len=0 MSS=1460 SACK_PERM=1 TSval=2015222136 TSecr=1626190282 WS=512"
"63","2.043528000","172.20.7.83","72.21.91.8","TCP","66","56717 > 80 [ACK] Seq=1 Ack=1 Win=131744 Len=0 TSval=1626190301 TSecr=2015222136"
"64","2.045604000","72.21.91.8","172.20.7.83","TCP","74","80 > 56718 [SYN, ACK] Seq=0 Ack=1 Win=14480 Len=0 MSS=1460 SACK_PERM=1 TSval=2015130063 TSecr=1626190282 WS=512"
"65","2.045677000","172.20.7.83","72.21.91.8","TCP","66","56718 > 80 [ACK] Seq=1 Ack=1 Win=131744 Len=0 TSval=1626190303 TSecr=2015130063"
"68","2.173448000","66.29.212.110","172.20.7.83","TCP","74","80 > 56716 [SYN, ACK] Seq=0 Ack=1 Win=8192 Len=0 MSS=1460 WS=256 SACK_PERM=1 TSval=258214754 TSecr=1626190269"
"69","2.173533000","172.20.7.83","66.29.212.110","TCP","66","56716 > 80 [ACK] Seq=1 Ack=1 Win=131744 Len=0 TSval=1626190430 TSecr=258214754"
"70","2.200106000","74.125.226.82","172.20.7.83","TLSv1.2","122","Application Data"
"71","2.200187000","172.20.7.83","74.125.226.82","TCP","66","56714 > 443 [ACK] Seq=734 Ack=211 Win=131648 Len=0 TSval=1626190456 TSecr=2513387392"
"72","2.200289000","74.125.226.82","172.20.7.83","TLSv1.2","108","Application Data"
"73","2.200330000","172.20.7.83","74.125.226.82","TCP","66","56714 > 443 [ACK] Seq=734 Ack=253 Win=131616 Len=0 TSval=1626190456 TSecr=2513387392"
"74","2.230871000","111.206.227.118","172.20.7.83","TCP","66","80 > 56715 [SYN, ACK] Seq=0 Ack=1 Win=14600 Len=0 MSS=1460 SACK_PERM=1 WS=128"
"75","2.230958000","172.20.7.83","111.206.227.118","TCP","54","56715 > 80 [ACK] Seq=1 Ack=1 Win=262144 Len=0"
"77","2.246014000","172.20.7.83","62.138.116.3","TCP","78","56719 > 80 [SYN] Seq=0 Win=65535 Len=0 MSS=1460 WS=32 TSval=1626190501 TSecr=0 SACK_PERM=1"
"79","2.247698000","172.20.7.83","62.138.116.3","TCP","78","56720 > 80 [SYN] Seq=0 Win=65535 Len=0 MSS=1460 WS=32 TSval=1626190502 TSecr=0 SACK_PERM=1"
"80","2.247823000","172.20.7.83","62.138.116.3","TCP","78","56721 > 80 [SYN] Seq=0 Win=65535 Len=0 MSS=1460 WS=32 TSval=1626190502 TSecr=0 SACK_PERM=1"
"83","2.408921000","62.138.116.3","172.20.7.83","TCP","74","80 > 56719 [SYN, ACK] Seq=0 Ack=1 Win=14480 Len=0 MSS=1460 SACK_PERM=1 TSval=2115764877 TSecr=1626190501 WS=128"
"84","2.408998000","172.20.7.83","62.138.116.3","TCP","66","56719 > 80 [ACK] Seq=1 Ack=1 Win=131744 Len=0 TSval=1626190663 TSecr=2115764877"
"85","2.417118000","62.138.116.3","172.20.7.83","TCP","74","80 > 56721 [SYN, ACK] Seq=0 Ack=1 Win=14480 Len=0 MSS=1460 SACK_PERM=1 TSval=2043656560 TSecr=1626190502 WS=128"
"86","2.417193000","172.20.7.83","62.138.116.3","TCP","66","56721 > 80 [ACK] Seq=1 Ack=1 Win=131744 Len=0 TSval=1626190671 TSecr=2043656560"
"87","2.417573000","62.138.116.3","172.20.7.83","TCP","74","80 > 56720 [SYN, ACK] Seq=0 Ack=1 Win=14480 Len=0 MSS=1460 SACK_PERM=1 TSval=2043656561 TSecr=1626190502 WS=128"
"88","2.417626000","172.20.7.83","62.138.116.3","TCP","66","56720 > 80 [ACK] Seq=1 Ack=1 Win=131744 Len=0 TSval=1626190671 TSecr=2043656561"
"90","2.425728000","172.20.7.83","64.30.234.73","TCP","78","56722 > 80 [SYN] Seq=0 Win=65535 Len=0 MSS=1460 WS=32 TSval=1626190679 TSecr=0 SACK_PERM=1"
"92","2.440961000","172.20.7.83","192.5.110.39","TCP","78","56723 > 80 [SYN] Seq=0 Win=65535 Len=0 MSS=1460 WS=32 TSval=1626190694 TSecr=0 SACK_PERM=1"
"93","2.441023000","172.20.7.83","192.5.110.39","TCP","78","56724 > 80 [SYN] Seq=0 Win=65535 Len=0 MSS=1460 WS=32 TSval=1626190694 TSecr=0 SACK_PERM=1"
"94","2.449998000","192.5.110.39","172.20.7.83","TCP","74","80 > 56723 [SYN, ACK] Seq=0 Ack=1 Win=14480 Len=0 MSS=1460 SACK_PERM=1 TSval=661093009 TSecr=1626190694 WS=32"
"95","2.450078000","172.20.7.83","192.5.110.39","TCP","66","56723 > 80 [ACK] Seq=1 Ack=1 Win=131744 Len=0 TSval=1626190703 TSecr=661093009"
"96","2.450284000","192.5.110.39","172.20.7.83","TCP","74","80 > 56724 [SYN, ACK] Seq=0 Ack=1 Win=14480 Len=0 MSS=1460 SACK_PERM=1 TSval=661093009 TSecr=1626190694 WS=32"
"97","2.450327000","172.20.7.83","192.5.110.39","TCP","66","56724 > 80 [ACK] Seq=1 Ack=1 Win=131744 Len=0 TSval=1626190703 TSecr=661093009"
"98","2.462629000","172.20.7.83","119.254.11.66","TCP","78","56725 > 80 [SYN] Seq=0 Win=65535 Len=0 MSS=1460 WS=32 TSval=1626190715 TSecr=0 SACK_PERM=1"
"99","2.464796000","172.20.7.83","119.254.11.68","TCP","78","56726 > 80 [SYN] Seq=0 Win=65535 Len=0 MSS=1460 WS=32 TSval=1626190717 TSecr=0 SACK_PERM=1"
"100","2.464894000","172.20.7.83","119.254.11.68","TCP","78","56727 > 80 [SYN] Seq=0 Win=65535 Len=0 MSS=1460 WS=32 TSval=1626190717 TSecr=0 SACK_PERM=1"
"101","2.465044000","172.20.7.83","119.254.11.68","TCP","78","56728 > 80 [SYN] Seq=0 Win=65535 Len=0 MSS=1460 WS=32 TSval=1626190717 TSecr=0 SACK_PERM=1"
"102","2.465466000","172.20.7.83","119.254.11.68","TCP","78","56729 > 80 [SYN] Seq=0 Win=65535 Len=0 MSS=1460 WS=32 TSval=1626190717 TSecr=0 SACK_PERM=1"
"103","2.466712000","172.20.7.83","119.254.11.66","TCP","78","56730 > 80 [SYN] Seq=0 Win=65535 Len=0 MSS=1460 WS=32 TSval=1626190718 TSecr=0 SACK_PERM=1"
"104","2.466949000","172.20.7.83","119.254.11.66","TCP","78","56731 > 80 [SYN] Seq=0 Win=65535 Len=0 MSS=1460 WS=32 TSval=1626190718 TSecr=0 SACK_PERM=1"
"105","2.467194000","172.20.7.83","119.254.11.66","TCP","78","56732 > 80 [SYN] Seq=0 Win=65535 Len=0 MSS=1460 WS=32 TSval=1626190718 TSecr=0 SACK_PERM=1"
"106","2.467656000","172.20.7.83","119.254.11.66","TCP","78","56733 > 80 [SYN] Seq=0 Win=65535 Len=0 MSS=1460 WS=32 TSval=1626190718 TSecr=0 SACK_PERM=1"
"107","2.467932000","172.20.7.83","119.254.11.66","TCP","78","56734 > 80 [SYN] Seq=0 Win=65535 Len=0 MSS=1460 WS=32 TSval=1626190719 TSecr=0 SACK_PERM=1"
"108","2.468727000","172.20.7.83","119.254.11.66","TCP","78","56735 > 80 [SYN] Seq=0 Win=65535 Len=0 MSS=1460 WS=32 TSval=1626190719 TSecr=0 SACK_PERM=1"
"109","2.469137000","172.20.7.83","119.254.11.66","TCP","78","56736 > 80 [SYN] Seq=0 Win=65535 Len=0 MSS=1460 WS=32 TSval=1626190720 TSecr=0 SACK_PERM=1"
"110","2.469644000","172.20.7.83","119.254.11.66","TCP","78","56737 > 80 [SYN] Seq=0 Win=65535 Len=0 MSS=1460 WS=32 TSval=1626190720 TSecr=0 SACK_PERM=1"
"111","2.470059000","172.20.7.83","119.254.11.66","TCP","78","56738 > 80 [SYN] Seq=0 Win=65535 Len=0 MSS=1460 WS=32 TSval=1626190721 TSecr=0 SACK_PERM=1"
"112","2.470327000","172.20.7.83","119.254.11.66","TCP","78","56739 > 80 [SYN] Seq=0 Win=65535 Len=0 MSS=1460 WS=32 TSval=1626190721 TSecr=0 SACK_PERM=1"
"113","2.470526000","172.20.7.83","119.254.11.66","TCP","78","56740 > 80 [SYN] Seq=0 Win=65535 Len=0 MSS=1460 WS=32 TSval=1626190721 TSecr=0 SACK_PERM=1"
"114","2.473951000","64.30.234.73","172.20.7.83","TCP","58","80 > 56722 [SYN, ACK] Seq=0 Ack=1 Win=8190 Len=0 MSS=1460"
"115","2.474043000","172.20.7.83","64.30.234.73","TCP","54","56722 > 80 [ACK] Seq=1 Ack=1 Win=65535 Len=0"
"117","2.535426000","172.20.7.83","192.229.163.158","TCP","78","56741 > 80 [SYN] Seq=0 Win=65535 Len=0 MSS=1460 WS=32 TSval=1626190784 TSecr=0 SACK_PERM=1"
"118","2.535492000","172.20.7.83","192.229.163.158","TCP","78","56742 > 80 [SYN] Seq=0 Win=65535 Len=0 MSS=1460 WS=32 TSval=1626190785 TSecr=0 SACK_PERM=1"
"119","2.558548000","192.229.163.158","172.20.7.83","TCP","74","80 > 56742 [SYN, ACK] Seq=0 Ack=1 Win=14480 Len=0 MSS=1460 SACK_PERM=1 TSval=3359971035 TSecr=1626190785 WS=512"
"120","2.558635000","172.20.7.83","192.229.163.158","TCP","66","56742 > 80 [ACK] Seq=1 Ack=1 Win=131744 Len=0 TSval=1626190808 TSecr=3359971035"
"121","2.559906000","192.229.163.158","172.20.7.83","TCP","74","80 > 56741 [SYN, ACK] Seq=0 Ack=1 Win=14480 Len=0 MSS=1460 SACK_PERM=1 TSval=2015227058 TSecr=1626190784 WS=512"
"122","2.559975000","172.20.7.83","192.229.163.158","TCP","66","56741 > 80 [ACK] Seq=1 Ack=1 Win=131744 Len=0 TSval=1626190809 TSecr=2015227058"
"125","2.671854000","119.254.11.68","172.20.7.83","TCP","74","80 > 56729 [SYN, ACK] Seq=0 Ack=1 Win=65535 Len=0 MSS=1460 WS=8 SACK_PERM=1 TSval=41530033 TSecr=1626190717"
"126","2.671943000","172.20.7.83","119.254.11.68","TCP","66","56729 > 80 [ACK] Seq=1 Ack=1 Win=131744 Len=0 TSval=1626190920 TSecr=41530033"
"127","2.672234000","119.254.11.68","172.20.7.83","TCP","74","80 > 56726 [SYN, ACK] Seq=0 Ack=1 Win=65535 Len=0 MSS=1460 WS=8 SACK_PERM=1 TSval=3002697306 TSecr=1626190717"
"128","2.672237000","119.254.11.68","172.20.7.83","TCP","74","80 > 56727 [SYN, ACK] Seq=0 Ack=1 Win=65535 Len=0 MSS=1460 WS=8 SACK_PERM=1 TSval=1851865660 TSecr=1626190717"
"129","2.672278000","172.20.7.83","119.254.11.68","TCP","66","56726 > 80 [ACK] Seq=1 Ack=1 Win=131744 Len=0 TSval=1626190920 TSecr=3002697306"
"130","2.672330000","172.20.7.83","119.254.11.68","TCP","66","56727 > 80 [ACK] Seq=1 Ack=1 Win=131744 Len=0 TSval=1626190920 TSecr=1851865660"
"131","2.672644000","119.254.11.68","172.20.7.83","TCP","74","80 > 56728 [SYN, ACK] Seq=0 Ack=1 Win=65535 Len=0 MSS=1460 WS=8 SACK_PERM=1 TSval=2015775009 TSecr=1626190717"
"132","2.672693000","172.20.7.83","119.254.11.68","TCP","66","56728 > 80 [ACK] Seq=1 Ack=1 Win=131744 Len=0 TSval=1626190920 TSecr=2015775009"
"133","2.746826000","172.20.7.83","49.129.31.76","TCP","78","56743 > 80 [SYN] Seq=0 Win=65535 Len=0 MSS=1460 WS=32 TSval=1626190993 TSecr=0 SACK_PERM=1"
"134","2.747937000","172.20.7.83","49.129.31.76","TCP","78","56744 > 80 [SYN] Seq=0 Win=65535 Len=0 MSS=1460 WS=32 TSval=1626190994 TSecr=0 SACK_PERM=1"
"135","2.748013000","172.20.7.83","49.129.31.76","TCP","78","56745 > 80 [SYN] Seq=0 Win=65535 Len=0 MSS=1460 WS=32 TSval=1626190994 TSecr=0 SACK_PERM=1"
"137","2.766252000","172.20.7.83","66.135.211.132","TCP","78","56746 > 80 [SYN] Seq=0 Win=65535 Len=0 MSS=1460 WS=32 TSval=1626191012 TSecr=0 SACK_PERM=1"
"139","2.804818000","172.20.7.83","104.69.219.52","TCP","78","56747 > 80 [SYN] Seq=0 Win=65535 Len=0 MSS=1460 WS=32 TSval=1626191050 TSecr=0 SACK_PERM=1"
"140","2.805091000","172.20.7.83","104.69.219.52","TCP","78","56748 > 80 [SYN] Seq=0 Win=65535 Len=0 MSS=1460 WS=32 TSval=1626191050 TSecr=0 SACK_PERM=1"
"142","2.880816000","104.69.219.52","172.20.7.83","TCP","74","80 > 56747 [SYN, ACK] Seq=0 Ack=1 Win=28240 Len=0 MSS=1424 SACK_PERM=1 TSval=1151324071 TSecr=1626191050 WS=32"
"143","2.880899000","172.20.7.83","104.69.219.52","TCP","66","56747 > 80 [ACK] Seq=1 Ack=1 Win=131296 Len=0 TSval=1626191126 TSecr=1151324071"
"144","2.881203000","104.69.219.52","172.20.7.83","TCP","74","80 > 56748 [SYN, ACK] Seq=0 Ack=1 Win=28240 Len=0 MSS=1424 SACK_PERM=1 TSval=1195537739 TSecr=1626191050 WS=32"
"145","2.881250000","172.20.7.83","104.69.219.52","TCP","66","56748 > 80 [ACK] Seq=1 Ack=1 Win=131296 Len=0 TSval=1626191126 TSecr=1195537739"
"146","2.883948000","119.254.11.66","172.20.7.83","TCP","74","80 > 56725 [SYN, ACK] Seq=0 Ack=1 Win=65535 Len=0 MSS=1460 WS=8 SACK_PERM=1 TSval=3632276221 TSecr=1626190715"
"147","2.884039000","172.20.7.83","119.254.11.66","TCP","66","56725 > 80 [ACK] Seq=1 Ack=1 Win=131744 Len=0 TSval=1626191129 TSecr=3632276221"
"149","2.890894000","119.254.11.66","172.20.7.83","TCP","74","80 > 56730 [SYN, ACK] Seq=0 Ack=1 Win=65535 Len=0 MSS=1460 WS=8 SACK_PERM=1 TSval=3464613975 TSecr=1626190718"
"150","2.890968000","172.20.7.83","119.254.11.66","TCP","66","56730 > 80 [ACK] Seq=1 Ack=1 Win=131744 Len=0 TSval=1626191135 TSecr=3464613975"
"151","2.892201000","119.254.11.66","172.20.7.83","TCP","74","80 > 56732 [SYN, ACK] Seq=0 Ack=1 Win=65535 Len=0 MSS=1460 WS=8 SACK_PERM=1 TSval=3384821879 TSecr=1626190718"
"152","2.892204000","119.254.11.66","172.20.7.83","TCP","74","80 > 56733 [SYN, ACK] Seq=0 Ack=1 Win=65535 Len=0 MSS=1460 WS=8 SACK_PERM=1 TSval=1955333715 TSecr=1626190718"
"153","2.892205000","119.254.11.66","172.20.7.83","TCP","74","80 > 56734 [SYN, ACK] Seq=0 Ack=1 Win=65535 Len=0 MSS=1460 WS=8 SACK_PERM=1 TSval=1387929307 TSecr=1626190719"
"154","2.892264000","172.20.7.83","119.254.11.66","TCP","66","56732 > 80 [ACK] Seq=1 Ack=1 Win=131744 Len=0 TSval=1626191136 TSecr=3384821879"
"155","2.892324000","172.20.7.83","119.254.11.66","TCP","66","56733 > 80 [ACK] Seq=1 Ack=1 Win=131744 Len=0 TSval=1626191136 TSecr=1955333715"
"156","2.892324000","172.20.7.83","119.254.11.66","TCP","66","56734 > 80 [ACK] Seq=1 Ack=1 Win=131744 Len=0 TSval=1626191136 TSecr=1387929307"
"157","2.893181000","119.254.11.66","172.20.7.83","TCP","74","80 > 56737 [SYN, ACK] Seq=0 Ack=1 Win=65535 Len=0 MSS=1460 WS=8 SACK_PERM=1 TSval=835238836 TSecr=1626190720"
"158","2.893184000","119.254.11.66","172.20.7.83","TCP","74","80 > 56736 [SYN, ACK] Seq=0 Ack=1 Win=65535 Len=0 MSS=1460 WS=8 SACK_PERM=1 TSval=1901236582 TSecr=1626190720"
"159","2.893185000","119.254.11.66","172.20.7.83","TCP","74","80 > 56731 [SYN, ACK] Seq=0 Ack=1 Win=65535 Len=0 MSS=1460 WS=8 SACK_PERM=1 TSval=2478210087 TSecr=1626190718"
"160","2.893241000","172.20.7.83","119.254.11.66","TCP","66","56737 > 80 [ACK] Seq=1 Ack=1 Win=131744 Len=0 TSval=1626191136 TSecr=835238836"
"161","2.893297000","172.20.7.83","119.254.11.66","TCP","66","56736 > 80 [ACK] Seq=1 Ack=1 Win=131744 Len=0 TSval=1626191137 TSecr=1901236582"
"162","2.893297000","172.20.7.83","119.254.11.66","TCP","66","56731 > 80 [ACK] Seq=1 Ack=1 Win=131744 Len=0 TSval=1626191137 TSecr=2478210087"
"163","2.893551000","119.254.11.66","172.20.7.83","TCP","74","80 > 56740 [SYN, ACK] Seq=0 Ack=1 Win=65535 Len=0 MSS=1460 WS=8 SACK_PERM=1 TSval=3537739632 TSecr=1626190721"
"164","2.893589000","172.20.7.83","119.254.11.66","TCP","66","56740 > 80 [ACK] Seq=1 Ack=1 Win=131744 Len=0 TSval=1626191137 TSecr=3537739632"
"165","2.894088000","119.254.11.66","172.20.7.83","TCP","74","80 > 56739 [SYN, ACK] Seq=0 Ack=1 Win=65535 Len=0 MSS=1460 WS=8 SACK_PERM=1 TSval=162998004 TSecr=1626190721"
"166","2.894136000","172.20.7.83","119.254.11.66","TCP","66","56739 > 80 [ACK] Seq=1 Ack=1 Win=131744 Len=0 TSval=1626191137 TSecr=162998004"
"167","2.905862000","119.254.11.66","172.20.7.83","TCP","74","80 > 56735 [SYN, ACK] Seq=0 Ack=1 Win=65535 Len=0 MSS=1460 WS=8 SACK_PERM=1 TSval=2268476556 TSecr=1626190719"
"168","2.905936000","172.20.7.83","119.254.11.66","TCP","66","56735 > 80 [ACK] Seq=1 Ack=1 Win=131744 Len=0 TSval=1626191149 TSecr=2268476556"
"169","2.923206000","66.135.211.132","172.20.7.83","TCP","58","80 > 56746 [SYN, ACK] Seq=0 Ack=1 Win=8190 Len=0 MSS=1460"
"170","2.923287000","172.20.7.83","66.135.211.132","TCP","54","56746 > 80 [ACK] Seq=1 Ack=1 Win=65535 Len=0"
"172","2.982297000","172.20.7.83","23.227.10.30","TCP","78","56749 > 80 [SYN] Seq=0 Win=65535 Len=0 MSS=1460 WS=32 TSval=1626191224 TSecr=0 SACK_PERM=1"
"174","2.987814000","172.20.7.83","72.21.91.8","TCP","78","56750 > 80 [SYN] Seq=0 Win=65535 Len=0 MSS=1460 WS=32 TSval=1626191229 TSecr=0 SACK_PERM=1"
"175","2.987897000","172.20.7.83","72.21.91.8","TCP","78","56751 > 80 [SYN] Seq=0 Win=65535 Len=0 MSS=1460 WS=32 TSval=1626191229 TSecr=0 SACK_PERM=1"
"176","3.011000000","49.129.31.76","172.20.7.83","TCP","58","80 > 56743 [SYN, ACK] Seq=0 Ack=1 Win=12400 Len=0 MSS=1240"
"177","3.011084000","172.20.7.83","49.129.31.76","TCP","54","56743 > 80 [ACK] Seq=1 Ack=1 Win=65535 Len=0"
"178","3.012848000","49.129.31.76","172.20.7.83","TCP","58","80 > 56744 [SYN, ACK] Seq=0 Ack=1 Win=12400 Len=0 MSS=1240"
"179","3.012852000","72.21.91.8","172.20.7.83","TCP","74","80 > 56750 [SYN, ACK] Seq=0 Ack=1 Win=14480 Len=0 MSS=1460 SACK_PERM=1 TSval=2015157381 TSecr=1626191229 WS=512"
"180","3.012915000","172.20.7.83","49.129.31.76","TCP","54","56744 > 80 [ACK] Seq=1 Ack=1 Win=65535 Len=0"
"181","3.012973000","172.20.7.83","72.21.91.8","TCP","66","56750 > 80 [ACK] Seq=1 Ack=1 Win=131744 Len=0 TSval=1626191253 TSecr=2015157381"
"182","3.014225000","72.21.91.8","172.20.7.83","TCP","74","80 > 56751 [SYN, ACK] Seq=0 Ack=1 Win=14480 Len=0 MSS=1460 SACK_PERM=1 TSval=2015129837 TSecr=1626191229 WS=512"
"183","3.014293000","172.20.7.83","72.21.91.8","TCP","66","56751 > 80 [ACK] Seq=1 Ack=1 Win=131744 Len=0 TSval=1626191254 TSecr=2015129837"
"184","3.024298000","49.129.31.76","172.20.7.83","TCP","58","80 > 56745 [SYN, ACK] Seq=0 Ack=1 Win=12400 Len=0 MSS=1240"
"185","3.024378000","172.20.7.83","49.129.31.76","TCP","54","56745 > 80 [ACK] Seq=1 Ack=1 Win=65535 Len=0"
"186","3.068463000","23.227.10.30","172.20.7.83","TCP","78","80 > 56749 [SYN, ACK] Seq=0 Ack=1 Win=4380 Len=0 MSS=1460 WS=1 TSval=1513384439 TSecr=1626191224 SACK_PERM=1"
"187","3.068542000","172.20.7.83","23.227.10.30","TCP","66","56749 > 80 [ACK] Seq=1 Ack=1 Win=131744 Len=0 TSval=1626191308 TSecr=1513384439"
"191","3.279104000","172.20.7.83","199.83.132.174","TCP","78","56752 > 80 [SYN] Seq=0 Win=65535 Len=0 MSS=1460 WS=32 TSval=1626191518 TSecr=0 SACK_PERM=1"
"193","3.285879000","172.20.7.83","104.70.75.151","TCP","78","56753 > 80 [SYN] Seq=0 Win=65535 Len=0 MSS=1460 WS=32 TSval=1626191524 TSecr=0 SACK_PERM=1"
"194","3.285941000","172.20.7.83","104.70.75.151","TCP","78","56754 > 80 [SYN] Seq=0 Win=65535 Len=0 MSS=1460 WS=32 TSval=1626191524 TSecr=0 SACK_PERM=1"
"195","3.325639000","104.70.75.151","172.20.7.83","TCP","74","80 > 56753 [SYN, ACK] Seq=0 Ack=1 Win=28240 Len=0 MSS=1424 SACK_PERM=1 TSval=1035969026 TSecr=1626191524 WS=32"
"196","3.325718000","172.20.7.83","104.70.75.151","TCP","66","56753 > 80 [ACK] Seq=1 Ack=1 Win=131296 Len=0 TSval=1626191563 TSecr=1035969026"
"197","3.327564000","104.70.75.151","172.20.7.83","TCP","74","80 > 56754 [SYN, ACK] Seq=0 Ack=1 Win=28960 Len=0 MSS=1460 SACK_PERM=1 TSval=1019698178 TSecr=1626191524 WS=32"
"198","3.327644000","172.20.7.83","104.70.75.151","TCP","66","56754 > 80 [ACK] Seq=1 Ack=1 Win=131744 Len=0 TSval=1626191564 TSecr=1019698178"
"199","3.443784000","199.83.132.174","172.20.7.83","TCP","74","80 > 56752 [SYN, ACK] Seq=0 Ack=1 Win=28960 Len=0 MSS=1460 SACK_PERM=1 TSval=816569256 TSecr=1626191518 WS=128"
"200","3.443870000","172.20.7.83","199.83.132.174","TCP","66","56752 > 80 [ACK] Seq=1 Ack=1 Win=131744 Len=0 TSval=1626191680 TSecr=816569256"
"201","3.486167000","172.20.7.83","119.254.11.66","TCP","78","[TCP Retransmission] 56738 > 80 [SYN] Seq=0 Win=65535 Len=0 MSS=1460 WS=32 TSval=1626191721 TSecr=0 SACK_PERM=1"
"202","3.823149000","172.20.7.83","111.206.227.118","HTTP","609","GET / HTTP/1.1 "
"203","3.825110000","172.20.7.83","66.29.212.110","HTTP","498","GET / HTTP/1.1 "
"204","3.877860000","172.20.7.83","216.58.216.206","TLSv1.2","119","Application Data"
"205","3.877929000","172.20.7.83","216.58.216.206","TLSv1.2","116","Application Data"
"206","3.877930000","172.20.7.83","216.58.216.206","TLSv1.2","108","Application Data"
"207","3.878120000","172.20.7.83","216.58.216.206","TLSv1.2","104","Application Data"
"208","3.878349000","172.20.7.83","216.58.216.206","TLSv1.2","1427","Application Data"
"209","3.889413000","119.254.11.66","172.20.7.83","TCP","74","80 > 56738 [SYN, ACK] Seq=0 Ack=1 Win=65535 Len=0 MSS=1460 WS=8 SACK_PERM=1 TSval=3072990835 TSecr=1626191721"
"210","3.889492000","172.20.7.83","119.254.11.66","TCP","66","56738 > 80 [ACK] Seq=1 Ack=1 Win=131744 Len=0 TSval=1626192120 TSecr=3072990835"
"211","3.916227000","216.58.216.206","172.20.7.83","TCP","66","443 > 56713 [ACK] Seq=253 Ack=837 Win=44800 Len=0 TSval=3192811232 TSecr=1626192109"
"212","3.916407000","216.58.216.206","172.20.7.83","TLSv1.2","104","Application Data"
"213","3.916476000","172.20.7.83","216.58.216.206","TCP","66","56713 > 443 [ACK] Seq=2278 Ack=291 Win=131584 Len=0 TSval=1626192147 TSecr=3192811232"
"214","3.916706000","216.58.216.206","172.20.7.83","TCP","66","443 > 56713 [ACK] Seq=291 Ack=917 Win=44800 Len=0 TSval=3192811233 TSecr=1626192109"
"215","3.933574000","66.29.212.110","172.20.7.83","HTTP","456","HTTP/1.1 301 Moved Permanently  (text/html)"
"216","3.933656000","172.20.7.83","66.29.212.110","TCP","66","56716 > 80 [ACK] Seq=433 Ack=391 Win=131360 Len=0 TSval=1626192164 TSecr=258214932"
"220","3.945967000","172.20.7.83","74.125.226.82","TCP","78","56755 > 80 [SYN] Seq=0 Win=65535 Len=0 MSS=1460 WS=32 TSval=1626192176 TSecr=0 SACK_PERM=1"
"221","3.946074000","172.20.7.83","74.125.226.82","TCP","78","56756 > 80 [SYN] Seq=0 Win=65535 Len=0 MSS=1460 WS=32 TSval=1626192176 TSecr=0 SACK_PERM=1"
"222","3.946122000","172.20.7.83","74.125.226.82","TCP","78","56757 > 80 [SYN] Seq=0 Win=65535 Len=0 MSS=1460 WS=32 TSval=1626192176 TSecr=0 SACK_PERM=1"
"223","3.946179000","172.20.7.83","74.125.226.82","TCP","78","56758 > 80 [SYN] Seq=0 Win=65535 Len=0 MSS=1460 WS=32 TSval=1626192176 TSecr=0 SACK_PERM=1"
"224","3.946244000","172.20.7.83","74.125.226.82","TCP","78","56759 > 80 [SYN] Seq=0 Win=65535 Len=0 MSS=1460 WS=32 TSval=1626192176 TSecr=0 SACK_PERM=1"
"225","3.946342000","172.20.7.83","74.125.226.82","TCP","78","56760 > 80 [SYN] Seq=0 Win=65535 Len=0 MSS=1460 WS=32 TSval=1626192176 TSecr=0 SACK_PERM=1"
"226","3.946575000","172.20.7.83","72.21.91.8","TCP","78","56761 > 80 [SYN] Seq=0 Win=65535 Len=0 MSS=1460 WS=32 TSval=1626192176 TSecr=0 SACK_PERM=1"
"227","3.946588000","172.20.7.83","72.21.91.8","TCP","78","56762 > 80 [SYN] Seq=0 Win=65535 Len=0 MSS=1460 WS=32 TSval=1626192176 TSecr=0 SACK_PERM=1"
"228","3.946640000","172.20.7.83","72.21.91.8","TCP","78","56763 > 80 [SYN] Seq=0 Win=65535 Len=0 MSS=1460 WS=32 TSval=1626192176 TSecr=0 SACK_PERM=1"
"229","3.946710000","172.20.7.83","72.21.91.8","TCP","78","56764 > 80 [SYN] Seq=0 Win=65535 Len=0 MSS=1460 WS=32 TSval=1626192176 TSecr=0 SACK_PERM=1"
"233","3.955386000","216.58.216.206","172.20.7.83","TLSv1.2","335","Application Data"
"234","3.955468000","172.20.7.83","216.58.216.206","TCP","66","56713 > 443 [ACK] Seq=2278 Ack=560 Win=131296 Len=0 TSval=1626192185 TSecr=3192811266"
"235","3.955612000","216.58.216.206","172.20.7.83","TLSv1.2","324","Application Data"
"236","3.955616000","216.58.216.206","172.20.7.83","TLSv1.2","112","Application Data"
"237","3.955711000","172.20.7.83","216.58.216.206","TCP","66","56713 > 443 [ACK] Seq=2278 Ack=818 Win=131040 Len=0 TSval=1626192185 TSecr=3192811266"
"238","3.955711000","172.20.7.83","216.58.216.206","TCP","66","56713 > 443 [ACK] Seq=2278 Ack=864 Win=131008 Len=0 TSval=1626192185 TSecr=3192811266"
"239","3.957125000","172.20.7.83","216.58.216.206","TLSv1.2","112","Application Data"
"240","3.967098000","172.20.7.83","74.125.226.82","TLSv1.2","119","Application Data"
"241","3.967166000","172.20.7.83","74.125.226.82","TLSv1.2","116","Application Data"
"242","3.967178000","172.20.7.83","74.125.226.82","TLSv1.2","108","Application Data"
"243","3.967957000","172.20.7.83","74.125.226.82","TLSv1.2","104","Application Data"
"244","3.968186000","172.20.7.83","74.125.226.82","TLSv1.2","1431","Application Data"
"247","3.974386000","172.20.7.83","216.58.216.206","TCP","78","56765 > 80 [SYN] Seq=0 Win=65535 Len=0 MSS=1460 WS=32 TSval=1626192203 TSecr=0 SACK_PERM=1"
"248","3.974521000","172.20.7.83","216.58.216.206","TCP","78","56766 > 80 [SYN] Seq=0 Win=65535 Len=0 MSS=1460 WS=32 TSval=1626192203 TSecr=0 SACK_PERM=1"
"249","3.974622000","172.20.7.83","216.58.216.206","TCP","78","56767 > 80 [SYN] Seq=0 Win=65535 Len=0 MSS=1460 WS=32 TSval=1626192203 TSecr=0 SACK_PERM=1"
"252","3.975224000","172.20.7.83","216.58.216.238","TCP","78","56768 > 80 [SYN] Seq=0 Win=65535 Len=0 MSS=1460 WS=32 TSval=1626192203 TSecr=0 SACK_PERM=1"
"253","3.975341000","172.20.7.83","216.58.216.238","TCP","78","56769 > 80 [SYN] Seq=0 Win=65535 Len=0 MSS=1460 WS=32 TSval=1626192203 TSecr=0 SACK_PERM=1"
"254","3.975417000","172.20.7.83","216.58.216.238","TCP","78","56770 > 80 [SYN] Seq=0 Win=65535 Len=0 MSS=1460 WS=32 TSval=1626192204 TSecr=0 SACK_PERM=1"
"258","3.976948000","172.20.7.83","74.125.70.156","TCP","78","56771 > 443 [SYN] Seq=0 Win=65535 Len=0 MSS=1460 WS=32 TSval=1626192205 TSecr=0 SACK_PERM=1"
"261","3.977692000","172.20.7.83","216.58.216.234","TCP","78","56772 > 443 [SYN] Seq=0 Win=65535 Len=0 MSS=1460 WS=32 TSval=1626192205 TSecr=0 SACK_PERM=1"
"263","3.978157000","172.20.7.83","216.58.216.234","TCP","78","56773 > 443 [SYN] Seq=0 Win=65535 Len=0 MSS=1460 WS=32 TSval=1626192206 TSecr=0 SACK_PERM=1"
"264","3.983443000","72.21.91.8","172.20.7.83","TCP","74","80 > 56762 [SYN, ACK] Seq=0 Ack=1 Win=14480 Len=0 MSS=1460 SACK_PERM=1 TSval=2015157622 TSecr=1626192176 WS=512"
"265","3.983527000","172.20.7.83","72.21.91.8","TCP","66","56762 > 80 [ACK] Seq=1 Ack=1 Win=131744 Len=0 TSval=1626192211 TSecr=2015157622"
"266","3.983615000","72.21.91.8","172.20.7.83","TCP","74","80 > 56761 [SYN, ACK] Seq=0 Ack=1 Win=14480 Len=0 MSS=1460 SACK_PERM=1 TSval=1804832102 TSecr=1626192176 WS=512"
"267","3.983659000","172.20.7.83","72.21.91.8","TCP","66","56761 > 80 [ACK] Seq=1 Ack=1 Win=131744 Len=0 TSval=1626192211 TSecr=1804832102"
"268","3.984381000","72.21.91.8","172.20.7.83","TCP","74","80 > 56764 [SYN, ACK] Seq=0 Ack=1 Win=14480 Len=0 MSS=1460 SACK_PERM=1 TSval=229799907 TSecr=1626192176 WS=512"
"269","3.984384000","72.21.91.8","172.20.7.83","TCP","74","80 > 56763 [SYN, ACK] Seq=0 Ack=1 Win=14480 Len=0 MSS=1460 SACK_PERM=1 TSval=426355196 TSecr=1626192176 WS=512"
"270","3.984431000","172.20.7.83","72.21.91.8","TCP","66","56764 > 80 [ACK] Seq=1 Ack=1 Win=131744 Len=0 TSval=1626192211 TSecr=229799907"
"271","3.984480000","172.20.7.83","72.21.91.8","TCP","66","56763 > 80 [ACK] Seq=1 Ack=1 Win=131744 Len=0 TSval=1626192211 TSecr=426355196"
"274","4.001937000","172.20.7.83","216.58.216.110","TCP","78","56774 > 80 [SYN] Seq=0 Win=65535 Len=0 MSS=1460 WS=32 TSval=1626192229 TSecr=0 SACK_PERM=1"
"275","4.001996000","172.20.7.83","216.58.216.110","TCP","78","56775 > 80 [SYN] Seq=0 Win=65535 Len=0 MSS=1460 WS=32 TSval=1626192229 TSecr=0 SACK_PERM=1"
"276","4.002024000","172.20.7.83","216.58.216.110","TCP","78","56776 > 80 [SYN] Seq=0 Win=65535 Len=0 MSS=1460 WS=32 TSval=1626192229 TSecr=0 SACK_PERM=1"
"278","4.004970000","172.20.7.83","216.58.216.110","TCP","78","56777 > 80 [SYN] Seq=0 Win=65535 Len=0 MSS=1460 WS=32 TSval=1626192232 TSecr=0 SACK_PERM=1"
"280","4.005493000","172.20.7.83","216.58.216.227","TCP","78","56778 > 443 [SYN] Seq=0 Win=65535 Len=0 MSS=1460 WS=32 TSval=1626192232 TSecr=0 SACK_PERM=1"
"284","4.011616000","172.20.7.83","216.58.216.238","TCP","78","56779 > 443 [SYN] Seq=0 Win=65535 Len=0 MSS=1460 WS=32 TSval=1626192238 TSecr=0 SACK_PERM=1"
"285","4.027662000","216.58.216.206","172.20.7.83","TCP","74","80 > 56767 [SYN, ACK] Seq=0 Ack=1 Win=42540 Len=0 MSS=1430 SACK_PERM=1 TSval=3192886585 TSecr=1626192203 WS=128"
"286","4.027757000","172.20.7.83","216.58.216.206","TCP","66","56767 > 80 [ACK] Seq=1 Ack=1 Win=131872 Len=0 TSval=1626192254 TSecr=3192886585"
"287","4.028626000","216.58.216.206","172.20.7.83","TCP","74","80 > 56765 [SYN, ACK] Seq=0 Ack=1 Win=42540 Len=0 MSS=1430 SACK_PERM=1 TSval=3192819555 TSecr=1626192203 WS=128"
"288","4.028689000","172.20.7.83","216.58.216.206","TCP","66","56765 > 80 [ACK] Seq=1 Ack=1 Win=131872 Len=0 TSval=1626192254 TSecr=3192819555"
"289","4.028987000","216.58.216.206","172.20.7.83","TCP","74","80 > 56766 [SYN, ACK] Seq=0 Ack=1 Win=42540 Len=0 MSS=1430 SACK_PERM=1 TSval=3192829256 TSecr=1626192203 WS=128"
"290","4.029056000","172.20.7.83","216.58.216.206","TCP","66","56766 > 80 [ACK] Seq=1 Ack=1 Win=131872 Len=0 TSval=1626192255 TSecr=3192829256"
"291","4.030183000","74.125.70.156","172.20.7.83","TCP","74","443 > 56771 [SYN, ACK] Seq=0 Ack=1 Win=42540 Len=0 MSS=1430 SACK_PERM=1 TSval=1443990317 TSecr=1626192205 WS=128"
"292","4.030254000","172.20.7.83","74.125.70.156","TCP","66","56771 > 443 [ACK] Seq=1 Ack=1 Win=131872 Len=0 TSval=1626192256 TSecr=1443990317"
"293","4.030510000","172.20.7.83","74.125.70.156","TLSv1.2","583","Client Hello"
"295","4.052498000","216.58.216.110","172.20.7.83","TCP","74","80 > 56775 [SYN, ACK] Seq=0 Ack=1 Win=42540 Len=0 MSS=1430 SACK_PERM=1 TSval=3539159605 TSecr=1626192229 WS=128"
"296","4.052591000","172.20.7.83","216.58.216.110","TCP","66","56775 > 80 [ACK] Seq=1 Ack=1 Win=131872 Len=0 TSval=1626192277 TSecr=3539159605"
"297","4.052660000","216.58.216.110","172.20.7.83","TCP","74","80 > 56774 [SYN, ACK] Seq=0 Ack=1 Win=42540 Len=0 MSS=1430 SACK_PERM=1 TSval=3539153835 TSecr=1626192229 WS=128"
"298","4.052714000","172.20.7.83","216.58.216.110","TCP","66","56774 > 80 [ACK] Seq=1 Ack=1 Win=131872 Len=0 TSval=1626192277 TSecr=3539153835"
"299","4.053091000","216.58.216.110","172.20.7.83","TCP","74","80 > 56776 [SYN, ACK] Seq=0 Ack=1 Win=42540 Len=0 MSS=1430 SACK_PERM=1 TSval=3539175579 TSecr=1626192229 WS=128"
"300","4.053136000","172.20.7.83","216.58.216.110","TCP","66","56776 > 80 [ACK] Seq=1 Ack=1 Win=131872 Len=0 TSval=1626192277 TSecr=3539175579"
"301","4.056050000","216.58.216.110","172.20.7.83","TCP","74","80 > 56777 [SYN, ACK] Seq=0 Ack=1 Win=42540 Len=0 MSS=1430 SACK_PERM=1 TSval=3539159609 TSecr=1626192232 WS=128"
"302","4.056125000","172.20.7.83","216.58.216.110","TCP","66","56777 > 80 [ACK] Seq=1 Ack=1 Win=131872 Len=0 TSval=1626192280 TSecr=3539159609"
"303","4.056227000","216.58.216.206","172.20.7.83","TCP","66","443 > 56713 [ACK] Seq=864 Ack=2324 Win=47488 Len=0 TSval=3192811363 TSecr=1626192186"
"304","4.056838000","172.20.7.83","216.58.216.110","TCP","1484","[TCP segment of a reassembled PDU]"
"305","4.056840000","172.20.7.83","216.58.216.110","HTTP","321","GET /translate_a/element.js?cb=googleTranslateElementInit HTTP/1.1 "
"306","4.063224000","74.125.226.82","172.20.7.83","TCP","74","80 > 56759 [SYN, ACK] Seq=0 Ack=1 Win=42540 Len=0 MSS=1430 SACK_PERM=1 TSval=2513389277 TSecr=1626192176 WS=128"
"307","4.063312000","172.20.7.83","74.125.226.82","TCP","66","56759 > 80 [ACK] Seq=1 Ack=1 Win=131872 Len=0 TSval=1626192287 TSecr=2513389277"
"308","4.063421000","74.125.226.82","172.20.7.83","TCP","74","80 > 56755 [SYN, ACK] Seq=0 Ack=1 Win=42540 Len=0 MSS=1430 SACK_PERM=1 TSval=2520575991 TSecr=1626192176 WS=128"
"309","4.063424000","74.125.226.82","172.20.7.83","TCP","74","80 > 56757 [SYN, ACK] Seq=0 Ack=1 Win=42540 Len=0 MSS=1430 SACK_PERM=1 TSval=2513389276 TSecr=1626192176 WS=128"
"310","4.063424000","74.125.226.82","172.20.7.83","TCP","74","80 > 56758 [SYN, ACK] Seq=0 Ack=1 Win=42540 Len=0 MSS=1430 SACK_PERM=1 TSval=2520575991 TSecr=1626192176 WS=128"
"311","4.063425000","74.125.226.82","172.20.7.83","TCP","74","80 > 56756 [SYN, ACK] Seq=0 Ack=1 Win=42540 Len=0 MSS=1430 SACK_PERM=1 TSval=2520575992 TSecr=1626192176 WS=128"
"312","4.063470000","172.20.7.83","74.125.226.82","TCP","66","56755 > 80 [ACK] Seq=1 Ack=1 Win=131872 Len=0 TSval=1626192287 TSecr=2520575991"
"313","4.063520000","172.20.7.83","74.125.226.82","TCP","66","56757 > 80 [ACK] Seq=1 Ack=1 Win=131872 Len=0 TSval=1626192287 TSecr=2513389276"
"314","4.063520000","172.20.7.83","74.125.226.82","TCP","66","56758 > 80 [ACK] Seq=1 Ack=1 Win=131872 Len=0 TSval=1626192287 TSecr=2520575991"
"315","4.063528000","172.20.7.83","74.125.226.82","TCP","66","56756 > 80 [ACK] Seq=1 Ack=1 Win=131872 Len=0 TSval=1626192287 TSecr=2520575992"
"316","4.063685000","172.20.7.83","74.125.226.82","TCP","1484","[TCP segment of a reassembled PDU]"
"317","4.063686000","172.20.7.83","74.125.226.82","HTTP","310","GET /cse/cse.js?cx=012971019331610648934:m2tou3_miwy HTTP/1.1 "
"318","4.064241000","74.125.226.82","172.20.7.83","TCP","74","80 > 56760 [SYN, ACK] Seq=0 Ack=1 Win=42540 Len=0 MSS=1430 SACK_PERM=1 TSval=2520580592 TSecr=1626192176 WS=128"
"319","4.064292000","172.20.7.83","74.125.226.82","TCP","66","56760 > 80 [ACK] Seq=1 Ack=1 Win=131872 Len=0 TSval=1626192288 TSecr=2520580592"
"320","4.088521000","74.125.226.82","172.20.7.83","TCP","66","443 > 56714 [ACK] Seq=253 Ack=879 Win=44800 Len=0 TSval=2513389298 TSecr=1626192196"
"321","4.088785000","74.125.226.82","172.20.7.83","TLSv1.2","104","Application Data"
"322","4.088862000","172.20.7.83","74.125.226.82","TCP","66","56714 > 443 [ACK] Seq=2282 Ack=291 Win=131584 Len=0 TSval=1626192312 TSecr=2513389298"
"323","4.089727000","74.125.226.82","172.20.7.83","TCP","66","443 > 56714 [ACK] Seq=291 Ack=2282 Win=47488 Len=0 TSval=2513389299 TSecr=1626192196"
"324","4.096191000","111.206.227.118","172.20.7.83","TCP","54","80 > 56715 [ACK] Seq=1 Ack=556 Win=15744 Len=0"
"325","4.098824000","111.206.227.118","172.20.7.83","HTTP","416","HTTP/1.1 302 Moved Temporarily  (text/html)"
"326","4.098829000","74.125.70.156","172.20.7.83","TCP","66","443 > 56771 [ACK] Seq=1 Ack=518 Win=43648 Len=0 TSval=1443990367 TSecr=1626192256"
"327","4.098931000","74.125.70.156","172.20.7.83","TLSv1.2","220","Server Hello, Change Cipher Spec, Hello Request, Hello Request"
"328","4.098949000","172.20.7.83","111.206.227.118","TCP","54","56715 > 80 [ACK] Seq=556 Ack=363 Win=261760 Len=0"
"329","4.099004000","172.20.7.83","74.125.70.156","TCP","66","56771 > 443 [ACK] Seq=518 Ack=155 Win=131712 Len=0 TSval=1626192321 TSecr=1443990367"
"330","4.099685000","172.20.7.83","74.125.70.156","TLSv1.2","282","Change Cipher Spec, Hello Request, Hello Request, Hello Request, Hello Request"
"331","4.105480000","216.58.216.238","172.20.7.83","TCP","74","80 > 56768 [SYN, ACK] Seq=0 Ack=1 Win=42540 Len=0 MSS=1430 SACK_PERM=1 TSval=1104499257 TSecr=1626192203 WS=128"
"332","4.105566000","172.20.7.83","216.58.216.238","TCP","66","56768 > 80 [ACK] Seq=1 Ack=1 Win=131872 Len=0 TSval=1626192327 TSecr=1104499257"
"334","4.106697000","216.58.216.238","172.20.7.83","TCP","74","80 > 56769 [SYN, ACK] Seq=0 Ack=1 Win=42540 Len=0 MSS=1430 SACK_PERM=1 TSval=1104523454 TSecr=1626192203 WS=128"
"335","4.106751000","172.20.7.83","216.58.216.238","TCP","66","56769 > 80 [ACK] Seq=1 Ack=1 Win=131872 Len=0 TSval=1626192328 TSecr=1104523454"
