No.8.578868000,Time,Source,Destination,Protocol,Length,Info1,0,172.20.8.249,104.70.75.179,TCP,54,62065 > 443 [ACK] Seq=1 Ack=1 Win=4096 Len=02,0.119171,172.20.8.249,216.58.216.106,TCP,54,62059 > 80 [ACK] Seq=1 Ack=1 Win=4096 Len=03,0.150817,104.70.75.179,172.20.8.249,TCP,66,[TCP ACKed unseen segment] 443 > 62065 [ACK] Seq=1 Ack=2 Win=950 Len=0 TSval=535960726 TSecr=2800704304,0.291104,216.58.216.106,172.20.8.249,TCP,66,[TCP ACKed unseen segment] 80 > 62059 [ACK] Seq=1 Ack=2 Win=350 Len=0 TSval=3533647498 TSecr=2800707206,0.66638,172.20.8.249,192.5.110.40,TCP,54,62068 > 80 [ACK] Seq=1 Ack=1 Win=4096 Len=0,0.809527,172.20.8.249,104.70.55.222,TCP,54,62067 > 443 [ACK] Seq=1 Ack=1 Win=4096 Len=08,0.818651,192.5.110.40,172.20.8.249,TCP,66,[TCP ACKed unseen segment] 80 > 62068 [ACK] Seq=1 Ack=2 Win=495 Len=0 TSval=2015971849 TSecr=2800711409,0.976947,104.70.55.222,172.20.8.249,TCP,66,[TCP ACKed unseen segment] 443 > 62067 [ACK] Seq=1 Ack=2 Win=981 Len=0 TSval=1457616181 TSecr=28007129711,2.637392,74.125.202.189,172.20.8.249,TLSv1.2,126,Application Data12,2.637498,172.20.8.249,74.125.202.189,TCP,66,61296 > 443 [ACK] Seq=1 Ack=61 Win=4094 Len=0 TSval=280208398 TSecr=14348422113,2.63792,74.125.202.189,172.20.8.249,TLSv1.2,104,Application Data14,2.637925,74.125.202.189,172.20.8.249,TLSv1.2,112,Application Data15,2.637994,172.20.8.249,74.125.202.189,TCP,66,61296 > 443 [ACK] Seq=1 Ack=99 Win=4094 Len=0 TSval=280208398 TSecr=14348422216,2.637994,172.20.8.249,74.125.202.189,TCP,66,61296 > 443 [ACK] Seq=1 Ack=145 Win=4093 Len=0 TSval=280208398 TSecr=14348422717,2.63878,172.20.8.249,74.125.202.189,TLSv1.2,112,Application Data18,2.950155,74.125.202.189,172.20.8.249,TCP,66,443 > 61296 [ACK] Seq=145 Ack=47 Win=1653 Len=0 TSval=143484534 TSecr=28020839919,3.025867,172.20.8.249,74.125.202.189,TCP,1484,[TCP segment of a reassembled PDU]20,3.025868,172.20.8.249,74.125.202.189,TLSv1.2,386,Application Data21,3.221028,74.125.202.189,172.20.8.249,TCP,66,443 > 61296 [ACK] Seq=145 Ack=1465 Win=1644 Len=0 TSval=143484866 TSecr=28020878422,3.221041,74.125.202.189,172.20.8.249,TCP,66,443 > 61296 [ACK] Seq=145 Ack=1785 Win=1644 Len=0 TSval=143484867 TSecr=28020878423,3.238793,74.125.202.189,172.20.8.249,TLSv1.2,138,Application Data24,3.238945,172.20.8.249,74.125.202.189,TCP,66,61296 > 443 [ACK] Seq=1785 Ack=217 Win=4093 Len=0 TSval=280208995 TSecr=14348492525,3.243851,74.125.202.189,172.20.8.249,TLSv1.2,126,Application Data26,3.243951,172.20.8.249,74.125.202.189,TCP,66,61296 > 443 [ACK] Seq=1785 Ack=277 Win=4094 Len=0 TSval=280209000 TSecr=14348492531,5.823289,172.20.8.249,110.75.115.70,TCP,78,62174 > 80 [SYN] Seq=0 Win=65535 Len=0 MSS=1460 WS=32 TSval=280211536 TSecr=0 SACK_PERM=132,5.897435,172.20.8.249,110.75.115.70,TCP,78,62175 > 80 [SYN] Seq=0 Win=65535 Len=0 MSS=1460 WS=32 TSval=280211650 TSecr=0 SACK_PERM=133,6.188449,110.75.115.70,172.20.8.249,TCP,78,"80 > 62174 [SYN, ACK] Seq=0 Ack=1 Win=12960 Len=0 MSS=1340 SACK_PERM=1"34,6.188556,172.20.8.249,110.75.115.70,TCP,54,62174 > 80 [ACK] Seq=1 Ack=1 Win=65535 Len=035,6.188827,172.20.8.249,110.75.115.70,HTTP,434,GET / HTTP/1.1 36,6.28282,110.75.115.70,172.20.8.249,TCP,78,"80 > 62175 [SYN, ACK] Seq=0 Ack=1 Win=12960 Len=0 MSS=1340 SACK_PERM=1"37,6.282901,172.20.8.249,110.75.115.70,TCP,54,62175 > 80 [ACK] Seq=1 Ack=1 Win=65535 Len=038,6.60613,110.75.115.70,172.20.8.249,TCP,54,80 > 62174 [ACK] Seq=1 Ack=381 Win=15544 Len=039,6.60631,110.75.115.70,172.20.8.249,HTTP,492,HTTP/1.1 302 Found  (text/html)40,6.606367,172.20.8.249,110.75.115.70,TCP,54,62174 > 80 [ACK] Seq=381 Ack=439 Win=65535 Len=042,6.651776,110.75.115.70,172.20.8.249,TCP,55,"[TCP Out-Of-Order] 80 > 62174 [PSH, ACK] Seq=437 Ack=381 Win=15544 Len=1"43,6.651842,172.20.8.249,110.75.115.70,TCP,54,[TCP Dup ACK 40#1] 62174 > 80 [ACK] Seq=381 Ack=439 Win=65535 Len=045,6.71512,172.20.8.249,66.198.24.243,TCP,78,62176 > 80 [SYN] Seq=0 Win=65535 Len=0 MSS=1460 WS=32 TSval=280212465 TSecr=0 SACK_PERM=146,6.831868,66.198.24.243,172.20.8.249,TCP,74,"80 > 62176 [SYN, ACK] Seq=0 Ack=1 Win=14480 Len=0 MSS=1460 SACK_PERM=1 TSval=1654161475 TSecr=280212465 WS=512"47,6.832034,172.20.8.249,66.198.24.243,TCP,66,62176 > 80 [ACK] Seq=1 Ack=1 Win=131744 Len=0 TSval=280212581 TSecr=165416147548,6.832346,172.20.8.249,66.198.24.243,HTTP,450,GET / HTTP/1.1 49,6.888599,110.75.115.70,172.20.8.249,TCP,55,"[TCP Out-Of-Order] 80 > 62174 [PSH, ACK] Seq=437 Ack=381 Win=15544 Len=1"50,6.888753,172.20.8.249,110.75.115.70,TCP,54,[TCP Dup ACK 40#2] 62174 > 80 [ACK] Seq=381 Ack=439 Win=65535 Len=051,6.976425,66.198.24.243,172.20.8.249,TCP,66,80 > 62176 [ACK] Seq=1 Ack=385 Win=15872 Len=0 TSval=1654161610 TSecr=28021258152,6.977,66.198.24.243,172.20.8.249,HTTP,591,HTTP/1.1 302 Found  (text/html)53,6.977098,172.20.8.249,66.198.24.243,TCP,66,62176 > 80 [ACK] Seq=385 Ack=526 Win=131232 Len=0 TSval=280212724 TSecr=165416161054,6.981841,172.20.8.249,66.198.24.243,TCP,78,62177 > 443 [SYN] Seq=0 Win=65535 Len=0 MSS=1460 WS=32 TSval=280212729 TSecr=0 SACK_PERM=155,7.108308,66.198.24.243,172.20.8.249,TCP,74,"443 > 62177 [SYN, ACK] Seq=0 Ack=1 Win=14480 Len=0 MSS=1460 SACK_PERM=1 TSval=3438886692 TSecr=280212729 WS=512"56,7.108395,172.20.8.249,66.198.24.243,TCP,66,62177 > 443 [ACK] Seq=1 Ack=1 Win=131744 Len=0 TSval=280212855 TSecr=343888669257,7.108609,172.20.8.249,66.198.24.243,TLSv1.2,277,Client Hello58,7.214031,66.198.24.243,172.20.8.249,TCP,66,443 > 62177 [ACK] Seq=1 Ack=212 Win=15872 Len=0 TSval=3438886804 TSecr=28021285559,7.546281,66.198.24.243,172.20.8.249,TLSv1.2,1514,Server Hello60,7.546802,66.198.24.243,172.20.8.249,TCP,1514,[TCP segment of a reassembled PDU]61,7.546903,172.20.8.249,66.198.24.243,TCP,66,62177 > 443 [ACK] Seq=212 Ack=2897 Win=129600 Len=0 TSval=280213291 TSecr=343888704462,7.547026,66.198.24.243,172.20.8.249,TLSv1.2,494,Certificate63,7.547098,172.20.8.249,66.198.24.243,TCP,66,62177 > 443 [ACK] Seq=212 Ack=3325 Win=130624 Len=0 TSval=280213291 TSecr=343888704464,7.547951,172.20.8.249,66.198.24.243,TLSv1.2,257,"Client Key Exchange, Change Cipher Spec, Hello Request, Hello Request, Hello Request, Hello Request"65,7.548744,172.20.8.249,66.198.24.243,TLSv1.2,123,Application Data66,7.548765,172.20.8.249,66.198.24.243,TLSv1.2,111,Application Data67,7.549055,172.20.8.249,66.198.24.243,TLSv1.2,402,Application Data68,7.575954,66.198.24.243,172.20.8.249,TLSv1.2,67,[TCP Out-Of-Order] Continuation Data69,7.576145,172.20.8.249,66.198.24.243,TCP,66,[TCP Dup ACK 63#1] 62177 > 443 [ACK] Seq=841 Ack=3325 Win=131072 Len=0 TSval=280213320 TSecr=343888704470,7.719929,66.198.24.243,172.20.8.249,TCP,66,443 > 62177 [ACK] Seq=3325 Ack=403 Win=16896 Len=0 TSval=3438887281 TSecr=28021329271,7.720763,66.198.24.243,172.20.8.249,TLSv1.2,308,"New Session Ticket, Change Cipher Spec, Encrypted Handshake Message"72,7.720838,172.20.8.249,66.198.24.243,TCP,66,62177 > 443 [ACK] Seq=841 Ack=3567 Win=130816 Len=0 TSval=280213463 TSecr=343888728273,7.720927,66.198.24.243,172.20.8.249,TCP,66,443 > 62177 [ACK] Seq=3567 Ack=505 Win=16896 Len=0 TSval=3438887283 TSecr=28021329274,7.721341,66.198.24.243,172.20.8.249,TLSv1.2,714,"Application Data, Application Data, Application Data"75,7.72145,172.20.8.249,66.198.24.243,TCP,66,62177 > 443 [ACK] Seq=841 Ack=4215 Win=130400 Len=0 TSval=280213464 TSecr=343888728378,7.794241,172.20.8.249,66.102.255.57,TCP,78,62178 > 80 [SYN] Seq=0 Win=65535 Len=0 MSS=1460 WS=32 TSval=280213536 TSecr=0 SACK_PERM=179,7.813182,66.198.24.243,172.20.8.249,SSL,67,[TCP Out-Of-Order] [Malformed Packet]80,7.813267,172.20.8.249,66.198.24.243,TCP,66,[TCP Window Update] 62177 > 443 [ACK] Seq=841 Ack=4215 Win=131072 Len=0 TSval=280213555 TSecr=343888728381,7.976179,172.20.8.249,66.102.255.57,TCP,78,62179 > 80 [SYN] Seq=0 Win=65535 Len=0 MSS=1460 WS=32 TSval=280213717 TSecr=0 SACK_PERM=182,8.17259,66.102.255.57,172.20.8.249,TCP,74,"80 > 62178 [SYN, ACK] Seq=0 Ack=1 Win=14480 Len=0 MSS=1460 SACK_PERM=1 TSval=3680105177 TSecr=280213536 WS=512"83,8.172697,172.20.8.249,66.102.255.57,TCP,66,62178 > 80 [ACK] Seq=1 Ack=1 Win=131744 Len=0 TSval=280213913 TSecr=368010517784,8.173095,172.20.8.249,66.102.255.57,HTTP,468,GET / HTTP/1.1 85,8.283891,66.102.255.57,172.20.8.249,TCP,74,"80 > 62179 [SYN, ACK] Seq=0 Ack=1 Win=14480 Len=0 MSS=1460 SACK_PERM=1 TSval=3680105356 TSecr=280213717 WS=512"86,8.283997,172.20.8.249,66.102.255.57,TCP,66,62179 > 80 [ACK] Seq=1 Ack=1 Win=131744 Len=0 TSval=280214024 TSecr=368010535687,8.476358,66.102.255.57,172.20.8.249,TCP,66,80 > 62178 [ACK] Seq=1 Ack=403 Win=15872 Len=0 TSval=3680105550 TSecr=28021391388,8.481444,66.102.255.57,172.20.8.249,TCP,1514,[TCP segment of a reassembled PDU]89,8.481449,66.102.255.57,172.20.8.249,TCP,1514,[TCP segment of a reassembled PDU]90,8.481589,66.102.255.57,172.20.8.249,TCP,1514,[TCP segment of a reassembled PDU]91,8.481606,172.20.8.249,66.102.255.57,TCP,66,62178 > 80 [ACK] Seq=403 Ack=2897 Win=128864 Len=0 TSval=280214221 TSecr=368010555592,8.481835,66.102.255.57,172.20.8.249,TCP,1514,[TCP segment of a reassembled PDU]93,8.481911,66.102.255.57,172.20.8.249,TCP,1514,[TCP segment of a reassembled PDU]94,8.481954,66.102.255.57,172.20.8.249,TCP,1514,"[TCP Previous segment not captured] 80 > 62178 [ACK] Seq=8689 Ack=403 Win=15872 Len=1448 TSval=3680105555 TSecr=280213913[Reassembly error, protocol TCP: New fragment past old data limits]"95,8.481969,172.20.8.249,66.102.255.57,TCP,66,62178 > 80 [ACK] Seq=403 Ack=5793 Win=128160 Len=0 TSval=280214221 TSecr=368010555596,8.482028,66.102.255.57,172.20.8.249,TCP,1514,80 > 62178 [ACK] Seq=10137 Ack=403 Win=15872 Len=1448 TSval=3680105555 TSecr=28021391397,8.482041,172.20.8.249,66.102.255.57,TCP,78,62178 > 80 [ACK] Seq=403 Ack=7241 Win=126720 Len=0 TSval=280214221 TSecr=3680105555 SLE=8689 SRE=1013798,8.482089,66.102.255.57,172.20.8.249,TCP,1514,80 > 62178 [ACK] Seq=11585 Ack=403 Win=15872 Len=1448 TSval=3680105555 TSecr=28021391399,8.482101,172.20.8.249,66.102.255.57,TCP,78,[TCP Dup ACK 97#1] 62178 > 80 [ACK] Seq=403 Ack=7241 Win=126720 Len=0 TSval=280214221 TSecr=3680105555 SLE=8689 SRE=11585100,8.482122,172.20.8.249,66.102.255.57,TCP,78,[TCP Dup ACK 97#2] 62178 > 80 [ACK] Seq=403 Ack=7241 Win=126720 Len=0 TSval=280214221 TSecr=3680105555 SLE=8689 SRE=13033101,8.482234,66.102.255.57,172.20.8.249,TCP,1514,80 > 62178 [ACK] Seq=13033 Ack=403 Win=15872 Len=1448 TSval=3680105555 TSecr=280213913102,8.482275,172.20.8.249,66.102.255.57,TCP,78,[TCP Dup ACK 97#3] 62178 > 80 [ACK] Seq=403 Ack=7241 Win=126720 Len=0 TSval=280214221 TSecr=3680105555 SLE=8689 SRE=14481103,8.48478,172.20.8.249,66.102.255.57,TCP,78,[TCP Window Update] 62178 > 80 [ACK] Seq=403 Ack=7241 Win=131072 Len=0 TSval=280214224 TSecr=3680105555 SLE=8689 SRE=14481106,8.578868,66.102.255.57,172.20.8.249,TCP,74,"[TCP Out-Of-Order] 80 > 62179 [SYN, ACK] Seq=0 Ack=1 Win=14480 Len=0 MSS=1460 SACK_PERM=1 TSval=3680105660 TSecr=280213717 WS=512"107,8.578943,172.20.8.249,66.102.255.57,TCP,66,[TCP Dup ACK 86#1] 62179 > 80 [ACK] Seq=1 Ack=1 Win=131744 Len=0 TSval=280214318 TSecr=3680105356109,8.619106,172.20.8.249,66.198.24.240,TCP,78,62180 > 80 [SYN] Seq=0 Win=65535 Len=0 MSS=1460 WS=32 TSval=280214357 TSecr=0 SACK_PERM=1110,8.619201,172.20.8.249,66.198.24.240,TCP,78,62181 > 80 [SYN] Seq=0 Win=65535 Len=0 MSS=1460 WS=32 TSval=280214357 TSecr=0 SACK_PERM=1111,8.619276,172.20.8.249,66.198.24.240,TCP,78,62182 > 80 [SYN] Seq=0 Win=65535 Len=0 MSS=1460 WS=32 TSval=280214357 TSecr=0 SACK_PERM=1112,8.619321,172.20.8.249,66.198.24.240,TCP,78,62183 > 80 [SYN] Seq=0 Win=65535 Len=0 MSS=1460 WS=32 TSval=280214357 TSecr=0 SACK_PERM=1113,8.619368,172.20.8.249,66.198.24.240,TCP,78,62184 > 80 [SYN] Seq=0 Win=65535 Len=0 MSS=1460 WS=32 TSval=280214357 TSecr=0 SACK_PERM=1114,8.628336,66.102.255.57,172.20.8.249,TCP,67,[TCP Out-Of-Order] [TCP segment of a reassembled PDU]115,8.628412,172.20.8.249,66.102.255.57,TCP,86,[TCP Dup ACK 97#4] 62178 > 80 [ACK] Seq=403 Ack=7241 Win=131072 Len=0 TSval=280214366 TSecr=3680105555 SLE=14479 SRE=14480 SLE=8689 SRE=14481117,8.632755,172.20.8.249,66.198.24.240,TCP,78,62185 > 80 [SYN] Seq=0 Win=65535 Len=0 MSS=1460 WS=32 TSval=280214370 TSecr=0 SACK_PERM=1118,8.632842,172.20.8.249,66.198.24.240,TCP,78,62186 > 80 [SYN] Seq=0 Win=65535 Len=0 MSS=1460 WS=32 TSval=280214370 TSecr=0 SACK_PERM=1119,8.784743,66.102.255.57,172.20.8.249,TCP,1514,80 > 62178 [ACK] Seq=14481 Ack=403 Win=15872 Len=1448 TSval=3680105859 TSecr=280214221120,8.784749,66.102.255.57,172.20.8.249,TCP,1514,80 > 62178 [ACK] Seq=15929 Ack=403 Win=15872 Len=1448 TSval=3680105859 TSecr=280214221121,8.784798,66.102.255.57,172.20.8.249,TCP,1514,80 > 62178 [ACK] Seq=17377 Ack=403 Win=15872 Len=1448 TSval=3680105859 TSecr=280214221122,8.784864,172.20.8.249,66.102.255.57,TCP,78,[TCP Dup ACK 97#5] 62178 > 80 [ACK] Seq=403 Ack=7241 Win=131072 Len=0 TSval=280214522 TSecr=3680105555 SLE=8689 SRE=15929123,8.784865,172.20.8.249,66.102.255.57,TCP,78,[TCP Dup ACK 97#6] 62178 > 80 [ACK] Seq=403 Ack=7241 Win=131072 Len=0 TSval=280214522 TSecr=3680105555 SLE=8689 SRE=17377124,8.784903,172.20.8.249,66.102.255.57,TCP,78,[TCP Dup ACK 97#7] 62178 > 80 [ACK] Seq=403 Ack=7241 Win=131072 Len=0 TSval=280214522 TSecr=3680105555 SLE=8689 SRE=18825125,8.785575,66.102.255.57,172.20.8.249,TCP,1514,80 > 62178 [ACK] Seq=18825 Ack=403 Win=15872 Len=1448 TSval=3680105860 TSecr=280214221126,8.785618,66.102.255.57,172.20.8.249,TCP,1514,80 > 62178 [ACK] Seq=20273 Ack=403 Win=15872 Len=1448 TSval=3680105860 TSecr=280214221127,8.785661,66.102.255.57,172.20.8.249,TCP,1514,80 > 62178 [ACK] Seq=21721 Ack=403 Win=15872 Len=1448 TSval=3680105860 TSecr=280214221128,8.785685,172.20.8.249,66.102.255.57,TCP,78,[TCP Dup ACK 97#8] 62178 > 80 [ACK] Seq=403 Ack=7241 Win=131072 Len=0 TSval=280214522 TSecr=3680105555 SLE=8689 SRE=20273129,8.785685,172.20.8.249,66.102.255.57,TCP,78,[TCP Dup ACK 97#9] 62178 > 80 [ACK] Seq=403 Ack=7241 Win=131072 Len=0 TSval=280214522 TSecr=3680105555 SLE=8689 SRE=21721130,8.785707,172.20.8.249,66.102.255.57,TCP,78,[TCP Dup ACK 97#10] 62178 > 80 [ACK] Seq=403 Ack=7241 Win=131072 Len=0 TSval=280214522 TSecr=3680105555 SLE=8689 SRE=23169131,8.785843,66.102.255.57,172.20.8.249,TCP,1514,80 > 62178 [ACK] Seq=23169 Ack=403 Win=15872 Len=1448 TSval=3680105860 TSecr=280214221132,8.785892,172.20.8.249,66.102.255.57,TCP,78,[TCP Dup ACK 97#11] 62178 > 80 [ACK] Seq=403 Ack=7241 Win=131072 Len=0 TSval=280214523 TSecr=3680105555 SLE=8689 SRE=24617133,8.786111,66.102.255.57,172.20.8.249,TCP,1514,[TCP Fast Retransmission] [TCP segment of a reassembled PDU]134,8.786159,172.20.8.249,66.102.255.57,TCP,66,62178 > 80 [ACK] Seq=403 Ack=24617 Win=113696 Len=0 TSval=280214523 TSecr=3680105860135,8.786199,172.20.8.249,66.102.255.57,TCP,66,[TCP Window Update] 62178 > 80 [ACK] Seq=403 Ack=24617 Win=131072 Len=0 TSval=280214523 TSecr=3680105860136,8.791325,172.20.8.249,66.198.24.240,TCP,78,62187 > 80 [SYN] Seq=0 Win=65535 Len=0 MSS=1460 WS=32 TSval=280214528 TSecr=0 SACK_PERM=1138,8.8017,66.198.24.240,172.20.8.249,TCP,74,"80 > 62182 [SYN, ACK] Seq=0 Ack=1 Win=14480 Len=0 MSS=1460 SACK_PERM=1 TSval=1661190653 TSecr=280214357 WS=512"139,8.80178,172.20.8.249,66.198.24.240,TCP,66,62182 > 80 [ACK] Seq=1 Ack=1 Win=131744 Len=0 TSval=280214538 TSecr=1661190653140,8.801944,66.198.24.240,172.20.8.249,TCP,74,"80 > 62183 [SYN, ACK] Seq=0 Ack=1 Win=14480 Len=0 MSS=1460 SACK_PERM=1 TSval=1655902053 TSecr=280214357 WS=512"141,8.80198,172.20.8.249,66.198.24.240,TCP,66,62183 > 80 [ACK] Seq=1 Ack=1 Win=131744 Len=0 TSval=280214538 TSecr=1655902053142,8.803348,66.198.24.240,172.20.8.249,TCP,74,"80 > 62181 [SYN, ACK] Seq=0 Ack=1 Win=14480 Len=0 MSS=1460 SACK_PERM=1 TSval=1661210779 TSecr=280214357 WS=512"143,8.803384,172.20.8.249,66.198.24.240,TCP,66,62181 > 80 [ACK] Seq=1 Ack=1 Win=131744 Len=0 TSval=280214539 TSecr=1661210779144,8.804275,172.20.8.249,66.198.24.240,TCP,78,62188 > 80 [SYN] Seq=0 Win=65535 Len=0 MSS=1460 WS=32 TSval=280214539 TSecr=0 SACK_PERM=1145,8.805652,172.20.8.249,66.198.24.240,HTTP,436,GET /sea/sitenav-global/0.2.4/global-min.css HTTP/1.1 146,8.80578,172.20.8.249,66.198.24.240,HTTP,436,GET /tb/press/2.2.3/layouts/990-20-50-10.css HTTP/1.1 147,8.805899,172.20.8.249,66.198.24.240,HTTP,407,GET /kissy/k/1.4.8/seed-min.js HTTP/1.1 148,8.810472,66.198.24.240,172.20.8.249,TCP,74,"80 > 62185 [SYN, ACK] Seq=0 Ack=1 Win=14480 Len=0 MSS=1460 SACK_PERM=1 TSval=1661156309 TSecr=280214370 WS=512"149,8.810535,172.20.8.249,66.198.24.240,TCP,66,62185 > 80 [ACK] Seq=1 Ack=1 Win=131744 Len=0 TSval=280214545 TSecr=1661156309150,8.810627,66.198.24.240,172.20.8.249,TCP,74,"80 > 62186 [SYN, ACK] Seq=0 Ack=1 Win=14480 Len=0 MSS=1460 SACK_PERM=1 TSval=1655369804 TSecr=280214370 WS=512"151,8.810656,172.20.8.249,66.198.24.240,HTTP,874,"GET /tmse/1/dpl/??world-homepage-header-logo/v10/world-homepage-header-logo.css,oversea-activity-august-atmosphere/v15/oversea-activity-august-atmosphere.css,oversea-activity-august-atmosphere-left/v2/oversea-activity-august-atmosphere-left.css,world-homepage-first-nav/v7/world-homepage-first-nav.css,oversea-homepage-first-focus/v41/oversea-homepage-first-focus.css,oversea-homepage-floor-cat/v73/oversea-homepage-floor-cat.css,oversea-homepage-mier/v7/oversea-homepage-mier.css HTTP/1.1 "152,8.810656,172.20.8.249,66.198.24.240,TCP,66,62186 > 80 [ACK] Seq=1 Ack=1 Win=131744 Len=0 TSval=280214545 TSecr=1655369804153,8.810775,172.20.8.249,66.198.24.240,HTTP,1170,"GET /tmse/1/dpl/??5862/world-homepage-header-logo/world-homepage-header-logo/v10/skin/default.css,5862/oversea-activity-august-atmosphere/oversea-activity-august-atmosphere/v15/skin/default.css,5862/oversea-activity-august-atmosphere-left/oversea-activity-august-atmosphere-left/v2/skin/default.css,5862/world-homepage-first-nav/world-homepage-first-nav/v7/skin/default.css,5862/oversea-homepage-first-focus/oversea-homepage-first-focus/v41/skin/hongkong.css,5862/world-focus-link-fix/world-focus-link-fix/v9/skin/default.css,5862/oversea-rgn/oversea-rgn/v1/skin/default.css,5862/oversea-space/oversea-space/v1/skin/default.css,5862/oversea-homepage-floor-cat/oversea-homepage-floor-cat/v73/skin/default.css,5862/oversea-homepage-mier/oversea-homepage-mier/v7/skin/default.css HTTP/1.1 "155,8.876744,172.20.8.249,66.198.24.250,TCP,78,62189 > 80 [SYN] Seq=0 Win=65535 Len=0 MSS=1460 WS=32 TSval=280214611 TSecr=0 SACK_PERM=1156,8.930337,66.102.255.57,172.20.8.249,TCP,1514,80 > 62178 [ACK] Seq=24617 Ack=403 Win=15872 Len=1448 TSval=3680106010 TSecr=280214224157,8.959665,66.198.24.240,172.20.8.249,TCP,74,"80 > 62187 [SYN, ACK] Seq=0 Ack=1 Win=14480 Len=0 MSS=1460 SACK_PERM=1 TSval=1655903206 TSecr=280214528 WS=512"158,8.959777,172.20.8.249,66.198.24.240,TCP,66,62187 > 80 [ACK] Seq=1 Ack=1 Win=131744 Len=0 TSval=280214693 TSecr=1655903206159,8.960088,172.20.8.249,66.198.24.240,HTTP,436,GET /sea/discover/0.1.0/p/discover/index.css HTTP/1.1 160,8.971827,66.198.24.240,172.20.8.249,TCP,74,"80 > 62188 [SYN, ACK] Seq=0 Ack=1 Win=14480 Len=0 MSS=1460 SACK_PERM=1 TSval=1655902223 TSecr=280214539 WS=512"161,8.971927,172.20.8.249,66.198.24.240,TCP,66,62188 > 80 [ACK] Seq=1 Ack=1 Win=131744 Len=0 TSval=280214705 TSecr=1655902223162,8.973662,66.198.24.240,172.20.8.249,TCP,66,80 > 62182 [ACK] Seq=1 Ack=371 Win=15872 Len=0 TSval=1661190826 TSecr=280214541163,8.974463,66.198.24.240,172.20.8.249,TCP,1514,[TCP segment of a reassembled PDU]164,8.97447,66.198.24.240,172.20.8.249,TCP,1514,[TCP segment of a reassembled PDU]165,8.974607,66.198.24.240,172.20.8.249,TCP,1514,[TCP segment of a reassembled PDU]166,8.974636,172.20.8.249,66.198.24.240,TCP,66,62182 > 80 [ACK] Seq=371 Ack=2897 Win=128864 Len=0 TSval=280214706 TSecr=1661190826167,8.974846,66.198.24.240,172.20.8.249,TCP,1514,[TCP segment of a reassembled PDU]168,8.974932,66.198.24.240,172.20.8.249,TCP,1514,[TCP segment of a reassembled PDU]169,8.974936,66.198.24.240,172.20.8.249,TCP,1514,[TCP segment of a reassembled PDU]170,8.974977,66.198.24.240,172.20.8.249,TCP,1514,[TCP segment of a reassembled PDU]171,8.975023,172.20.8.249,66.198.24.240,TCP,66,62182 > 80 [ACK] Seq=371 Ack=5793 Win=128160 Len=0 TSval=280214707 TSecr=1661190826172,8.975024,172.20.8.249,66.198.24.240,TCP,66,62182 > 80 [ACK] Seq=371 Ack=8689 Win=125280 Len=0 TSval=280214707 TSecr=1661190826173,8.975172,66.198.24.240,172.20.8.249,HTTP,1442,HTTP/1.1 200 OK  (text/css)174,8.975218,172.20.8.249,66.198.24.240,TCP,66,62182 > 80 [ACK] Seq=371 Ack=11513 Win=122432 Len=0 TSval=280214707 TSecr=1661190826175,8.975847,66.198.24.240,172.20.8.249,TCP,66,80 > 62183 [ACK] Seq=1 Ack=371 Win=15872 Len=0 TSval=1655902226 TSecr=280214541176,8.976005,172.20.8.249,66.198.24.240,TCP,66,[TCP Window Update] 62182 > 80 [ACK] Seq=371 Ack=11513 Win=131072 Len=0 TSval=280214708 TSecr=1661190826177,8.976356,66.198.24.240,172.20.8.249,TCP,66,80 > 62181 [ACK] Seq=1 Ack=342 Win=15872 Len=0 TSval=1661210953 TSecr=280214541178,8.976499,66.198.24.240,172.20.8.249,HTTP,1294,HTTP/1.1 200 OK  (text/css)179,8.976553,172.20.8.249,66.198.24.240,TCP,66,62183 > 80 [ACK] Seq=371 Ack=1229 Win=130528 Len=0 TSval=280214708 TSecr=1655902226180,8.977201,66.198.24.240,172.20.8.249,TCP,1514,[TCP segment of a reassembled PDU]181,8.977207,66.198.24.240,172.20.8.249,TCP,1514,[TCP segment of a reassembled PDU]182,8.977257,66.198.24.240,172.20.8.249,TCP,106,[TCP segment of a reassembled PDU]183,8.977267,172.20.8.249,66.198.24.240,TCP,66,62181 > 80 [ACK] Seq=342 Ack=2897 Win=128864 Len=0 TSval=280214709 TSecr=1661210953184,8.977279,172.20.8.249,66.198.24.240,TCP,66,62181 > 80 [ACK] Seq=342 Ack=2937 Win=128832 Len=0 TSval=280214709 TSecr=1661210953185,8.977522,66.198.24.240,172.20.8.249,TCP,1514,[TCP segment of a reassembled PDU]186,8.977579,66.198.24.240,172.20.8.249,TCP,1514,[TCP segment of a reassembled PDU]187,8.977657,66.198.24.240,172.20.8.249,TCP,1514,[TCP segment of a reassembled PDU]188,8.9777,66.198.24.240,172.20.8.249,TCP,1514,[TCP segment of a reassembled PDU]189,8.977713,172.20.8.249,66.198.24.240,TCP,66,62181 > 80 [ACK] Seq=342 Ack=5833 Win=125920 Len=0 TSval=280214709 TSecr=1661210953190,8.977728,172.20.8.249,66.198.24.240,TCP,66,62181 > 80 [ACK] Seq=342 Ack=8729 Win=123040 Len=0 TSval=280214709 TSecr=1661210953191,8.977776,66.198.24.240,172.20.8.249,TCP,1514,[TCP segment of a reassembled PDU]192,8.977836,66.198.24.240,172.20.8.249,TCP,1514,[TCP segment of a reassembled PDU]193,8.977878,172.20.8.249,66.198.24.240,TCP,66,62181 > 80 [ACK] Seq=342 Ack=11625 Win=120128 Len=0 TSval=280214709 TSecr=1661210953194,8.977983,66.198.24.240,172.20.8.249,TCP,1514,[TCP segment of a reassembled PDU]195,8.978793,172.20.8.249,66.198.24.240,TCP,66,62181 > 80 [ACK] Seq=342 Ack=13073 Win=122080 Len=0 TSval=280214710 TSecr=1661210953196,8.979487,172.20.8.249,66.198.24.240,TCP,66,[TCP Window Update] 62181 > 80 [ACK] Seq=342 Ack=13073 Win=131072 Len=0 TSval=280214710 TSecr=1661210953197,8.979628,66.198.24.240,172.20.8.249,TCP,66,80 > 62185 [ACK] Seq=1 Ack=809 Win=16384 Len=0 TSval=1661156475 TSecr=280214545198,8.979877,66.198.24.240,172.20.8.249,TCP,66,80 > 62186 [ACK] Seq=1 Ack=1105 Win=16896 Len=0 TSval=1655369971 TSecr=280214545199,8.980037,172.20.8.249,66.198.24.240,HTTP,420,GET /sea/sitenav-global/0.2.4/global-min.js HTTP/1.1 200,8.980106,172.20.8.249,66.198.24.240,HTTP,395,GET /cm/log/log.js HTTP/1.1 201,8.982314,66.198.24.240,172.20.8.249,HTTP,1298,HTTP/1.1 200 OK  (text/css)202,8.982353,66.198.24.240,172.20.8.249,TCP,1514,[TCP segment of a reassembled PDU]203,8.982365,172.20.8.249,66.198.24.240,TCP,66,62186 > 80 [ACK] Seq=1105 Ack=1233 Win=130528 Len=0 TSval=280214713 TSecr=1655369972204,8.982429,66.198.24.240,172.20.8.249,TCP,1514,[TCP segment of a reassembled PDU]205,8.982434,66.198.24.240,172.20.8.249,TCP,106,[TCP segment of a reassembled PDU]206,8.982485,66.198.24.240,172.20.8.249,TCP,1514,[TCP segment of a reassembled PDU]207,8.982502,172.20.8.249,66.198.24.240,TCP,66,62185 > 80 [ACK] Seq=809 Ack=2897 Win=128864 Len=0 TSval=280214713 TSecr=1661156477208,8.982503,172.20.8.249,66.198.24.240,TCP,66,62185 > 80 [ACK] Seq=809 Ack=2937 Win=128832 Len=0 TSval=280214713 TSecr=1661156477209,8.982558,66.198.24.240,172.20.8.249,TCP,1514,[TCP segment of a reassembled PDU]210,8.982615,66.198.24.240,172.20.8.249,TCP,1514,[TCP segment of a reassembled PDU]211,8.982627,172.20.8.249,66.198.24.240,TCP,66,62185 > 80 [ACK] Seq=809 Ack=5833 Win=125920 Len=0 TSval=280214713 TSecr=1661156477212,8.982676,66.198.24.240,172.20.8.249,TCP,1514,[TCP segment of a reassembled PDU]213,8.982705,172.20.8.249,66.198.24.240,TCP,66,62185 > 80 [ACK] Seq=809 Ack=8729 Win=123040 Len=0 TSval=280214713 TSecr=1661156477214,8.982801,66.198.24.240,172.20.8.249,HTTP,850,HTTP/1.1 200 OK  (text/css)215,8.982842,172.20.8.249,66.198.24.240,TCP,66,62185 > 80 [ACK] Seq=809 Ack=9513 Win=122240 Len=0 TSval=280214713 TSecr=1661156477216,8.983697,172.20.8.249,66.198.24.240,TCP,66,[TCP Window Update] 62185 > 80 [ACK] Seq=809 Ack=9513 Win=125632 Len=0 TSval=280214714 TSecr=1661156477217,8.984498,172.20.8.249,66.198.24.240,TCP,66,[TCP Window Update] 62185 > 80 [ACK] Seq=809 Ack=9513 Win=131072 Len=0 TSval=280214714 TSecr=1661156477218,9.034978,172.20.8.249,66.102.255.57,TCP,66,62178 > 80 [ACK] Seq=403 Ack=26065 Win=131072 Len=0 TSval=280214764 TSecr=3680106010219,9.048049,172.20.8.249,66.198.24.250,TCP,78,62190 > 80 [SYN] Seq=0 Win=65535 Len=0 MSS=1460 WS=32 TSval=280214776 TSecr=0 SACK_PERM=1220,9.04911,66.198.24.250,172.20.8.249,TCP,74,"80 > 62189 [SYN, ACK] Seq=0 Ack=1 Win=14480 Len=0 MSS=1460 SACK_PERM=1 TSval=1655783446 TSecr=280214611 WS=512"221,9.04922,172.20.8.249,66.198.24.250,TCP,66,62189 > 80 [ACK] Seq=1 Ack=1 Win=131744 Len=0 TSval=280214777 TSecr=1655783446222,9.049503,172.20.8.249,66.198.24.250,HTTP,455,GET /tps/i1/TB14R.THXXXXXaxaFXXW4780FXX-110-110.png HTTP/1.1 223,9.071161,66.102.255.57,172.20.8.249,TCP,1514,80 > 62178 [ACK] Seq=26065 Ack=403 Win=15872 Len=1448 TSval=3680106158 TSecr=280214522224,9.071167,66.102.255.57,172.20.8.249,TCP,1514,80 > 62178 [ACK] Seq=27513 Ack=403 Win=15872 Len=1448 TSval=3680106158 TSecr=280214522225,9.071259,172.20.8.249,66.102.255.57,TCP,66,62178 > 80 [ACK] Seq=403 Ack=28961 Win=128160 Len=0 TSval=280214799 TSecr=3680106158226,9.071259,172.20.8.249,66.102.255.57,TCP,66,[TCP Window Update] 62178 > 80 [ACK] Seq=403 Ack=28961 Win=131072 Len=0 TSval=280214799 TSecr=3680106158227,9.071363,66.102.255.57,172.20.8.249,TCP,1514,80 > 62178 [ACK] Seq=28961 Ack=403 Win=15872 Len=1448 TSval=3680106158 TSecr=280214523228,9.071443,172.20.8.249,66.102.255.57,TCP,66,62178 > 80 [ACK] Seq=403 Ack=30409 Win=131072 Len=0 TSval=280214799 TSecr=3680106158229,9.071646,66.102.255.57,172.20.8.249,TCP,1194,"80 > 62178 [PSH, ACK] Seq=30409 Ack=403 Win=15872 Len=1128 TSval=3680106158 TSecr=280214523"230,9.071696,172.20.8.249,66.102.255.57,TCP,66,62178 > 80 [ACK] Seq=403 Ack=31537 Win=129920 Len=0 TSval=280214799 TSecr=3680106158231,9.077757,172.20.8.249,66.198.24.240,HTTP,964,"GET /tmse/1/dpl/??world-homepage-header-logo/v10/world-homepage-header-logo.js,oversea-activity-august-atmosphere/v15/oversea-activity-august-atmosphere.js,oversea-activity-august-atmosphere-left/v2/oversea-activity-august-atmosphere-left.js,world-homepage-first-nav/v7/world-homepage-first-nav.js,oversea-homepage-first-focus/v41/oversea-homepage-first-focus.js,world-focus-link-fix/v9/world-focus-link-fix.js,oversea-rgn/v1/oversea-rgn.js,oversea-space/v1/oversea-space.js,oversea-homepage-floor-cat/v73/oversea-homepage-floor-cat.js,oversea-homepage-mier/v7/oversea-homepage-mier.js HTTP/1.1 "232,9.085326,66.198.24.240,172.20.8.249,TCP,74,"80 > 62184 [SYN, ACK] Seq=0 Ack=1 Win=14480 Len=0 MSS=1460 SACK_PERM=1 TSval=1655783480 TSecr=280214357 WS=512"233,9.085493,172.20.8.249,66.198.24.240,TCP,66,62184 > 80 [ACK] Seq=1 Ack=1 Win=131744 Len=0 TSval=280214812 TSecr=1655783480234,9.128957,66.198.24.240,172.20.8.249,TCP,67,"[TCP Out-Of-Order] 80 > 62183 [PSH, ACK] Seq=1227 Ack=371 Win=15872 Len=1 TSval=1655902376 TSecr=280214541"235,9.129031,172.20.8.249,66.198.24.240,TCP,66,[TCP Dup ACK 179#1] 62183 > 80 [ACK] Seq=700 Ack=1229 Win=131072 Len=0 TSval=280214855 TSecr=1655902226236,9.129233,66.198.24.240,172.20.8.249,TCP,67,"[TCP Out-Of-Order] 80 > 62182 [PSH, ACK] Seq=11511 Ack=371 Win=15872 Len=1 TSval=1661190976 TSecr=280214541[Reassembly error, protocol TCP: New fragment overlaps old data (retransmission?)]"237,9.129267,172.20.8.249,66.198.24.240,TCP,66,[TCP Dup ACK 174#1] 62182 > 80 [ACK] Seq=725 Ack=11513 Win=131072 Len=0 TSval=280214855 TSecr=1661190826238,9.129474,66.198.24.240,172.20.8.249,TCP,67,[TCP Out-Of-Order] [TCP segment of a reassembled PDU]239,9.129501,172.20.8.249,66.198.24.240,TCP,66,[TCP Dup ACK 195#1] 62181 > 80 [ACK] Seq=342 Ack=13073 Win=131072 Len=0 TSval=280214855 TSecr=1661210953240,9.133542,66.198.24.240,172.20.8.249,TCP,66,80 > 62187 [ACK] Seq=1 Ack=371 Win=15872 Len=0 TSval=1655903375 TSecr=280214693241,9.134597,66.198.24.240,172.20.8.249,TCP,1514,[TCP segment of a reassembled PDU]242,9.1346,66.198.24.240,172.20.8.249,TCP,106,[TCP segment of a reassembled PDU]243,9.134665,66.198.24.240,172.20.8.249,TCP,1514,[TCP segment of a reassembled PDU]244,9.13468,172.20.8.249,66.198.24.240,TCP,66,62187 > 80 [ACK] Seq=371 Ack=1489 Win=130272 Len=0 TSval=280214860 TSecr=1655903375245,9.134748,66.198.24.240,172.20.8.249,HTTP,137,HTTP/1.1 200 OK  (text/css)246,9.134781,172.20.8.249,66.198.24.240,TCP,66,62187 > 80 [ACK] Seq=371 Ack=3008 Win=129536 Len=0 TSval=280214860 TSecr=1655903375247,9.135235,66.198.24.240,172.20.8.249,TCP,67,"[TCP Out-Of-Order] 80 > 62185 [PSH, ACK] Seq=9511 Ack=809 Win=16384 Len=1 TSval=1661156627 TSecr=280214545[Reassembly error, protocol TCP: New fragment overlaps old data (retransmission?)]"248,9.135282,172.20.8.249,66.198.24.240,TCP,66,[TCP Dup ACK 215#1] 62185 > 80 [ACK] Seq=1707 Ack=9513 Win=131072 Len=0 TSval=280214860 TSecr=1661156477249,9.135488,66.198.24.240,172.20.8.249,TCP,67,[TCP Out-Of-Order] [TCP segment of a reassembled PDU]250,9.135528,172.20.8.249,66.198.24.240,TCP,66,[TCP Window Update] 62186 > 80 [ACK] Seq=1105 Ack=1233 Win=131072 Len=0 TSval=280214860 TSecr=1655369972251,9.154782,66.198.24.240,172.20.8.249,TCP,1514,[TCP segment of a reassembled PDU]252,9.154823,66.198.24.240,172.20.8.249,TCP,1514,[TCP segment of a reassembled PDU]253,9.154881,66.198.24.240,172.20.8.249,TCP,1514,[TCP segment of a reassembled PDU]254,9.154896,172.20.8.249,66.198.24.240,TCP,66,62181 > 80 [ACK] Seq=342 Ack=15969 Win=129600 Len=0 TSval=280214879 TSecr=1661211133255,9.155004,66.198.24.240,172.20.8.249,HTTP,1301,HTTP/1.1 200 OK  (application/x-javascript)256,9.155027,172.20.8.249,66.198.24.240,TCP,66,62181 > 80 [ACK] Seq=342 Ack=18652 Win=126912 Len=0 TSval=280214879 TSecr=1661211133257,9.155092,172.20.8.249,66.198.24.240,TCP,66,[TCP Window Update] 62181 > 80 [ACK] Seq=342 Ack=18652 Win=131072 Len=0 TSval=280214879 TSecr=1661211133258,9.157174,66.198.24.240,172.20.8.249,TCP,1514,[TCP segment of a reassembled PDU]259,9.157291,66.198.24.240,172.20.8.249,HTTP,1185,HTTP/1.1 200 OK  (application/x-javascript)260,9.157344,172.20.8.249,66.198.24.240,TCP,66,62183 > 80 [ACK] Seq=700 Ack=3796 Win=129952 Len=0 TSval=280214881 TSecr=1655902410261,9.158944,66.198.24.240,172.20.8.249,TCP,1514,[TCP segment of a reassembled PDU]262,9.15899,66.198.24.240,172.20.8.249,TCP,1514,[TCP segment of a reassembled PDU]263,9.15904,66.198.24.240,172.20.8.249,TCP,1514,[TCP segment of a reassembled PDU]264,9.159056,172.20.8.249,66.198.24.240,TCP,66,62182 > 80 [ACK] Seq=725 Ack=14409 Win=128160 Len=0 TSval=280214882 TSecr=1661191009265,9.159128,66.198.24.240,172.20.8.249,TCP,1514,[TCP segment of a reassembled PDU]266,9.159167,66.198.24.240,172.20.8.249,TCP,1514,[TCP segment of a reassembled PDU]267,9.159174,172.20.8.249,66.198.24.240,TCP,66,62182 > 80 [ACK] Seq=725 Ack=17305 Win=125280 Len=0 TSval=280214882 TSecr=1661191009268,9.159234,172.20.8.249,66.198.24.240,TCP,66,62182 > 80 [ACK] Seq=725 Ack=18753 Win=127904 Len=0 TSval=280214882 TSecr=1661191009269,9.159327,66.198.24.240,172.20.8.249,TCP,1514,[TCP segment of a reassembled PDU]270,9.159941,66.198.24.240,172.20.8.249,TCP,1514,[TCP segment of a reassembled PDU]271,9.159946,66.198.24.240,172.20.8.249,TCP,1514,[TCP segment of a reassembled PDU]272,9.159948,66.198.24.240,172.20.8.249,TCP,1514,[TCP segment of a reassembled PDU]273,9.159986,66.198.24.240,172.20.8.249,TCP,1514,[TCP segment of a reassembled PDU]274,9.16,172.20.8.249,66.198.24.240,TCP,66,62182 > 80 [ACK] Seq=725 Ack=21649 Win=125024 Len=0 TSval=280214883 TSecr=1661191009275,9.160009,172.20.8.249,66.198.24.240,TCP,66,62182 > 80 [ACK] Seq=725 Ack=24545 Win=122112 Len=0 TSval=280214883 TSecr=1661191009276,9.160146,66.198.24.240,172.20.8.249,TCP,1514,[TCP segment of a reassembled PDU]277,9.160187,172.20.8.249,66.198.24.240,TCP,66,62182 > 80 [ACK] Seq=725 Ack=27441 Win=119232 Len=0 TSval=280214883 TSecr=1661191009278,9.160246,172.20.8.249,66.198.24.240,TCP,66,[TCP Window Update] 62182 > 80 [ACK] Seq=725 Ack=27441 Win=131072 Len=0 TSval=280214883 TSecr=1661191009279,9.219682,66.102.255.57,172.20.8.249,TCP,67,"[TCP Out-Of-Order] 80 > 62178 [PSH, ACK] Seq=31535 Ack=403 Win=15872 Len=1 TSval=3680106308 TSecr=280214523"280,9.219764,172.20.8.249,66.102.255.57,TCP,66,[TCP Window Update] 62178 > 80 [ACK] Seq=403 Ack=31537 Win=131072 Len=0 TSval=280214942 TSecr=3680106158281,9.22346,66.198.24.250,172.20.8.249,TCP,74,"80 > 62190 [SYN, ACK] Seq=0 Ack=1 Win=14480 Len=0 MSS=1460 SACK_PERM=1 TSval=1661211202 TSecr=280214776 WS=512"282,9.223552,172.20.8.249,66.198.24.250,TCP,66,62190 > 80 [ACK] Seq=1 Ack=1 Win=131744 Len=0 TSval=280214945 TSecr=1661211202283,9.224558,66.198.24.250,172.20.8.249,TCP,66,80 > 62189 [ACK] Seq=1 Ack=390 Win=15872 Len=0 TSval=1655783624 TSecr=280214777284,9.224852,66.198.24.250,172.20.8.249,TCP,1514,[TCP segment of a reassembled PDU]285,9.224857,66.198.24.250,172.20.8.249,TCP,1514,[TCP segment of a reassembled PDU]286,9.224932,172.20.8.249,66.198.24.250,TCP,66,62189 > 80 [ACK] Seq=390 Ack=2897 Win=128864 Len=0 TSval=280214946 TSecr=1655783625287,9.225011,66.198.24.250,172.20.8.249,TCP,1514,[TCP segment of a reassembled PDU]288,9.225283,66.198.24.250,172.20.8.249,TCP,1514,[TCP segment of a reassembled PDU]289,9.225288,66.198.24.250,172.20.8.249,TCP,1514,[TCP segment of a reassembled PDU]290,9.225367,66.198.24.250,172.20.8.249,TCP,1514,[TCP segment of a reassembled PDU]291,9.225381,172.20.8.249,66.198.24.250,TCP,66,62189 > 80 [ACK] Seq=390 Ack=5793 Win=128160 Len=0 TSval=280214946 TSecr=1655783625292,9.225434,66.198.24.250,172.20.8.249,TCP,1514,[TCP segment of a reassembled PDU]293,9.22545,172.20.8.249,66.198.24.250,TCP,66,62189 > 80 [ACK] Seq=390 Ack=8689 Win=125280 Len=0 TSval=280214946 TSecr=1655783625294,9.225498,66.198.24.250,172.20.8.249,TCP,1514,[TCP segment of a reassembled PDU]295,9.225568,66.198.24.250,172.20.8.249,TCP,1514,[TCP segment of a reassembled PDU]296,9.225581,172.20.8.249,66.198.24.250,TCP,66,62189 > 80 [ACK] Seq=390 Ack=11585 Win=122368 Len=0 TSval=280214946 TSecr=1655783625297,9.225714,66.198.24.250,172.20.8.249,TCP,1514,[TCP segment of a reassembled PDU]298,9.22575,172.20.8.249,66.198.24.250,TCP,66,62189 > 80 [ACK] Seq=390 Ack=14481 Win=119488 Len=0 TSval=280214947 TSecr=1655783625299,9.226245,172.20.8.249,66.198.24.250,TCP,66,[TCP Window Update] 62189 > 80 [ACK] Seq=390 Ack=14481 Win=131072 Len=0 TSval=280214947 TSecr=1655783625300,9.257463,66.198.24.240,172.20.8.249,TCP,1514,[TCP Previous segment not captured] [TCP segment of a reassembled PDU]301,9.257475,66.198.24.240,172.20.8.249,TCP,1514,[TCP Previous segment not captured] [TCP segment of a reassembled PDU]302,9.25762,66.198.24.240,172.20.8.249,TCP,783,[TCP segment of a reassembled PDU]303,9.257684,172.20.8.249,66.198.24.240,TCP,78,[TCP Dup ACK 215#2] 62185 > 80 [ACK] Seq=1707 Ack=9513 Win=131072 Len=0 TSval=280214978 TSecr=1661156477 SLE=10961 SRE=12409304,9.257781,172.20.8.249,66.198.24.240,TCP,86,[TCP Dup ACK 215#3] 62185 > 80 [ACK] Seq=1707 Ack=9513 Win=131072 Len=0 TSval=280214978 TSecr=1661156477 SLE=13857 SRE=15305 SLE=10961 SRE=12409305,9.257782,172.20.8.249,66.198.24.240,TCP,86,[TCP Dup ACK 215#4] 62185 > 80 [ACK] Seq=1707 Ack=9513 Win=131072 Len=0 TSval=280214978 TSecr=1661156477 SLE=13857 SRE=16022 SLE=10961 SRE=12409306,9.280946,66.198.24.240,172.20.8.249,TCP,67,"[TCP Out-Of-Order] 80 > 62187 [PSH, ACK] Seq=3006 Ack=371 Win=15872 Len=1 TSval=1655903525 TSecr=280214693[Reassembly error, protocol TCP: New fragment overlaps old data (retransmission?)]"307,9.28108,172.20.8.249,66.198.24.240,TCP,66,[TCP Window Update] 62187 > 80 [ACK] Seq=371 Ack=3008 Win=131072 Len=0 TSval=280215001 TSecr=1655903375308,9.291603,172.20.8.249,216.58.216.238,TCP,54,62052 > 443 [ACK] Seq=1 Ack=1 Win=4096 Len=0309,9.304236,66.198.24.240,172.20.8.249,TCP,67,"[TCP Out-Of-Order] 80 > 62181 [PSH, ACK] Seq=18650 Ack=342 Win=15872 Len=1 TSval=1661211283 TSecr=280214855[Reassembly error, protocol TCP: New fragment overlaps old data (retransmission?)]"310,9.304314,172.20.8.249,66.198.24.240,TCP,66,[TCP Dup ACK 256#1] 62181 > 80 [ACK] Seq=342 Ack=18652 Win=131072 Len=0 TSval=280215023 TSecr=1661211133311,9.306211,66.198.24.240,172.20.8.249,TCP,67,[TCP Out-Of-Order] [TCP segment of a reassembled PDU]312,9.306289,172.20.8.249,66.198.24.240,TCP,66,[TCP Dup ACK 277#1] 62182 > 80 [ACK] Seq=725 Ack=27441 Win=131072 Len=0 TSval=280215024 TSecr=1661191009313,9.308246,66.198.24.240,172.20.8.249,TCP,67,"[TCP Out-Of-Order] 80 > 62183 [PSH, ACK] Seq=3794 Ack=700 Win=16896 Len=1 TSval=1655902560 TSecr=280214855[Reassembly error, protocol TCP: New fragment overlaps old data (retransmission?)]"314,9.308329,172.20.8.249,66.198.24.240,TCP,66,[TCP Window Update] 62183 > 80 [ACK] Seq=700 Ack=3796 Win=131072 Len=0 TSval=280215026 TSecr=1655902410315,9.33172,66.198.24.240,172.20.8.249,TCP,1514,[TCP segment of a reassembled PDU]316,9.331791,66.198.24.240,172.20.8.249,TCP,1514,[TCP segment of a reassembled PDU]317,9.332045,66.198.24.240,172.20.8.249,TCP,1514,[TCP segment of a reassembled PDU]318,9.332077,172.20.8.249,66.198.24.240,TCP,66,62182 > 80 [ACK] Seq=725 Ack=30337 Win=128160 Len=0 TSval=280215049 TSecr=1661191186319,9.332078,172.20.8.249,66.198.24.240,TCP,66,[TCP Window Update] 62182 > 80 [ACK] Seq=725 Ack=30337 Win=131072 Len=0 TSval=280215049 TSecr=1661191186320,9.332188,66.198.24.240,172.20.8.249,TCP,1514,[TCP segment of a reassembled PDU]321,9.332266,172.20.8.249,66.198.24.240,TCP,66,62182 > 80 [ACK] Seq=725 Ack=33233 Win=128160 Len=0 TSval=280215049 TSecr=1661191186322,9.33234,172.20.8.249,66.198.24.240,TCP,66,[TCP Window Update] 62182 > 80 [ACK] Seq=725 Ack=33233 Win=131072 Len=0 TSval=280215049 TSecr=1661191186323,9.332408,66.198.24.240,172.20.8.249,TCP,1514,[TCP segment of a reassembled PDU]324,9.332871,66.198.24.240,172.20.8.249,HTTP,1263,HTTP/1.1 200 OK  (application/x-javascript)325,9.332917,172.20.8.249,66.198.24.240,TCP,66,62182 > 80 [ACK] Seq=725 Ack=35878 Win=129856 Len=0 TSval=280215050 TSecr=1661191187326,9.366133,172.20.8.249,66.198.24.250,TCP,78,62191 > 80 [SYN] Seq=0 Win=65535 Len=0 MSS=1460 WS=32 TSval=280215083 TSecr=0 SACK_PERM=1327,9.366376,172.20.8.249,66.198.24.250,HTTP,455,GET /tps/i3/TB1358JHXXXXXXlaXXXW4780FXX-110-110.png HTTP/1.1 328,9.36817,172.20.8.249,66.198.24.250,TCP,78,62192 > 80 [SYN] Seq=0 Win=65535 Len=0 MSS=1460 WS=32 TSval=280215085 TSecr=0 SACK_PERM=1329,9.370175,172.20.8.249,66.198.24.250,TCP,78,62193 > 80 [SYN] Seq=0 Win=65535 Len=0 MSS=1460 WS=32 TSval=280215086 TSecr=0 SACK_PERM=1330,9.371304,172.20.8.249,66.198.24.250,TCP,78,62194 > 80 [SYN] Seq=0 Win=65535 Len=0 MSS=1460 WS=32 TSval=280215087 TSecr=0 SACK_PERM=1332,9.373489,172.20.8.249,66.198.24.240,HTTP,405,GET /alilog/mlog/aplus_v2.js HTTP/1.1 333,9.375939,66.198.24.250,172.20.8.249,TCP,67,[TCP Out-Of-Order] [TCP segment of a reassembled PDU]334,9.376001,172.20.8.249,66.198.24.250,TCP,66,[TCP Dup ACK 298#1] 62189 > 80 [ACK] Seq=390 Ack=14481 Win=13