"No.","Time","Source","Destination","Protocol","Length","Info"
"2","0.285532000","192.168.1.138","74.125.228.212","TCP","66","50090 > 443 [FIN, ACK] Seq=1 Ack=1 Win=4116 Len=0 TSval=151822596 TSecr=2664003074"
"3","0.308341000","74.125.228.212","192.168.1.138","TCP","66","443 > 50090 [FIN, ACK] Seq=1 Ack=2 Win=350 Len=0 TSval=2664017780 TSecr=151822596"
"4","0.308450000","192.168.1.138","74.125.228.212","TCP","66","50090 > 443 [ACK] Seq=2 Ack=2 Win=4116 Len=0 TSval=151822618 TSecr=2664017780"
"5","0.379302000","192.168.1.138","192.168.1.211","TCP","181","[TCP segment of a reassembled PDU]"
"6","0.383066000","192.168.1.211","192.168.1.138","TCP","99","[TCP segment of a reassembled PDU]"
"7","0.383168000","192.168.1.138","192.168.1.211","TCP","66","49657 > 8009 [ACK] Seq=116 Ack=34 Win=4094 Len=0 TSval=151822691 TSecr=4535298"
"8","0.383424000","192.168.1.211","192.168.1.138","TCP","177","[TCP segment of a reassembled PDU]"
"9","0.383488000","192.168.1.138","192.168.1.211","TCP","66","49657 > 8009 [ACK] Seq=116 Ack=145 Win=4092 Len=0 TSval=151822691 TSecr=4535298"
"18","4.094959000","192.168.1.138","64.233.171.113","TCP","78","50092 > 80 [SYN] Seq=0 Win=65535 Len=0 MSS=1460 WS=32 TSval=151826397 TSecr=0 SACK_PERM=1"
"19","4.124872000","64.233.171.113","192.168.1.138","TCP","74","80 > 50092 [SYN, ACK] Seq=0 Ack=1 Win=42540 Len=0 MSS=1430 SACK_PERM=1 TSval=87525070 TSecr=151826397 WS=128"
"20","4.124982000","192.168.1.138","64.233.171.113","TCP","66","50092 > 80 [ACK] Seq=1 Ack=1 Win=131872 Len=0 TSval=151826427 TSecr=87525070"
"21","4.125279000","192.168.1.138","64.233.171.113","HTTP","446","GET / HTTP/1.1 "
"22","4.156804000","64.233.171.113","192.168.1.138","TCP","66","80 > 50092 [ACK] Seq=1 Ack=381 Win=43648 Len=0 TSval=87525100 TSecr=151826427"
"23","4.169657000","64.233.171.113","192.168.1.138","HTTP","606","HTTP/1.1 301 Moved Permanently  (text/html)"
"24","4.169810000","192.168.1.138","64.233.171.113","TCP","66","50092 > 80 [ACK] Seq=381 Ack=541 Win=131328 Len=0 TSval=151826470 TSecr=87525106"
"25","4.177036000","192.168.1.138","74.125.228.212","TCP","78","50093 > 80 [SYN] Seq=0 Win=65535 Len=0 MSS=1460 WS=32 TSval=151826477 TSecr=0 SACK_PERM=1"
"26","4.197952000","74.125.228.212","192.168.1.138","TCP","74","80 > 50093 [SYN, ACK] Seq=0 Ack=1 Win=42540 Len=0 MSS=1430 SACK_PERM=1 TSval=2664024676 TSecr=151826477 WS=128"
"27","4.198130000","192.168.1.138","74.125.228.212","TCP","66","50093 > 80 [ACK] Seq=1 Ack=1 Win=131872 Len=0 TSval=151826498 TSecr=2664024676"
"28","4.198431000","192.168.1.138","74.125.228.212","HTTP","450","GET / HTTP/1.1 "
"29","4.221348000","74.125.228.212","192.168.1.138","TCP","66","80 > 50093 [ACK] Seq=1 Ack=385 Win=43648 Len=0 TSval=2664024697 TSecr=151826498"
"30","4.243557000","74.125.228.212","192.168.1.138","HTTP","1078","HTTP/1.1 302 Found  (text/html)"
"31","4.243719000","192.168.1.138","74.125.228.212","TCP","66","50093 > 80 [ACK] Seq=385 Ack=1013 Win=130848 Len=0 TSval=151826542 TSecr=2664024713"
"32","4.248954000","192.168.1.138","74.125.228.212","TCP","78","50094 > 443 [SYN] Seq=0 Win=65535 Len=0 MSS=1460 WS=32 TSval=151826547 TSecr=0 SACK_PERM=1"
"33","4.269915000","74.125.228.212","192.168.1.138","TCP","74","443 > 50094 [SYN, ACK] Seq=0 Ack=1 Win=42540 Len=0 MSS=1430 SACK_PERM=1 TSval=2664013073 TSecr=151826547 WS=128"
"34","4.270010000","192.168.1.138","74.125.228.212","TCP","66","50094 > 443 [ACK] Seq=1 Ack=1 Win=131872 Len=0 TSval=151826568 TSecr=2664013073"
"35","4.270303000","192.168.1.138","74.125.228.212","TLSv1.2","277","Client Hello"
"36","4.302424000","74.125.228.212","192.168.1.138","TCP","66","443 > 50094 [ACK] Seq=1 Ack=212 Win=43648 Len=0 TSval=2664013096 TSecr=151826568"
"37","4.306858000","74.125.228.212","192.168.1.138","TLSv1.2","1484","Server Hello"
"38","4.307438000","74.125.228.212","192.168.1.138","TCP","1484","[TCP segment of a reassembled PDU]"
"39","4.307445000","74.125.228.212","192.168.1.138","TLSv1.2","1326","Certificate"
"40","4.307447000","74.125.228.212","192.168.1.138","TLSv1.2","95","Server Key Exchange"
"41","4.307543000","192.168.1.138","74.125.228.212","TCP","66","50094 > 443 [ACK] Seq=212 Ack=2837 Win=129632 Len=0 TSval=151826603 TSecr=2664013097"
"42","4.307543000","192.168.1.138","74.125.228.212","TCP","66","50094 > 443 [ACK] Seq=212 Ack=4097 Win=128384 Len=0 TSval=151826603 TSecr=2664013097"
"43","4.307608000","192.168.1.138","74.125.228.212","TCP","66","50094 > 443 [ACK] Seq=212 Ack=4126 Win=128352 Len=0 TSval=151826603 TSecr=2664013098"
"44","4.309235000","192.168.1.138","74.125.228.212","TLSv1.2","357","Client Key Exchange, Change Cipher Spec, Hello Request, Hello Request, Hello Request, Hello Request"
"45","4.312341000","192.168.1.138","74.125.228.212","TLSv1.2","119","Application Data"
"46","4.312394000","192.168.1.138","74.125.228.212","TLSv1.2","116","Application Data"
"47","4.312424000","192.168.1.138","74.125.228.212","TLSv1.2","108","Application Data"
"48","4.312705000","192.168.1.138","74.125.228.212","TLSv1.2","518","Application Data"
"49","4.341276000","74.125.228.212","192.168.1.138","TLSv1.2","360","New Session Ticket, Change Cipher Spec, Hello Request, Hello Request"
"50","4.341342000","192.168.1.138","74.125.228.212","TCP","66","50094 > 443 [ACK] Seq=1100 Ack=4420 Win=130752 Len=0 TSval=151826636 TSecr=2664013134"
"51","4.341941000","74.125.228.212","192.168.1.138","TLSv1.2","122","Application Data"
"52","4.341944000","74.125.228.212","192.168.1.138","TLSv1.2","108","Application Data"
"53","4.341946000","74.125.228.212","192.168.1.138","TCP","66","443 > 50094 [ACK] Seq=4518 Ack=606 Win=44800 Len=0 TSval=2664013137 TSecr=151826608"
"54","4.341946000","74.125.228.212","192.168.1.138","TLSv1.2","104","Application Data"
"55","4.341989000","192.168.1.138","74.125.228.212","TCP","66","50094 > 443 [ACK] Seq=1100 Ack=4476 Win=131008 Len=0 TSval=151826636 TSecr=2664013134"
"56","4.341989000","192.168.1.138","74.125.228.212","TCP","66","50094 > 443 [ACK] Seq=1100 Ack=4518 Win=130944 Len=0 TSval=151826636 TSecr=2664013134"
"57","4.342011000","192.168.1.138","74.125.228.212","TCP","66","50094 > 443 [ACK] Seq=1100 Ack=4556 Win=131008 Len=0 TSval=151826636 TSecr=2664013137"
"58","4.342093000","192.168.1.138","74.125.228.212","TLSv1.2","104","Application Data"
"59","4.342520000","74.125.228.212","192.168.1.138","TCP","66","443 > 50094 [ACK] Seq=4556 Ack=1100 Win=45824 Len=0 TSval=2664013137 TSecr=151826608"
"60","4.403114000","74.125.228.212","192.168.1.138","TCP","66","443 > 50094 [ACK] Seq=4556 Ack=1138 Win=45824 Len=0 TSval=2664013207 TSecr=151826636"
"61","4.518926000","74.125.228.212","192.168.1.138","TLSv1.2","606","Application Data"
"62","4.519090000","192.168.1.138","74.125.228.212","TCP","66","50094 > 443 [ACK] Seq=1138 Ack=5096 Win=130528 Len=0 TSval=151826811 TSecr=2664013322"
"63","4.519330000","74.125.228.212","192.168.1.138","TLSv1.2","1484","Application Data"
"64","4.519339000","74.125.228.212","192.168.1.138","TLSv1.2","1484","Application Data"
"65","4.519340000","74.125.228.212","192.168.1.138","TLSv1.2","1484","Application Data"
"66","4.519394000","74.125.228.212","192.168.1.138","TLSv1.2","1484","Application Data"
"67","4.519397000","74.125.228.212","192.168.1.138","TLSv1.2","1484","Application Data"
"68","4.519398000","74.125.228.212","192.168.1.138","TLSv1.2","1484","Application Data"
"69","4.519445000","192.168.1.138","74.125.228.212","TCP","66","50094 > 443 [ACK] Seq=1138 Ack=6514 Win=129632 Len=0 TSval=151826811 TSecr=2664013322"
"70","4.519445000","192.168.1.138","74.125.228.212","TCP","66","50094 > 443 [ACK] Seq=1138 Ack=7932 Win=128224 Len=0 TSval=151826811 TSecr=2664013322"
"71","4.519446000","192.168.1.138","74.125.228.212","TCP","66","50094 > 443 [ACK] Seq=1138 Ack=9350 Win=126816 Len=0 TSval=151826811 TSecr=2664013322"
"72","4.519446000","192.168.1.138","74.125.228.212","TCP","66","50094 > 443 [ACK] Seq=1138 Ack=10768 Win=125376 Len=0 TSval=151826811 TSecr=2664013322"
"73","4.519468000","192.168.1.138","74.125.228.212","TCP","66","50094 > 443 [ACK] Seq=1138 Ack=12186 Win=123968 Len=0 TSval=151826811 TSecr=2664013322"
"74","4.519468000","192.168.1.138","74.125.228.212","TCP","66","50094 > 443 [ACK] Seq=1138 Ack=13604 Win=122560 Len=0 TSval=151826811 TSecr=2664013322"
"75","4.520032000","74.125.228.212","192.168.1.138","TLSv1.2","1484","Application Data"
"76","4.520035000","74.125.228.212","192.168.1.138","TLSv1.2","1484","Application Data"
"77","4.520075000","74.125.228.212","192.168.1.138","TLSv1.2","1484","Application Data"
"78","4.520079000","74.125.228.212","192.168.1.138","TLSv1.2","1255","Application Data"
"79","4.520088000","192.168.1.138","74.125.228.212","TCP","66","50094 > 443 [ACK] Seq=1138 Ack=15022 Win=121120 Len=0 TSval=151826812 TSecr=2664013322"
"80","4.520089000","192.168.1.138","74.125.228.212","TCP","66","50094 > 443 [ACK] Seq=1138 Ack=16440 Win=119712 Len=0 TSval=151826812 TSecr=2664013322"
"81","4.520103000","192.168.1.138","74.125.228.212","TCP","66","50094 > 443 [ACK] Seq=1138 Ack=17858 Win=118304 Len=0 TSval=151826812 TSecr=2664013322"
"82","4.520113000","192.168.1.138","74.125.228.212","TCP","66","50094 > 443 [ACK] Seq=1138 Ack=19047 Win=117120 Len=0 TSval=151826812 TSecr=2664013322"
"83","4.520181000","74.125.228.212","192.168.1.138","TLSv1.2","1484","Application Data"
"84","4.520185000","74.125.228.212","192.168.1.138","TLSv1.2","462","Application Data"
"85","4.520187000","74.125.228.212","192.168.1.138","TLSv1.2","1484","Application Data"
"86","4.520188000","74.125.228.212","192.168.1.138","TLSv1.2","1484","Application Data"
"87","4.520229000","74.125.228.212","192.168.1.138","TLSv1.2","1484","Application Data"
"88","4.520231000","74.125.228.212","192.168.1.138","TLSv1.2","1484","Application Data"
"89","4.520273000","74.125.228.212","192.168.1.138","TLSv1.2","1484","Application Data"
"90","4.520277000","74.125.228.212","192.168.1.138","TLSv1.2","1484","Application Data"
"91","4.520317000","74.125.228.212","192.168.1.138","TLSv1.2","1484","Application Data"
"92","4.520334000","192.168.1.138","74.125.228.212","TCP","66","50094 > 443 [ACK] Seq=1138 Ack=20465 Win=115680 Len=0 TSval=151826812 TSecr=2664013322"
"93","4.520335000","192.168.1.138","74.125.228.212","TCP","66","50094 > 443 [ACK] Seq=1138 Ack=20861 Win=115296 Len=0 TSval=151826812 TSecr=2664013322"
"94","4.520335000","192.168.1.138","74.125.228.212","TCP","66","50094 > 443 [ACK] Seq=1138 Ack=22279 Win=113888 Len=0 TSval=151826812 TSecr=2664013322"
"95","4.520335000","192.168.1.138","74.125.228.212","TCP","66","50094 > 443 [ACK] Seq=1138 Ack=23697 Win=112448 Len=0 TSval=151826812 TSecr=2664013322"
"96","4.520336000","192.168.1.138","74.125.228.212","TCP","66","50094 > 443 [ACK] Seq=1138 Ack=25115 Win=111040 Len=0 TSval=151826812 TSecr=2664013322"
"97","4.520336000","192.168.1.138","74.125.228.212","TCP","66","50094 > 443 [ACK] Seq=1138 Ack=26533 Win=109632 Len=0 TSval=151826812 TSecr=2664013322"
"98","4.520336000","192.168.1.138","74.125.228.212","TCP","66","50094 > 443 [ACK] Seq=1138 Ack=27951 Win=108192 Len=0 TSval=151826812 TSecr=2664013322"
"99","4.520337000","192.168.1.138","74.125.228.212","TCP","66","50094 > 443 [ACK] Seq=1138 Ack=29369 Win=106784 Len=0 TSval=151826812 TSecr=2664013322"
"100","4.520367000","192.168.1.138","74.125.228.212","TCP","66","50094 > 443 [ACK] Seq=1138 Ack=30787 Win=105376 Len=0 TSval=151826812 TSecr=2664013322"
"101","4.520827000","192.168.1.138","74.125.228.212","TCP","66","[TCP Window Update] 50094 > 443 [ACK] Seq=1138 Ack=30787 Win=122784 Len=0 TSval=151826812 TSecr=2664013322"
"102","4.520873000","192.168.1.138","74.125.228.212","TCP","66","[TCP Window Update] 50094 > 443 [ACK] Seq=1138 Ack=30787 Win=131072 Len=0 TSval=151826812 TSecr=2664013322"
"103","4.520970000","74.125.228.212","192.168.1.138","TLSv1.2","1484","Application Data"
"104","4.520976000","74.125.228.212","192.168.1.138","TLSv1.2","1484","Application Data"
"105","4.521018000","74.125.228.212","192.168.1.138","TLSv1.2","1484","Application Data"
"106","4.521020000","74.125.228.212","192.168.1.138","TLSv1.2","1484","Application Data"
"107","4.521061000","74.125.228.212","192.168.1.138","TLSv1.2","1272","Application Data"
"108","4.521066000","74.125.228.212","192.168.1.138","TLSv1.2","1484","Application Data"
"109","4.521110000","74.125.228.212","192.168.1.138","TLSv1.2","1484","Application Data"
"110","4.521113000","74.125.228.212","192.168.1.138","TLSv1.2","1484","Application Data"
"111","4.521167000","74.125.228.212","192.168.1.138","TLSv1.2","1484","Application Data"
"112","4.521173000","74.125.228.212","192.168.1.138","TLSv1.2","1484","Application Data"
"113","4.521218000","74.125.228.212","192.168.1.138","TLSv1.2","1484","Application Data"
"114","4.521223000","74.125.228.212","192.168.1.138","TLSv1.2","1484","Application Data"
"115","4.521262000","192.168.1.138","74.125.228.212","TCP","66","50094 > 443 [ACK] Seq=1138 Ack=32205 Win=129632 Len=0 TSval=151826812 TSecr=2664013322"
"116","4.521263000","192.168.1.138","74.125.228.212","TCP","66","50094 > 443 [ACK] Seq=1138 Ack=33623 Win=128224 Len=0 TSval=151826812 TSecr=2664013322"
"117","4.521263000","192.168.1.138","74.125.228.212","TCP","66","50094 > 443 [ACK] Seq=1138 Ack=35041 Win=126816 Len=0 TSval=151826812 TSecr=2664013322"
"118","4.521263000","192.168.1.138","74.125.228.212","TCP","66","50094 > 443 [ACK] Seq=1138 Ack=36459 Win=125376 Len=0 TSval=151826812 TSecr=2664013322"
"119","4.521264000","192.168.1.138","74.125.228.212","TCP","66","50094 > 443 [ACK] Seq=1138 Ack=37665 Win=124192 Len=0 TSval=151826813 TSecr=2664013322"
"120","4.521264000","192.168.1.138","74.125.228.212","TCP","66","50094 > 443 [ACK] Seq=1138 Ack=39083 Win=122752 Len=0 TSval=151826813 TSecr=2664013323"
"121","4.521264000","192.168.1.138","74.125.228.212","TCP","66","50094 > 443 [ACK] Seq=1138 Ack=40501 Win=121344 Len=0 TSval=151826813 TSecr=2664013323"
"122","4.521265000","192.168.1.138","74.125.228.212","TCP","66","50094 > 443 [ACK] Seq=1138 Ack=41919 Win=119936 Len=0 TSval=151826813 TSecr=2664013323"
"123","4.521265000","192.168.1.138","74.125.228.212","TCP","66","[TCP Window Update] 50094 > 443 [ACK] Seq=1138 Ack=41919 Win=131072 Len=0 TSval=151826813 TSecr=2664013323"
"124","4.521265000","192.168.1.138","74.125.228.212","TCP","66","50094 > 443 [ACK] Seq=1138 Ack=43337 Win=129632 Len=0 TSval=151826813 TSecr=2664013323"
"125","4.521265000","192.168.1.138","74.125.228.212","TCP","66","50094 > 443 [ACK] Seq=1138 Ack=44755 Win=128224 Len=0 TSval=151826813 TSecr=2664013323"
"126","4.521266000","192.168.1.138","74.125.228.212","TCP","66","50094 > 443 [ACK] Seq=1138 Ack=46173 Win=126816 Len=0 TSval=151826813 TSecr=2664013323"
"127","4.521266000","192.168.1.138","74.125.228.212","TCP","66","50094 > 443 [ACK] Seq=1138 Ack=47591 Win=125376 Len=0 TSval=151826813 TSecr=2664013323"
"128","4.521330000","192.168.1.138","74.125.228.212","TCP","66","[TCP Window Update] 50094 > 443 [ACK] Seq=1138 Ack=47591 Win=131072 Len=0 TSval=151826813 TSecr=2664013323"
"129","4.540072000","74.125.228.212","192.168.1.138","TLSv1.2","1484","Application Data"
"130","4.540448000","74.125.228.212","192.168.1.138","TLSv1.2","1484","Application Data"
"131","4.540494000","192.168.1.138","74.125.228.212","TCP","66","50094 > 443 [ACK] Seq=1138 Ack=50427 Win=129632 Len=0 TSval=151826831 TSecr=2664013344"
"132","4.541160000","74.125.228.212","192.168.1.138","TLSv1.2","1484","Application Data"
"133","4.541207000","192.168.1.138","74.125.228.212","TCP","66","50094 > 443 [ACK] Seq=1138 Ack=51845 Win=131072 Len=0 TSval=151826832 TSecr=2664013344"
"134","4.541805000","74.125.228.212","192.168.1.138","TLSv1.2","1484","Application Data"
"135","4.541809000","74.125.228.212","192.168.1.138","TLSv1.2","1484","Application Data"
"136","4.541842000","74.125.228.212","192.168.1.138","TLSv1.2","1484","Application Data"
"137","4.541878000","74.125.228.212","192.168.1.138","TLSv1.2","1484","Application Data"
"138","4.541922000","74.125.228.212","192.168.1.138","TLSv1.2","1484","Application Data"
"139","4.541926000","74.125.228.212","192.168.1.138","TLSv1.2","1484","Application Data"
"140","4.541961000","74.125.228.212","192.168.1.138","TLSv1.2","1484","Application Data"
"141","4.542003000","74.125.228.212","192.168.1.138","TLSv1.2","1484","Application Data"
"142","4.542006000","74.125.228.212","192.168.1.138","TLSv1.2","1484","Application Data"
"143","4.542049000","74.125.228.212","192.168.1.138","TLSv1.2","888","Application Data"
"144","4.542063000","192.168.1.138","74.125.228.212","TCP","66","50094 > 443 [ACK] Seq=1138 Ack=54681 Win=128224 Len=0 TSval=151826832 TSecr=2664013344"
"145","4.542063000","192.168.1.138","74.125.228.212","TCP","66","[TCP Window Update] 50094 > 443 [ACK] Seq=1138 Ack=54681 Win=131072 Len=0 TSval=151826832 TSecr=2664013344"
"146","4.542063000","192.168.1.138","74.125.228.212","TCP","66","50094 > 443 [ACK] Seq=1138 Ack=56099 Win=131072 Len=0 TSval=151826832 TSecr=2664013344"
"147","4.542063000","192.168.1.138","74.125.228.212","TCP","66","50094 > 443 [ACK] Seq=1138 Ack=58935 Win=129632 Len=0 TSval=151826832 TSecr=2664013344"
"148","4.542063000","192.168.1.138","74.125.228.212","TCP","66","50094 > 443 [ACK] Seq=1138 Ack=60353 Win=131072 Len=0 TSval=151826832 TSecr=2664013344"
"149","4.542064000","192.168.1.138","74.125.228.212","TCP","66","50094 > 443 [ACK] Seq=1138 Ack=63189 Win=128224 Len=0 TSval=151826832 TSecr=2664013344"
"150","4.542064000","192.168.1.138","74.125.228.212","TCP","66","50094 > 443 [ACK] Seq=1138 Ack=64607 Win=131072 Len=0 TSval=151826832 TSecr=2664013344"
"151","4.542100000","192.168.1.138","74.125.228.212","TCP","66","50094 > 443 [ACK] Seq=1138 Ack=65429 Win=130240 Len=0 TSval=151826832 TSecr=2664013344"
"152","4.542893000","192.168.1.138","74.125.228.212","TLSv1.2","112","Application Data"
"153","4.563279000","74.125.228.212","192.168.1.138","TCP","66","443 > 50094 [ACK] Seq=65429 Ack=1184 Win=45824 Len=0 TSval=2664013367 TSecr=151826833"
"155","4.586332000","192.168.1.138","74.125.228.212","TLSv1.2","320","Application Data"
"156","4.586393000","192.168.1.138","74.125.228.212","TLSv1.2","169","Application Data"
"157","4.606697000","74.125.228.212","192.168.1.138","TCP","66","443 > 50094 [ACK] Seq=65429 Ack=1438 Win=46848 Len=0 TSval=2664013410 TSecr=151826875"
"160","4.607875000","74.125.228.212","192.168.1.138","TCP","66","443 > 50094 [ACK] Seq=65429 Ack=1541 Win=46848 Len=0 TSval=2664013411 TSecr=151826875"
"162","4.617099000","74.125.228.212","192.168.1.138","TLSv1.2","221","Application Data"
"163","4.617171000","192.168.1.138","74.125.228.212","TCP","66","50094 > 443 [ACK] Seq=1541 Ack=65584 Win=130912 Len=0 TSval=151826905 TSecr=2664013420"
"164","4.617806000","74.125.228.212","192.168.1.138","TLSv1.2","1484","Application Data"
"165","4.617811000","74.125.228.212","192.168.1.138","TLSv1.2","1484","Application Data"
"166","4.617850000","74.125.228.212","192.168.1.138","TLSv1.2","1484","Application Data"
"167","4.617851000","74.125.228.212","192.168.1.138","TLSv1.2","1484","Application Data"
"168","4.617883000","74.125.228.212","192.168.1.138","TLSv1.2","1484","Application Data"
"169","4.617900000","192.168.1.138","74.125.228.212","TCP","66","50094 > 443 [ACK] Seq=1541 Ack=67002 Win=129472 Len=0 TSval=151826905 TSecr=2664013420"
"170","4.617900000","192.168.1.138","74.125.228.212","TCP","66","50094 > 443 [ACK] Seq=1541 Ack=68420 Win=128064 Len=0 TSval=151826905 TSecr=2664013420"
"171","4.617900000","192.168.1.138","74.125.228.212","TCP","66","50094 > 443 [ACK] Seq=1541 Ack=69838 Win=126656 Len=0 TSval=151826905 TSecr=2664013420"
"172","4.617900000","192.168.1.138","74.125.228.212","TCP","66","50094 > 443 [ACK] Seq=1541 Ack=71256 Win=125216 Len=0 TSval=151826905 TSecr=2664013420"
"173","4.617930000","192.168.1.138","74.125.228.212","TCP","66","50094 > 443 [ACK] Seq=1541 Ack=72674 Win=123808 Len=0 TSval=151826905 TSecr=2664013420"
"174","4.617988000","74.125.228.212","192.168.1.138","TLSv1.2","1484","Application Data"
"175","4.617992000","74.125.228.212","192.168.1.138","TLSv1.2","1484","Application Data"
"176","4.618034000","192.168.1.138","74.125.228.212","TCP","66","50094 > 443 [ACK] Seq=1541 Ack=74092 Win=122400 Len=0 TSval=151826905 TSecr=2664013420"
"177","4.618042000","192.168.1.138","74.125.228.212","TCP","66","50094 > 443 [ACK] Seq=1541 Ack=75510 Win=120960 Len=0 TSval=151826905 TSecr=2664013420"
"178","4.618174000","192.168.1.138","74.125.228.212","TCP","66","[TCP Window Update] 50094 > 443 [ACK] Seq=1541 Ack=75510 Win=131072 Len=0 TSval=151826906 TSecr=2664013420"
"179","4.618606000","74.125.228.212","192.168.1.138","TLSv1.2","1484","Application Data"
"180","4.618610000","74.125.228.212","192.168.1.138","TLSv1.2","1484","Application Data"
"181","4.618655000","74.125.228.212","192.168.1.138","TLSv1.2","1484","Application Data"
"182","4.618657000","74.125.228.212","192.168.1.138","TLSv1.2","1484","Application Data"
"183","4.618658000","74.125.228.212","192.168.1.138","TLSv1.2","563","Application Data"
"184","4.618668000","192.168.1.138","74.125.228.212","TCP","66","50094 > 443 [ACK] Seq=1541 Ack=76928 Win=129632 Len=0 TSval=151826906 TSecr=2664013420"
"185","4.618668000","192.168.1.138","74.125.228.212","TCP","66","50094 > 443 [ACK] Seq=1541 Ack=78346 Win=128224 Len=0 TSval=151826906 TSecr=2664013420"
"186","4.618669000","192.168.1.138","74.125.228.212","TCP","66","50094 > 443 [ACK] Seq=1541 Ack=79764 Win=126816 Len=0 TSval=151826906 TSecr=2664013420"
"187","4.618681000","192.168.1.138","74.125.228.212","TCP","66","50094 > 443 [ACK] Seq=1541 Ack=81182 Win=125376 Len=0 TSval=151826906 TSecr=2664013420"
"188","4.618686000","192.168.1.138","74.125.228.212","TCP","66","50094 > 443 [ACK] Seq=1541 Ack=81679 Win=124896 Len=0 TSval=151826906 TSecr=2664013420"
"189","4.618744000","74.125.228.212","192.168.1.138","TLSv1.2","1484","Application Data"
"190","4.618750000","74.125.228.212","192.168.1.138","TLSv1.2","1484","Application Data"
"191","4.618751000","74.125.228.212","192.168.1.138","TLSv1.2","1484","Application Data"
"192","4.618799000","74.125.228.212","192.168.1.138","TLSv1.2","1484","Application Data"
"193","4.618804000","74.125.228.212","192.168.1.138","TLSv1.2","521","Application Data"
"194","4.618805000","74.125.228.212","192.168.1.138","TLSv1.2","112","Application Data"
"195","4.618806000","74.125.228.212","192.168.1.138","TLSv1.2","144","Application Data"
"196","4.618852000","192.168.1.138","74.125.228.212","TCP","66","50094 > 443 [ACK] Seq=1541 Ack=83097 Win=123456 Len=0 TSval=151826906 TSecr=2664013420"
"197","4.618852000","192.168.1.138","74.125.228.212","TCP","66","50094 > 443 [ACK] Seq=1541 Ack=84515 Win=122048 Len=0 TSval=151826906 TSecr=2664013421"
"198","4.618853000","192.168.1.138","74.125.228.212","TCP","66","50094 > 443 [ACK] Seq=1541 Ack=85933 Win=120640 Len=0 TSval=151826906 TSecr=2664013421"
"199","4.618853000","192.168.1.138","74.125.228.212","TCP","66","50094 > 443 [ACK] Seq=1541 Ack=87351 Win=119200 Len=0 TSval=151826906 TSecr=2664013421"
"200","4.618853000","192.168.1.138","74.125.228.212","TCP","66","50094 > 443 [ACK] Seq=1541 Ack=87806 Win=118752 Len=0 TSval=151826906 TSecr=2664013421"
"201","4.618853000","192.168.1.138","74.125.228.212","TCP","66","50094 > 443 [ACK] Seq=1541 Ack=87852 Win=118720 Len=0 TSval=151826906 TSecr=2664013421"
"202","4.618853000","192.168.1.138","74.125.228.212","TCP","66","50094 > 443 [ACK] Seq=1541 Ack=87930 Win=118624 Len=0 TSval=151826906 TSecr=2664013421"
"203","4.619460000","74.125.228.212","192.168.1.138","TLSv1.2","1484","Application Data"
"204","4.619464000","74.125.228.212","192.168.1.138","TLSv1.2","1484","Application Data"
"205","4.619466000","74.125.228.212","192.168.1.138","TLSv1.2","1484","Application Data"
"206","4.619503000","74.125.228.212","192.168.1.138","TLSv1.2","1484","Application Data"
"207","4.619505000","74.125.228.212","192.168.1.138","TLSv1.2","1484","Application Data"
"208","4.619520000","192.168.1.138","74.125.228.212","TCP","66","[TCP Window Update] 50094 > 443 [ACK] Seq=1541 Ack=87930 Win=131072 Len=0 TSval=151826907 TSecr=2664013421"
"209","4.619521000","192.168.1.138","74.125.228.212","TCP","66","50094 > 443 [ACK] Seq=1541 Ack=89348 Win=129632 Len=0 TSval=151826907 TSecr=2664013421"
"210","4.619521000","192.168.1.138","74.125.228.212","TCP","66","50094 > 443 [ACK] Seq=1541 Ack=90766 Win=128224 Len=0 TSval=151826907 TSecr=2664013421"
"211","4.619521000","192.168.1.138","74.125.228.212","TCP","66","50094 > 443 [ACK] Seq=1541 Ack=92184 Win=126816 Len=0 TSval=151826907 TSecr=2664013421"
"212","4.619537000","192.168.1.138","74.125.228.212","TCP","66","50094 > 443 [ACK] Seq=1541 Ack=93602 Win=125376 Len=0 TSval=151826907 TSecr=2664013421"
"213","4.619537000","192.168.1.138","74.125.228.212","TCP","66","50094 > 443 [ACK] Seq=1541 Ack=95020 Win=123968 Len=0 TSval=151826907 TSecr=2664013421"
"214","4.619596000","74.125.228.212","192.168.1.138","TLSv1.2","1484","Application Data"
"215","4.619600000","74.125.228.212","192.168.1.138","TLSv1.2","1484","Application Data"
"216","4.619602000","74.125.228.212","192.168.1.138","TLSv1.2","1484","Application Data"
"217","4.619646000","74.125.228.212","192.168.1.138","TLSv1.2","1484","Application Data"
"218","4.619649000","74.125.228.212","192.168.1.138","TLSv1.2","1107","Application Data"
"219","4.619651000","74.125.228.212","192.168.1.138","TLSv1.2","112","Application Data"
"220","4.619683000","192.168.1.138","74.125.228.212","TCP","66","[TCP Window Update] 50094 > 443 [ACK] Seq=1541 Ack=95020 Win=131072 Len=0 TSval=151826907 TSecr=2664013421"
"221","4.619684000","192.168.1.138","74.125.228.212","TCP","66","50094 > 443 [ACK] Seq=1541 Ack=96438 Win=129632 Len=0 TSval=151826907 TSecr=2664013421"
"222","4.619684000","192.168.1.138","74.125.228.212","TCP","66","50094 > 443 [ACK] Seq=1541 Ack=97856 Win=128224 Len=0 TSval=151826907 TSecr=2664013421"
"223","4.619684000","192.168.1.138","74.125.228.212","TCP","66","50094 > 443 [ACK] Seq=1541 Ack=100692 Win=125376 Len=0 TSval=151826907 TSecr=2664013421"
"224","4.619684000","192.168.1.138","74.125.228.212","TCP","66","50094 > 443 [ACK] Seq=1541 Ack=101733 Win=124352 Len=0 TSval=151826907 TSecr=2664013421"
"225","4.619702000","192.168.1.138","74.125.228.212","TCP","66","50094 > 443 [ACK] Seq=1541 Ack=101779 Win=124288 Len=0 TSval=151826907 TSecr=2664013421"
"226","4.621112000","192.168.1.138","74.125.228.212","TCP","66","[TCP Window Update] 50094 > 443 [ACK] Seq=1541 Ack=101779 Win=131072 Len=0 TSval=151826908 TSecr=2664013421"
"228","4.623555000","192.168.1.138","74.125.228.212","TLSv1.2","112","Application Data"
"229","4.623587000","192.168.1.138","74.125.228.212","TLSv1.2","112","Application Data"
"231","4.644377000","74.125.228.212","192.168.1.138","TCP","66","443 > 50094 [ACK] Seq=101779 Ack=1633 Win=46848 Len=0 TSval=2664013448 TSecr=151826910"
"237","4.675052000","192.168.1.138","74.125.226.79","TCP","78","50095 > 443 [SYN] Seq=0 Win=65535 Len=0 MSS=1460 WS=32 TSval=151826959 TSecr=0 SACK_PERM=1"
"238","4.701160000","74.125.226.79","192.168.1.138","TCP","74","443 > 50095 [SYN, ACK] Seq=0 Ack=1 Win=42540 Len=0 MSS=1430 SACK_PERM=1 TSval=2319425284 TSecr=151826959 WS=128"
"239","4.701238000","192.168.1.138","74.125.226.79","TCP","66","50095 > 443 [ACK] Seq=1 Ack=1 Win=131872 Len=0 TSval=151826985 TSecr=2319425284"
"240","4.701389000","192.168.1.138","74.125.226.79","TLSv1.2","278","Client Hello"
"241","4.727152000","74.125.226.79","192.168.1.138","TCP","66","443 > 50095 [ACK] Seq=1 Ack=213 Win=43648 Len=0 TSval=2319425310 TSecr=151826985"
"242","4.727875000","74.125.226.79","192.168.1.138","TLSv1.2","1484","Server Hello"
"243","4.728492000","74.125.226.79","192.168.1.138","TCP","1484","[TCP segment of a reassembled PDU]"
"244","4.728497000","74.125.226.79","192.168.1.138","TCP","1326","[TCP segment of a reassembled PDU]"
"245","4.728499000","74.125.226.79","192.168.1.138","TLSv1.2","503","Certificate"
"246","4.728559000","192.168.1.138","74.125.226.79","TCP","66","50095 > 443 [ACK] Seq=213 Ack=2837 Win=129632 Len=0 TSval=151827012 TSecr=2319425310"
"247","4.728559000","192.168.1.138","74.125.226.79","TCP","66","50095 > 443 [ACK] Seq=213 Ack=4097 Win=129792 Len=0 TSval=151827012 TSecr=2319425310"
"248","4.728601000","192.168.1.138","74.125.226.79","TCP","66","50095 > 443 [ACK] Seq=213 Ack=4534 Win=130624 Len=0 TSval=151827012 TSecr=2319425310"
"249","4.730533000","192.168.1.138","74.125.226.79","TLSv1.2","357","Client Key Exchange, Change Cipher Spec, Hello Request, Hello Request, Hello Request, Hello Request"
"250","4.732896000","192.168.1.138","74.125.226.79","TLSv1.2","119","Application Data"
"251","4.732953000","192.168.1.138","74.125.226.79","TLSv1.2","116","Application Data"
"252","4.732954000","192.168.1.138","74.125.226.79","TLSv1.2","108","Application Data"
"253","4.733156000","192.168.1.138","74.125.226.79","TLSv1.2","315","Application Data"
"255","4.757671000","74.125.226.79","192.168.1.138","TLSv1.2","360","New Session Ticket, Change Cipher Spec, Hello Request, Hello Request"
"256","4.757798000","192.168.1.138","74.125.226.79","TCP","66","50095 > 443 [ACK] Seq=898 Ack=4828 Win=130752 Len=0 TSval=151827039 TSecr=2319425340"
"257","4.758068000","74.125.226.79","192.168.1.138","TLSv1.2","122","Application Data"
"258","4.758073000","74.125.226.79","192.168.1.138","TLSv1.2","108","Application Data"
"259","4.758138000","192.168.1.138","74.125.226.79","TCP","66","50095 > 443 [ACK] Seq=898 Ack=4884 Win=131008 Len=0 TSval=151827039 TSecr=2319425340"
"260","4.758139000","192.168.1.138","74.125.226.79","TCP","66","50095 > 443 [ACK] Seq=898 Ack=4926 Win=130944 Len=0 TSval=151827039 TSecr=2319425340"
"261","4.758237000","192.168.1.138","74.125.226.79","TLSv1.2","104","Application Data"
"262","4.759149000","74.125.226.79","192.168.1.138","TCP","66","443 > 50095 [ACK] Seq=4926 Ack=898 Win=45824 Len=0 TSval=2319425342 TSecr=151827015"
"263","4.759593000","74.125.226.79","192.168.1.138","TLSv1.2","104","Application Data"
"264","4.759633000","192.168.1.138","74.125.226.79","TCP","66","50095 > 443 [ACK] Seq=936 Ack=4964 Win=131008 Len=0 TSval=151827040 TSecr=2319425342"
"265","4.762376000","74.125.226.79","192.168.1.138","TLSv1.2","337","Application Data"
"266","4.762465000","192.168.1.138","74.125.226.79","TCP","66","50095 > 443 [ACK] Seq=936 Ack=5235 Win=130784 Len=0 TSval=151827043 TSecr=2319425343"
"267","4.762714000","74.125.226.79","192.168.1.138","TLSv1.2","1484","Application Data"
"268","4.762720000","74.125.226.79","192.168.1.138","TLSv1.2","1484","Application Data"
"269","4.762721000","74.125.226.79","192.168.1.138","TLSv1.2","1484","Application Data"
"270","4.762757000","74.125.226.79","192.168.1.138","TLSv1.2","1484","Application Data"
"271","4.762779000","192.168.1.138","74.125.226.79","TCP","66","50095 > 443 [ACK] Seq=936 Ack=6653 Win=129632 Len=0 TSval=151827043 TSecr=2319425343"
"272","4.762779000","192.168.1.138","74.125.226.79","TCP","66","50095 > 443 [ACK] Seq=936 Ack=8071 Win=128224 Len=0 TSval=151827043 TSecr=2319425343"
"273","4.762793000","192.168.1.138","74.125.226.79","TCP","66","50095 > 443 [ACK] Seq=936 Ack=10907 Win=125376 Len=0 TSval=151827043 TSecr=2319425343"
"274","4.763371000","74.125.226.79","192.168.1.138","TLSv1.2","1484","Application Data"
"275","4.763376000","74.125.226.79","192.168.1.138","TLSv1.2","1215","Application Data"
"276","4.763378000","74.125.226.79","192.168.1.138","TLSv1.2","112","Application Data"
"277","4.763417000","192.168.1.138","74.125.226.79","TCP","66","50095 > 443 [ACK] Seq=936 Ack=12325 Win=123968 Len=0 TSval=151827043 TSecr=2319425343"
"278","4.763425000","192.168.1.138","74.125.226.79","TCP","66","50095 > 443 [ACK] Seq=936 Ack=13474 Win=122816 Len=0 TSval=151827044 TSecr=2319425343"
"279","4.763440000","192.168.1.138","74.125.226.79","TCP","66","50095 > 443 [ACK] Seq=936 Ack=13520 Win=122784 Len=0 TSval=151827044 TSecr=2319425343"
"280","4.763546000","192.168.1.138","74.125.226.79","TCP","66","[TCP Window Update] 50095 > 443 [ACK] Seq=936 Ack=13520 Win=131072 Len=0 TSval=151827044 TSecr=2319425343"
"281","4.764061000","192.168.1.138","74.125.226.79","TLSv1.2","112","Application Data"
"317","4.774393000","192.168.1.138","74.125.228.212","TCP","78","50096 > 443 [SYN] Seq=0 Win=65535 Len=0 MSS=1460 WS=32 TSval=151827054 TSecr=0 SACK_PERM=1"
"339","4.795083000","74.125.226.79","192.168.1.138","TCP","66","443 > 50095 [ACK] Seq=13520 Ack=982 Win=45824 Len=0 TSval=2319425375 TSecr=151827039"
"351","4.795949000","74.125.228.212","192.168.1.138","TCP","74","443 > 50096 [SYN, ACK] Seq=0 Ack=1 Win=42540 Len=0 MSS=1430 SACK_PERM=1 TSval=2664013599 TSecr=151827054 WS=128"
"352","4.796002000","192.168.1.138","74.125.228.212","TCP","66","50096 > 443 [ACK] Seq=1 Ack=1 Win=131872 Len=0 TSval=151827074 TSecr=2664013599"
"371","4.797756000","192.168.1.138","74.125.228.212","TLSv1.2","273","Client Hello"
"444","4.819226000","74.125.228.212","192.168.1.138","TCP","66","443 > 50096 [ACK] Seq=1 Ack=208 Win=43648 Len=0 TSval=2664013622 TSecr=151827076"
"445","4.820484000","74.125.228.212","192.168.1.138","TLSv1.2","1484","Server Hello"
"446","4.821060000","74.125.228.212","192.168.1.138","TCP","1484","[TCP segment of a reassembled PDU]"
"448","4.821066000","74.125.228.212","192.168.1.138","TLSv1.2","1326","Certificate"
"449","4.821068000","74.125.228.212","192.168.1.138","TLSv1.2","91","Server Key Exchange"
"450","4.821123000","192.168.1.138","74.125.228.212","TCP","66","50096 > 443 [ACK] Seq=208 Ack=2837 Win=129632 Len=0 TSval=151827098 TSecr=2664013624"
"451","4.821168000","192.168.1.138","74.125.228.212","TCP","66","50096 > 443 [ACK] Seq=208 Ack=4097 Win=129792 Len=0 TSval=151827098 TSecr=2664013624"
"452","4.821169000","192.168.1.138","74.125.228.212","TCP","66","50096 > 443 [ACK] Seq=208 Ack=4122 Win=129760 Len=0 TSval=151827098 TSecr=2664013624"
"453","4.822276000","192.168.1.138","74.125.228.212","TLSv1.2","192","Client Key Exchange, Change Cipher Spec, Hello Request, Hello Request"
"488","4.832607000","192.168.1.138","74.125.228.212","TLSv1.2","119","Application Data"
"489","4.832736000","192.168.1.138","74.125.228.212","TLSv1.2","116","Application Data"
"490","4.832737000","192.168.1.138","74.125.228.212","TLSv1.2","108","Application Data"
"510","4.843152000","74.125.228.212","192.168.1.138","TLSv1.2","312","New Session Ticket, Change Cipher Spec, Hello Request, Hello Request"
"511","4.843227000","192.168.1.138","74.125.228.212","TCP","66","50096 > 443 [ACK] Seq=479 Ack=4368 Win=130816 Len=0 TSval=151827118 TSecr=2664013646"
"512","4.843557000","74.125.228.212","192.168.1.138","TLSv1.2","122","Application Data"
"513","4.843559000","74.125.228.212","192.168.1.138","TLSv1.2","108","Application Data"
"514","4.843596000","192.168.1.138","74.125.228.212","TCP","66","50096 > 443 [ACK] Seq=479 Ack=4424 Win=131008 Len=0 TSval=151827118 TSecr=2664013646"
"515","4.843597000","192.168.1.138","74.125.228.212","TCP","66","50096 > 443 [ACK] Seq=479 Ack=4466 Win=130944 Len=0 TSval=151827118 TSecr=2664013646"
"516","4.843692000","192.168.1.138","74.125.228.212","TLSv1.2","104","Application Data"
"530","4.854120000","74.125.228.212","192.168.1.138","TCP","66","443 > 50096 [ACK] Seq=4466 Ack=479 Win=43648 Len=0 TSval=2664013657 TSecr=151827108"
"531","4.854157000","74.125.228.212","192.168.1.138","TLSv1.2","104","Application Data"
"532","4.854191000","192.168.1.138","74.125.228.212","TCP","66","50096 > 443 [ACK] Seq=517 Ack=4504 Win=131008 Len=0 TSval=151827128 TSecr=2664013657"
"611","4.907083000","74.125.228.212","192.168.1.138","TCP","66","443 > 50096 [ACK] Seq=4504 Ack=517 Win=43648 Len=0 TSval=2664013708 TSecr=151827118"
"676","5.040353000","192.168.1.138","74.125.226.79","TLSv1.2","237","Application Data"
"679","5.068828000","74.125.226.79","192.168.1.138","TLSv1.2","243","Application Data"
"680","5.068950000","192.168.1.138","74.125.226.79","TCP","66","50095 > 443 [ACK] Seq=1153 Ack=13697 Win=130880 Len=0 TSval=151827340 TSecr=2319425649"
"681","5.069798000","74.125.226.79","192.168.1.138","TLSv1.2","1484","Application Data"
"682","5.069858000","192.168.1.138","74.125.226.79","TCP","66","50095 > 443 [ACK] Seq=1153 Ack=15115 Win=129632 Len=0 TSval=151827340 TSecr=2319425649"
"683","5.070272000","74.125.226.79","192.168.1.138","TLSv1.2","1484","Application Data"
"684","5.070278000","74.125.226.79","192.168.1.138","TLSv1.2","1484","Application Data"
"685","5.070313000","192.168.1.138","74.125.226.79","TCP","66","50095 > 443 [ACK] Seq=1153 Ack=16533 Win=129632 Len=0 TSval=151827341 TSecr=2319425649"
"686","5.070321000","192.168.1.138","74.125.226.79","TCP","66","50095 > 443 [ACK] Seq=1153 Ack=17951 Win=129632 Len=0 TSval=151827341 TSecr=2319425649"
"687","5.071252000","74.125.226.79","192.168.1.138","TLSv1.2","1484","Application Data"
"688","5.071290000","192.168.1.138","74.125.226.79","TCP","66","50095 > 443 [ACK] Seq=1153 Ack=19369 Win=129632 Len=0 TSval=151827342 TSecr=2319425649"
"689","5.071867000","74.125.226.79","192.168.1.138","TLSv1.2","1484","Application Data"
"690","5.071870000","74.125.226.79","192.168.1.138","TLSv1.2","1484","Application Data"
"691","5.071905000","74.125.226.79","192.168.1.138","TLSv1.2","1484","Application Data"
"692","5.071914000","192.168.1.138","74.125.226.79","TCP","66","50095 > 443 [ACK] Seq=1153 Ack=20787 Win=129632 Len=0 TSval=151827342 TSecr=2319425649"
"693","5.071934000","192.168.1.138","74.125.226.79","TCP","66","50095 > 443 [ACK] Seq=1153 Ack=22205 Win=128224 Len=0 TSval=151827342 TSecr=2319425649"
"694","5.071934000","192.168.1.138","74.125.226.79","TCP","66","[TCP Window Update] 50095 > 443 [ACK] Seq=1153 Ack=22205 Win=131072 Len=0 TSval=151827342 TSecr=2319425649"
"695","5.071943000","192.168.1.138","74.125.226.79","TCP","66","50095 > 443 [ACK] Seq=1153 Ack=23623 Win=129632 Len=0 TSval=151827342 TSecr=2319425649"
"696","5.071997000","74.125.226.79","192.168.1.138","TLSv1.2","1484","Application Data"
"697","5.072000000","74.125.226.79","192.168.1.138","TLSv1.2","1484","Application Data"
"698","5.072001000","74.125.226.79","192.168.1.138","TLSv1.2","1484","Application Data"
"699","5.072040000","74.125.226.79","192.168.1.138","TLSv1.2","1484","Application Data"
"700","5.072042000","74.125.226.79","192.168.1.138","TLSv1.2","1484","Application Data"
"701","5.072079000","192.168.1.138","74.125.226.79","TCP","66","50095 > 443 [ACK] Seq=1153 Ack=25041 Win=129632 Len=0 TSval=151827342 TSecr=2319425649"
"702","5.072080000","192.168.1.138","74.125.226.79","TCP","66","50095 > 443 [ACK] Seq=1153 Ack=26459 Win=129632 Len=0 TSval=151827342 TSecr=2319425649"
"703","5.072080000","192.168.1.138","74.125.226.79","TCP","66","50095 > 443 [ACK] Seq=1153 Ack=27877 Win=128224 Len=0 TSval=151827342 TSecr=2319425649"
"704","5.072080000","192.168.1.138","74.125.226.79","TCP","66","50095 > 443 [ACK] Seq=1153 Ack=29295 Win=126816 Len=0 TSval=151827342 TSecr=2319425649"
"705","5.072080000","192.168.1.138","74.125.226.79","TCP","66","[TCP Window Update] 50095 > 443 [ACK] Seq=1153 Ack=29295 Win=131072 Len=0 TSval=151827342 TSecr=2319425649"
"706","5.072080000","192.168.1.138","74.125.226.79","TCP","66","50095 > 443 [ACK] Seq=1153 Ack=30713 Win=129632 Len=0 TSval=151827342 TSecr=2319425649"
"707","5.072655000","74.125.226.79","192.168.1.138","TLSv1.2","1484","Application Data"
"708","5.072659000","74.125.226.79","192.168.1.138","TLSv1.2","1484","Application Data"
"709","5.072693000","74.125.226.79","192.168.1.138","TLSv1.2","1484","Application Data"
"710","5.072737000","74.125.226.79","192.168.1.138","TLSv1.2","1484","Application Data"
"711","5.072741000","74.125.226.79","192.168.1.138","TLSv1.2","1484","Application Data"
"712","5.072778000","74.125.226.79","192.168.1.138","TLSv1.2","1484","Application Data"
"713","5.072820000","74.125.226.79","192.168.1.138","TLSv1.2","1484","Application Data"
"714","5.072825000","74.125.226.79","192.168.1.138","TLSv1.2","1484","Application Data"
"715","5.072860000","74.125.226.79","192.168.1.138","TLSv1.2","1484","Application Data"
"716","5.072901000","74.125.226.79","192.168.1.138","TLSv1.2","1484","Application Data"
"717","5.072905000","74.125.226.79","192.168.1.138","TLSv1.2","1484","Application Data"
"718","5.072948000","74.125.226.79","192.168.1.138","TLSv1.2","934","Application Data"
"719","5.072952000","74.125.226.79","192.168.1.138","TLSv1.2","1484","Application Data"
"720","5.072990000","74.125.226.79","192.168.1.138","TLSv1.2","1484","Application Data"
"721","5.073005000","192.168.1.138","74.125.226.79","TCP","66","50095 > 443 [ACK] Seq=1153 Ack=33549 Win=128224 Len=0 TSval=151827343 TSecr=2319425649"
"722","5.073006000","192.168.1.138","74.125.226.79","TCP","66","[TCP Window Update] 50095 > 443 [ACK] Seq=1153 Ack=33549 Win=131072 Len=0 TSval=151827343 TSecr=2319425649"
"723","5.073006000","192.168.1.138","74.125.226.79","TCP","66","50095 > 443 [ACK] Seq=1153 Ack=34967 Win=129632 Len=0 TSval=151827343 TSecr=2319425649"
"724","5.073006000","192.168.1.138","74.125.226.79","TCP","66","50095 > 443 [ACK] Seq=1153 Ack=36385 Win=129632 Len=0 TSval=151827343 TSecr=2319425649"
"725","5.073006000","192.168.1.138","74.125.226.79","TCP","66","50095 > 443 [ACK] Seq=1153 Ack=37803 Win=128224 Len=0 TSval=151827343 TSecr=2319425649"
"726","5.073006000","192.168.1.138","74.125.226.79","TCP","66","[TCP Window Update] 50095 > 443 [ACK] Seq=1153 Ack=37803 Win=131072 Len=0 TSval=151827343 TSecr=2319425649"
"727","5.073007000","192.168.1.138","74.125.226.79","TCP","66","50095 > 443 [ACK] Seq=1153 Ack=39221 Win=129632 Len=0 TSval=151827343 TSecr=2319425649"
"728","5.073007000","192.168.1.138","74.125.226.79","TCP","66","50095 > 443 [ACK] Seq=1153 Ack=40639 Win=129632 Len=0 TSval=151827343 TSecr=2319425649"
"729","5.073007000","192.168.1.138","74.125.226.79","TCP","66","50095 > 443 [ACK] Seq=1153 Ack=42057 Win=128224 Len=0 TSval=151827343 TSecr=2319425649"
"730","5.073007000","192.168.1.138","74.125.226.79","TCP","66","50095 > 443 [ACK] Seq=1153 Ack=43475 Win=126816 Len=0 TSval=151827343 TSecr=2319425649"
"731","5.073007000","192.168.1.138","74.125.226.79","TCP","66","[TCP Window Update] 50095 > 443 [ACK] Seq=1153 Ack=43475 Win=131072 Len=0 TSval=151827343 TSecr=2319425649"
"732","5.073008000","192.168.1.138","74.125.226.79","TCP","66","50095 > 443 [ACK] Seq=1153 Ack=44893 Win=129632 Len=0 TSval=151827343 TSecr=2319425650"
"733","5.073008000","192.168.1.138","74.125.226.79","TCP","66","50095 > 443 [ACK] Seq=1153 Ack=46311 Win=128224 Len=0 TSval=151827343 TSecr=2319425650"
"734","5.073008000","192.168.1.138","74.125.226.79","TCP","66","[TCP Window Update] 50095 > 443 [ACK] Seq=1153 Ack=46311 Win=131072 Len=0 TSval=151827343 TSecr=2319425650"
"735","5.073008000","192.168.1.138","74.125.226.79","TCP","66","50095 > 443 [ACK] Seq=1153 Ack=47179 Win=130176 Len=0 TSval=151827343 TSecr=2319425650"
"736","5.073008000","192.168.1.138","74.125.226.79","TCP","66","50095 > 443 [ACK] Seq=1153 Ack=48597 Win=128768 Len=0 TSval=151827343 TSecr=2319425650"
"737","5.073051000","192.168.1.138","74.125.226.79","TCP","66","50095 > 443 [ACK] Seq=1153 Ack=50015 Win=131072 Len=0 TSval=151827343 TSecr=2319425650"
"738","5.073720000","74.125.226.79","192.168.1.138","TLSv1.2","1484","Application Data"
"739","5.073724000","74.125.226.79","192.168.1.138","TLSv1.2","1484","Application Data"
"740","5.073762000","74.125.226.79","192.168.1.138","TLSv1.2","1484","Application Data"
"741","5.073764000","74.125.226.79","192.168.1.138","TLSv1.2","1484","Application Data"
"742","5.073772000","192.168.1.138","74.125.226.79","TCP","66","50095 > 443 [ACK] Seq=1153 Ack=51433 Win=129632 Len=0 TSval=151827344 TSecr=2319425650"
"743","5.073773000","192.168.1.138","74.125.226.79","TCP","66","50095 > 443 [ACK] Seq=1153 Ack=52851 Win=128224 Len=0 TSval=151827344 TSecr=2319425650"
"744","5.073783000","192.168.1.138","74.125.226.79","TCP","66","50095 > 443 [ACK] Seq=1153 Ack=54269 Win=126816 Len=0 TSval=151827344 TSecr=2319425650"
"745","5.073787000","192.168.1.138","74.125.226.79","TCP","66","50095 > 443 [ACK] Seq=1153 Ack=55687 Win=125376 Len=0 TSval=151827344 TSecr=2319425650"
"746","5.073841000","74.125.226.79","192.168.1.138","TLSv1.2","1484","Application Data"
"747","5.073872000","192.168.1.138","74.125.226.79","TCP","66","50095 > 443 [ACK] Seq=1153 Ack=57105 Win=123968 Len=0 TSval=151827344 TSecr=2319425650"
"748","5.073995000","192.168.1.138","74.125.226.79","TCP","66","[TCP Window Update] 50095 > 443 [ACK] Seq=1153 Ack=57105 Win=131072 Len=0 TSval=151827344 TSecr=2319425650"
"749","5.094680000","74.125.226.79","192.168.1.138","TLSv1.2","1484","Application Data"
"750","5.094959000","74.125.226.79","192.168.1.138","TLSv1.2","1484","Application Data"
"751","5.095059000","192.168.1.138","74.125.226.79","TCP","66","50095 > 443 [ACK] Seq=1153 Ack=59941 Win=129632 Len=0 TSval=151827364 TSecr=2319425677"
"752","5.097021000","74.125.226.79","192.168.1.138","TLSv1.2","1484","Application Data"
"753","5.097136000","192.168.1.138","74.125.226.79","TCP","66","50095 > 443 [ACK] Seq=1153 Ack=61359 Win=131072 Len=0 TSval=151827366 TSecr=2319425680"
"754","5.097489000","74.125.226.79","192.168.1.138","TLSv1.2","1484","Application Data"
"755","5.098065000","74.125.226.79","192.168.1.138","TLSv1.2","1076","Application Data, Application Data"
"756","5.098113000","192.168.1.138","74.125.226.79","TCP","66","50095 > 443 [ACK] Seq=1153 Ack=63787 Win=130048 Len=0 TSval=151827367 TSecr=2319425680"
"757","5.099108000","192.168.1.138","74.125.226.79","TLSv1.2","112","Application Data"
"760","5.150800000","192.168.1.138","74.125.226.70","TCP","78","50097 > 443 [SYN] Seq=0 Win=65535 Len=0 MSS=1460 WS=32 TSval=151827418 TSecr=0 SACK_PERM=1"
"761","5.164311000","74.125.226.79","192.168.1.138","TCP","66","443 > 50095 [ACK] Seq=63787 Ack=1199 Win=46848 Len=0 TSval=2319425747 TSecr=151827367"
"762","5.177213000","74.125.226.70","192.168.1.138","TCP","74","443 > 50097 [SYN, ACK] Seq=0 Ack=1 Win=42540 Len=0 MSS=1430 SACK_PERM=1 TSval=2313338681 TSecr=151827418 WS=128"
"763","5.177330000","192.168.1.138","74.125.226.70","TCP","66","50097 > 443 [ACK] Seq=1 Ack=1 Win=131872 Len=0 TSval=151827443 TSecr=2313338681"
"764","5.177639000","192.168.1.138","74.125.226.70","TLSv1.2","278","Client Hello"
"765","5.203993000","74.125.226.70","192.168.1.138","TCP","66","443 > 50097 [ACK] Seq=1 Ack=213 Win=43648 Len=0 TSval=2313338707 TSecr=151827443"
"766","5.204509000","74.125.226.70","192.168.1.138","TLSv1.2","1484","Server Hello"
"767","5.204516000","74.125.226.70","192.168.1.138","TCP","1484","[TCP segment of a reassembled PDU]"
"768","5.204518000","74.125.226.70","192.168.1.138","TCP","1326","[TCP segment of a reassembled PDU]"
"769","5.204611000","192.168.1.138","74.125.226.70","TCP","66","50097 > 443 [ACK] Seq=213 Ack=2837 Win=129024 Len=0 TSval=151827469 TSecr=2313338707"
"770","5.204612000","192.168.1.138","74.125.226.70","TCP","66","50097 > 443 [ACK] Seq=213 Ack=4097 Win=127776 Len=0 TSval=151827469 TSecr=2313338707"
"771","5.204668000","192.168.1.138","74.125.226.70","TCP","66","[TCP Window Update] 50097 > 443 [ACK] Seq=213 Ack=4097 Win=131072 Len=0 TSval=151827469 TSecr=2313338707"
"772","5.205025000","74.125.226.70","192.168.1.138","TLSv1.2","503","Certificate"
"773","5.205123000","192.168.1.138","74.125.226.70","TCP","66","50097 > 443 [ACK] Seq=213 Ack=4534 Win=130624 Len=0 TSval=151827470 TSecr=2313338707"
"774","5.206768000","192.168.1.138","74.125.226.70","TLSv1.2","357","Client Key Exchange, Change Cipher Spec, Hello Request, Hello Request, Hello Request, Hello Request"
"775","5.209440000","192.168.1.138","74.125.226.70","TLSv1.2","119","Application Data"
"776","5.209440000","192.168.1.138","74.125.226.70","TLSv1.2","116","Application Data"
"777","5.209489000","192.168.1.138","74.125.226.70","TLSv1.2","108","Application Data"
"778","5.209643000","192.168.1.138","74.125.226.70","TLSv1.2","606","Application Data"
"779","5.236115000","74.125.226.70","192.168.1.138","TCP","66","443 > 50097 [ACK] Seq=4534 Ack=1189 Win=45824 Len=0 TSval=2313338740 TSecr=151827471"
"780","5.240418000","74.125.226.70","192.168.1.138","TLSv1.2","360","New Session Ticket, Change Cipher Spec, Hello Request, Hello Request"
"781","5.240578000","192.168.1.138","74.125.226.70","TCP","66","50097 > 443 [ACK] Seq=1189 Ack=4828 Win=130752 Len=0 TSval=151827503 TSecr=2313338744"
"782","5.240759000","74.125.226.70","192.168.1.138","TLSv1.2","122","Application Data"
"783","5.240770000","74.125.226.70","192.168.1.138","TLSv1.2","108","Application Data"
"784","5.240868000","192.168.1.138","74.125.226.70","TCP","66","50097 > 443 [ACK] Seq=1189 Ack=4884 Win=131008 Len=0 TSval=151827503 TSecr=2313338744"
"785","5.240868000","192.168.1.138","74.125.226.70","TCP","66","50097 > 443 [ACK] Seq=1189 Ack=4926 Win=130944 Len=0 TSval=151827503 TSecr=2313338744"
"786","5.241048000","192.168.1.138","74.125.226.70","TLSv1.2","104","Application Data"
"787","5.253347000","74.125.226.70","192.168.1.138","TLSv1.2","104","Application Data"
"788","5.253434000","192.168.1.138","74.125.226.70","TCP","66","50097 > 443 [ACK] Seq=1227 Ack=4964 Win=131008 Len=0 TSval=151827515 TSecr=2313338758"
"789","5.254089000","74.125.226.70","192.168.1.138","TLSv1.2","364","Application Data"
"790","5.254176000","192.168.1.138","74.125.226.70","TCP","66","50097 > 443 [ACK] Seq=1227 Ack=5262 Win=130752 Len=0 TSval=151827515 TSecr=2313338758"
"791","5.254841000","74.125.226.70","192.168.1.138","TLSv1.2","1484","Application Data"
"792","5.254846000","74.125.226.70","192.168.1.138","TLSv1.2","1484","Application Data"
"793","5.254886000","74.125.226.70","192.168.1.138","TLSv1.2","1484","Application Data"
"794","5.254889000","74.125.226.70","192.168.1.138","TLSv1.2","1484","Application Data"
"795","5.254929000","74.125.226.70","192.168.1.138","TLSv1.2","1484","Application Data"
"796","5.254930000","74.125.226.70","192.168.1.138","TLSv1.2","1484","Application Data"
"797","5.254976000","192.168.1.138","74.125.226.70","TCP","66","50097 > 443 [ACK] Seq=1227 Ack=6680 Win=129632 Len=0 TSval=151827516 TSecr=2313338758"
"798","5.254977000","192.168.1.138","74.125.226.70","TCP","66","50097 > 443 [ACK] Seq=1227 Ack=8098 Win=128224 Len=0 TSval=151827516 TSecr=2313338758"
"799","5.254977000","192.168.1.138","74.125.226.70","TCP","66","50097 > 443 [ACK] Seq=1227 Ack=10934 Win=125376 Len=0 TSval=151827516 TSecr=2313338758"
"800","5.254977000","192.168.1.138","74.125.226.70","TCP","66","50097 > 443 [ACK] Seq=1227 Ack=12352 Win=123968 Len=0 TSval=151827516 TSecr=2313338758"
"801","5.254977000","192.168.1.138","74.125.226.70","TCP","66","50097 > 443 [ACK] Seq=1227 Ack=13770 Win=122560 Len=0 TSval=151827516 TSecr=2313338758"
"802","5.255274000","192.168.1.138","74.125.226.70","TCP","66","[TCP Window Update] 50097 > 443 [ACK] Seq=1227 Ack=13770 Win=131072 Len=0 TSval=151827516 TSecr=2313338758"
"803","5.255631000","74.125.226.70","192.168.1.138","TLSv1.2","1484","Application Data"
"804","5.255634000","74.125.226.70","192.168.1.138","TLSv1.2","1484","Application Data"
"805","5.255668000","74.125.226.70","192.168.1.138","TLSv1.2","1484","Application Data"
"806","5.255669000","74.125.226.70","192.168.1.138","TLSv1.2","1484","Application Data"
"807","5.255710000","74.125.226.70","192.168.1.138","TLSv1.2","1484","Application Data"
"808","5.255712000","74.125.226.70","192.168.1.138","TLSv1.2","1484","Application Data"
"809","5.255721000","192.168.1.138","74.125.226.70","TCP","66","50097 > 443 [ACK] Seq=1227 Ack=16606 Win=128224 Len=0 TSval=151827516 TSecr=2313338758"
"810","5.255721000","192.168.1.138","74.125.226.70","TCP","66","50097 > 443 [ACK] Seq=1227 Ack=19442 Win=125376 Len=0 TSval=151827516 TSecr=2313338758"
"811","5.255782000","74.125.226.70","192.168.1.138","TLSv1.2","1484","Application Data"
"812","5.255786000","74.125.226.70","192.168.1.138","TLSv1.2","1484","Application Data"
"813","5.255825000","74.125.226.70","192.168.1.138","TLSv1.2","1484","Application Data"
"814","5.255827000","74.125.226.70","192.168.1.138","TLSv1.2","1484","Application Data"
"815","5.255864000","74.125.226.70","192.168.1.138","TLSv1.2","1484","Application Data"
"816","5.255875000","192.168.1.138","74.125.226.70","TCP","66","50097 > 443 [ACK] Seq=1227 Ack=20860 Win=123968 Len=0 TSval=151827516 TSecr=2313338758"
"817","5.255875000","192.168.1.138","74.125.226.70","TCP","66","[TCP Window Update] 50097 > 443 [ACK] Seq=1227 Ack=20860 Win=131072 Len=0 TSval=151827516 TSecr=2313338758"
"818","5.255875000","192.168.1.138","74.125.226.70","TCP","66","50097 > 443 [ACK] Seq=1227 Ack=22278 Win=129632 Len=0 TSval=151827516 TSecr=2313338758"
"819","5.255875000","192.168.1.138","74.125.226.70","TCP","66","50097 > 443 [ACK] Seq=1227 Ack=23696 Win=128224 Len=0 TSval=151827516 TSecr=2313338758"
"820","5.255876000","192.168.1.138","74.125.226.70","TCP","66","50097 > 443 [ACK] Seq=1227 Ack=25114 Win=126816 Len=0 TSval=151827516 TSecr=2313338758"
"821","5.255876000","192.168.1.138","74.125.226.70","TCP","66","50097 > 443 [ACK] Seq=1227 Ack=26532 Win=125376 Len=0 TSval=151827516 TSecr=2313338758"
"822","5.255876000","192.168.1.138","74.125.226.70","TCP","66","50097 > 443 [ACK] Seq=1227 Ack=27950 Win=123968 Len=0 TSval=151827516 TSecr=2313338758"
"823","5.255895000","192.168.1.138","74.125.226.70","TCP","66","50097 > 443 [ACK] Seq=1227 Ack=29368 Win=122560 Len=0 TSval=151827517 TSecr=2313338758"
"824","5.255899000","192.168.1.138","74.125.226.70","TCP","66","[TCP Window Update] 50097 > 443 [ACK] Seq=1227 Ack=29368 Win=131072 Len=0 TSval=151827517 TSecr=2313338758"
"825","5.256529000","74.125.226.70","192.168.1.138","TLSv1.2","1484","Application Data"
"826","5.256533000","74.125.226.70","192.168.1.138","TLSv1.2","1484","Application Data"
"827","5.256564000","74.125.226.70","192.168.1.138","TLSv1.2","1484","Application Data"
"828","5.256565000","74.125.226.70","192.168.1.138","TLSv1.2","1484","Application Data"
"829","5.256595000","74.125.226.70","192.168.1.138","TLSv1.2","1484","Application Data"
"830","5.256605000","192.168.1.138","74.125.226.70","TCP","66","50097 > 443 [ACK] Seq=1227 Ack=30786 Win=129632 Len=0 TSval=151827517 TSecr=2313338758"
"831","5.256616000","192.168.1.138","74.125.226.70","TCP","66","50097 > 443 [ACK] Seq=1227 Ack=32204 Win=128224 Len=0 TSval=151827517 TSecr=2313338758"
"832","5.256624000","192.168.1.138","74.125.226.70","TCP","66","50097 > 443 [ACK] Seq=1227 Ack=33622 Win=126816 Len=0 TSval=151827517 TSecr=2313338758"
"833","5.256629000","192.168.1.138","74.125.226.70","TCP","66","[TCP Window Update] 50097 > 443 [ACK] Seq=1227 Ack=33622 Win=131072 Len=0 TSval=151827517 TSecr=2313338758"
"834","5.256643000","192.168.1.138","74.125.226.70","TCP","66","50097 > 443 [ACK] Seq=1227 Ack=35040 Win=129632 Len=0 TSval=151827517 TSecr=2313338758"
"835","5.256698000","74.125.226.70","192.168.1.138","TLSv1.2","1484","Application Data"
"836","5.256701000","74.125.226.70","192.168.1.138","TLSv1.2","934","Application Data"
"837","5.256702000","74.125.226.70","192.168.1.138","TLSv1.2","1484","Application Data"
"838","5.256711000","192.168.1.138","74.125.226.70","TCP","66","50097 > 443 [ACK] Seq=1227 Ack=36458 Win=131072 Len=0 TSval=151827517 TSecr=2313338758"
"839","5.256729000","192.168.1.138","74.125.226.70","TCP","66","50097 > 443 [ACK] Seq=1227 Ack=37876 Win=129632 Len=0 TSval=151827517 TSecr=2313338758"
"840","5.256733000","192.168.1.138","74.125.226.70","TCP","66","50097 > 443 [ACK] Seq=1227 Ack=38744 Win=128768 Len=0 TSval=151827517 TSecr=2313338758"
"841","5.256748000","192.168.1.138","74.125.226.70","TCP","66","50097 > 443 [ACK] Seq=1227 Ack=40162 Win=127360 Len=0 TSval=151827517 TSecr=2313338758"
"842","5.256765000","192.168.1.138","74.125.226.70","TCP","66","[TCP Window Update] 50097 > 443 [ACK] Seq=1227 Ack=40162 Win=131072 Len=0 TSval=151827517 TSecr=2313338758"
"843","5.266172000","74.125.226.70","192.168.1.138","TLSv1.2","1484","Application Data"
"844","5.266592000","74.125.226.70","192.168.1.138","TLSv1.2","1484","Application Data"
"845","5.266599000","74.125.226.70","192.168.1.138","TLSv1.2","1484","Application Data"
"846","5.266647000","74.125.226.70","192.168.1.138","TLSv1.2","1484","Application Data"
"847","5.266679000","192.168.1.138","74.125.226.70","TCP","66","50097 > 443 [ACK] Seq=1227 Ack=42998 Win=129632 Len=0 TSval=151827527 TSecr=2313338770"
"848","5.266708000","192.168.1.138","74.125.226.70","TCP","66","50097 > 443 [ACK] Seq=1227 Ack=45834 Win=126816 Len=0 TSval=151827527 TSecr=2313338770"
"849","5.266709000","192.168.1.138","74.125.226.70","TCP","66","[TCP Window Update] 50097 > 443 [ACK] Seq=1227 Ack=45834 Win=131072 Len=0 TSval=151827527 TSecr=2313338770"
"850","5.267201000","74.125.226.70","192.168.1.138","TLSv1.2","1484","Application Data"
"851","5.267204000","74.125.226.70","192.168.1.138","TLSv1.2","1484","Application Data"
"852","5.267270000","192.168.1.138","74.125.226.70","TCP","66","50097 > 443 [ACK] Seq=1227 Ack=48670 Win=128224 Len=0 TSval=151827528 TSecr=2313338771"
"853","5.267270000","192.168.1.138","74.125.226.70","TCP","66","[TCP Window Update] 50097 > 443 [ACK] Seq=1227 Ack=48670 Win=131072 Len=0 TSval=151827528 TSecr=2313338771"
"854","5.279220000","74.125.226.70","192.168.1.138","TLSv1.2","1484","Application Data"
"855","5.279330000","192.168.1.138","74.125.226.70","TCP","66","50097 > 443 [ACK] Seq=1227 Ack=50088 Win=129632 Len=0 TSval=151827540 TSecr=2313338783"
"856","5.279655000","74.125.226.70","192.168.1.138","TLSv1.2","1484","Application Data"
"857","5.279659000","74.125.226.70","192.168.1.138","TLSv1.2","1484","Application Data"
"858","5.279660000","74.125.226.70","192.168.1.138","TLSv1.2","1484","Application Data"
"859","5.279731000","192.168.1.138","74.125.226.70","TCP","66","50097 > 443 [ACK] Seq=1227 Ack=52924 Win=128224 Len=0 TSval=151827540 TSecr=2313338783"
"860","5.279731000","192.168.1.138","74.125.226.70","TCP","66","[TCP Window Update] 50097 > 443 [ACK] Seq=1227 Ack=52924 Win=131072 Len=0 TSval=151827540 TSecr=2313338783"
"861","5.279768000","192.168.1.138","74.125.226.70","TCP","66","50097 > 443 [ACK] Seq=1227 Ack=54342 Win=131072 Len=0 TSval=151827540 TSecr=2313338783"
"862","5.280220000","74.125.226.70","192.168.1.138","TLSv1.2","985","Application Data, Application Data"
"863","5.280280000","192.168.1.138","74.125.226.70","TCP","66","50097 > 443 [ACK] Seq=1227 Ack=55261 Win=130144 Len=0 TSval=151827540 TSecr=2313338784"
"864","5.281012000","192.168.1.138","74.125.226.70","TLSv1.2","112","Application Data"
"865","5.345435000","74.125.226.70","192.168.1.138","TCP","66","443 > 50097 [ACK] Seq=55261 Ack=1273 Win=45824 Len=0 TSval=2313338850 TSecr=151827541"
"866","5.384094000","192.168.1.138","192.168.1.211","TCP","181","[TCP segment of a reassembled PDU]"
"867","5.386906000","192.168.1.211","192.168.1.138","TCP","99","[TCP segment of a reassembled PDU]"
"868","5.387013000","192.168.1.138","192.168.1.211","TCP","66","49657 > 8009 [ACK] Seq=231 Ack=178 Win=4094 Len=0 TSval=151827645 TSecr=4535799"
"869","5.387314000","192.168.1.211","192.168.1.138","TCP","177","[TCP segment of a reassembled PDU]"
"870","5.387376000","192.168.1.138","192.168.1.211","TCP","66","49657 > 8009 [ACK] Seq=231 Ack=289 Win=4092 Len=0 TSval=151827645 TSecr=4535799"
